用户名,评论时间,IP属地,评论分数,有用数量,短评内容
阿德,2024-09-28 18:14:22,云南,5星,16,这才是原汁原味的变形金刚电影，讲的也是起源篇，青年时代擎天柱和霸天虎兄弟反目的故事，完全无观影门槛，对非粉丝也很友好。
Lonely,2024-12-21 00:04:29,湖南,3星,2,7.0/10 分。2024.12.21，初看，蓝光。时长01:44:02。。。整体中上吧。个人不太喜欢动画版的变型金刚的面部设计，感觉脸部太尖，怪怪的，不如真人版的那么有质感。。。D-16到威震天的这种粉转黑的改变，恰恰是老实人的悲剧。因为过于相信人，在遭遇到了背叛后，又从一个极端走向了另一个极端。。。听出了雷神的配音，但没听出斯嘉丽的来。我还听出了史蒂夫·布西密的配音。独特的声音对于一个演员来说是很有加分项的。不过大部分人先看的是五官。呵呵。。。最后有一个小彩蛋。
Mr. Infamous,2024-09-22 23:06:46,北京,3星,17,确实能填补真人版留下的烂坑，何况还是一则我们熟悉的奴隶故事。从出生开始没日没夜地劳作，被pua，被三六九等，但为人做的嫁衣，全都穿到了世仇身上……其实一开始没想到那是威震天，但有一个瞬间我特别共情他，就是当那个让自己为奴的狗东西就在眼前，天王老子来挡也没用。很懂擎天柱是天选领导者，但在现世，对恶人过界的仁慈实在太过让人沮丧了，莫非好人还不够惨吗？原谅我的慈悲只够分给善者。于是结局的分道扬镳分得挺不是滋味，少了一开始内涵的推演。还是会想御天敌的名字，从“御·天敌”到“御天·敌”，有些恶徒，名字藏有太多奥义，且联动太多同义词。三星半。
思路乐,2024-09-28 22:00:26,福建,3星,11,【C+】更多还是感慨吧，也算是见证了这十几年变形金刚的IP演变过程：从视效技术引领时代的真人巨制一步步萎缩，最终走向以讨好最初核心粉丝的创作思路，美术风格与制作规模都是以此为基准。最终呈现的效果确实比真人版强了不少，但目标受众和时长篇幅依旧锁死了本片在“革命故事”上的更多可能，依旧是过分公式化的商业写作，但还是比真人版的低智公式好太多。只可惜质量还是无法承载更多期待，除了粉丝的狂欢之外，不再具备刺激路人为之消费的能力，这也是属于当下大部分曾经辉煌的商业IP的共同困境。
Kid Wang,2024-10-24 23:47:24,山西,5星,20,比真人版，好看多了。
Decadent,2024-09-27 22:52:16,辽宁,4星,21,变形金刚老粉已经很满意了。每次看这个IP都很投入也很振奋。哈哈哈原来严肃沉稳的大家（大黄蜂除外）以前都这么中二欢脱啊。不过威震天的黑化太突兀了。
joa旺旺,2024-10-01 21:09:15,黑龙江,5星,45,说一句国庆档最好看绝对不过分！求求了放假想进电影院的去看这个吧其他的都太烂了！！
JG,2024-12-21 20:04:29,上海,4星,21,为什么突然威震天就黑化了
玩儿少,2024-09-15 21:25:35,上海,4星,122,#上海杜比剧场 千人点映场#完整的世界观，精美的作画，合适的节奏，上乘质量的动画前传！还是爆炸贝亲自制片。题外话第一次来上海杜比剧场看，效果真绝了。
叉叉,2024-09-30 13:51:39,浙江,3星,13,真是cliche到不能更cliche的故事了。这什么Transformers: First Class. 连误伤好友离婚场景都一样，同一个群体因为理念不同而分裂内斗。不过老万可不想弄死教授，每次搞事只能算teasing，而威震天是真心想干掉擎天柱。大黄蜂太蠢萌了，声带受损前居然是个烦死人的超级话痨。寡姐的角色阿丽塔过于刻板印象兼工具人，粉色、女性、助攻，孩之宝如果卖action figure是不是还要收pink tax啊，无语。
Sebastian Hugo,2024-09-28 11:16:38,河南,5星,27,最好的变形金钢电影。   重新回到动画，而且第一次用长篇幅来描绘塞伯坦的社会风貌。        制作组终于找到了变形金刚这个ip最有趣的地方，就是融入了人权，权力，资源分配和程序正义的社会设定。   实际上tf最有趣的，就是tf们在来到地球前发生的历史。      军阀，工人，这些元素都能在电影里找到，就像近代史的重演，某些封建帝王为了统治稳定，就像御天敌拆除变形齿轮那样，剥夺民众的智慧和独立人格，让他们永远成为一颗螺丝钉。      不过tf这个ip真是过气了，与电影出色的质量相比，票房成绩肯定不会好。      可能起源即使一个新的开始，也是这个ip的结束吧。     迈克尔贝和网飞的tf已经透支了这个ip所有的口碑了。    另提一点，领导模块带来无尽能源这个设定会让续作很难写。
📽Anakin🏂💨,2024-12-20 21:02:29,广东,4星,2,起初因为形象变得比较简约卡通一直没想看，真是错过了好戏。具体到画面里汽车人动起来还是很帅嘛😭。兄弟反目的戏码对我永远都是那么管用呢。
小胡,2024-10-02 22:38:57,北京,5星,40,虽然威震天黑化的生硬又奇怪，但比同期这些国产院线烂片不知好到哪去，能不能跟人家学学怎么好好讲故事
Joaquín C.,2024-09-15 16:16:03,北京,5星,22,@丰台万达杜比影院。实际上中规中矩，但我真的架不住杜比影院呈现的视听语言，动作场面酣畅淋漓，和最后第三幕的升华。真正的价值观输出，把“自由是与生俱来的权利”包装得精美无比。不知道现在小男孩和小女孩，把玩孩之宝变形机器人的时候，会想到变形核心和自由权利的这一层浅显的比喻吗。原来Autobot的auto是「自主」，而Decepticons是「反诈」。一切都太老美糖衣炮弹了，无法抗拒，被迫五星。对威震天非常有代入感，获得力量之后的沉迷，他的急躁、仇心、报复欲，简直都是我，好羞愧。
发条辰,2024-09-09 09:04:33,辽宁,3星,25,优质的起源故事，这次没有倒霉人类参与了，纯赛博坦故事。但作为单体电影还是有很多不太顺畅的地方，比如御天敌和威震天还有外星人塑造太扁了，女性角色工具化严重…造型方面几乎摒弃了迈克尔贝真人的机械感，全变成了人的实体化，面部细节和表情更像是人类（只是哭不出来），插科打诨的情节也多了不少，比起迈克尔贝严肃的擎天柱和御天敌显然更低幼化。但是高燃的地方也有不少，平行剪辑的威震天/擎天柱足够燃，“为了赛博坦”的宣言让我回到了小时候看变2的爽感。还是有太多像其它动画电影的感觉了，漫威乃至宇宙星神都有模仿。现场的小孩看嗨了，想想趁小时候看点这个也可以了，但是不如迈克尔贝📽️
обломов,2024-10-24 08:19:49,江苏,3星,3,伟光正领袖骗取全部人民信任，夺取他们自主思考能力，卖命为外来势力输送全部精力，老比登看了会不会气死
Xaviera,2024-09-26 08:33:29,北京,4星,7,非粉友好！CP好磕！
Hildy at beach,2024-09-28 12:23:17,上海,5星,17,都是套路故事，正因为是套路看起来熟悉毫无压力。人为等级分化，剥削压迫，谎言与背叛，忠诚与友情，都是这些惯常要素。擎天柱和威震天就像是宿命中的敌人一定要相遇而且还要先从朋友做起。D的坠落看似毫无理由其实盲信的人觉醒后很容易走向极端，尤其是掌握了巨大的力量以后。大黄蜂好可爱啊好贫啊昏迷的时候都不带停的，而且一点都不耽误打架。当擎天柱怀疑自己的时候，艾丽卡说我哪哪都比你强，但你心中有希望，你不守常规，大胆勇敢冒险。最欢乐的就是四个汽车人第一次变身，简直史诗级灾难现场。……这些翻译的名字真难区分。
方枪枪,2024-10-25 23:44:59,上海,4星,2,翻身农奴把歌唱，曾经兄弟变仇敌……
囍弗斯,2024-10-29 03:23:03,辽宁,3星,4,草根没有领导的死敌撑腰也是废。
petrouchka,2024-10-02 17:57:29,浙江,5星,6,我觉得，这也许是新时代一般路人入坑变形金刚系列的最好作品了。看的IMAX版，非常震撼，我之前没怎么了解过变形金刚（卖拷贝所有作品都没看过，只在小时候的电视上看过一些不明所以的3D变形金刚动画，根本不认识威震天和擎天柱）但这个电影却因此对我起到了最大的效果。本片剧本十分王道，完成度很高，也有幽默的部分，和漫威黄金时期的故事水平差不多。每个小伙伴的角色都十分鲜明而有趣，角色关系也富有张力（我预感每个人都会有很多同人，包括又好看又残忍又屑的反派）。作为动画的部分，演出特别优秀，剧情核心点的某些构图甚至有“残酷纯净的悲剧美”的效果。我是看到这一幕就决定给五星了，接下来要找机会二刷：）
陳顏,2024-09-27 21:16:59,上海,3星,11,擎天柱没有变形模块的时候，这辈子就在矿下做工，好不容易上到城市还要被鄙视，他究竟是为什么爱这个地方的？三星给还不错的动画制作，剧情推进简直比走马灯还快…我愿称之为御天敌的死亡回忆…
波希米亚,2025-01-14 13:54:45,北京,4星,0,正片不逗比，竟然是个正剧，哈哈哈，整得挺严肃的还
peeman,2024-12-26 23:07:13,河南,4星,2,相比于真人版一股子赛博风，色彩鲜艳的动画版在打斗方面更加的富有创意和华丽，还有不错的喜剧桥段，一段反目成仇的起源故事，不再那么的正邪分明。
无影不欢,2024-11-13 12:11:36,重庆,3星,9,即使是机器，也是人类的思想和形态，褪去外壳，故事平庸的一逼。
夜晚的语言,2024-10-26 11:08:45,上海,5星,4,全世界塞伯坦的矿工联合起来～
猫骨,2024-11-02 22:20:11,四川,3星,5,真爱粉变黑粉的可怕
Jorrow,2024-10-29 23:36:40,四川,4星,5,御天敌是不是太弱了
武侠小王子,2024-09-16 11:35:05,广东,4星,19,第一次在大银幕看动画版的变形⾦刚，满⾜了大人怀旧的情感需求，⼜能通过新颖的⽅式给孩⼦带来了充满想象⼒的体验，寓教于乐，算是一种动画传承了。看完感觉还是很爽的，贵在节奏快，在动作戏的视觉效果和节奏控制上表现出⾊，能牢牢抓住观众眼球。特别是变形场景和战⽃设计太炫酷了。同时电影很好地交代了擎天柱和威震天如何走向决裂，不仅限于简单的正邪对⽴，还传递了团结、勇⽓和正义的价值观， 这使得观影过程不仅仅是娱乐，更是潜移默化的教育。
人间指南杂编部,2024-09-27 22:02:16,湖北,4星,17,Transformers - More than meets the eye。 红蜘蛛，震荡波，声波等等老面孔全部回归，这才是真正能唤醒84版变形金刚第一部回忆的诚意之作。 再一次验证了在西方皿煮社会。作为领导者拥有一副好口才是必备条件。
千寻亿选,2024-10-07 20:18:43,上海,4星,2,变形金刚版x教授和万磁王相爱相杀，小黄蜂和威震天心理变化太快，五面怪的飞艇压迫感很强，仿佛又见沙丘。斯嘉丽配音黑寡妇，这很合理
大纠结师,2024-10-26 17:31:28,广东,3星,8,7.0讲好了一个故事，就是细节处理太漫威了，尤其是那些蠢到家的笑点
Indecent time,2024-10-04 11:41:57,福建,4星,7,本片又名《偶像塌房的严重后果》，去掉了人类戏份纯拍变形金刚以后，观感直线上升，主要角色都立体了很多，除了威震天转变有点生硬，擎天柱为球奸御天敌挡枪比较强行以外，整体流畅度都是变在大银幕上的最佳表现。
三岛,2024-10-04 11:08:40,北京,3星,1,@慈云寺杜比 dbq但看你们硅基生物做恨也挺带感的
第七大陸,2024-09-17 23:14:12,北京,4星,9,（变形金刚：领袖的倾覆变形金刚：我们都是领袖变形金刚：谁是更好的领袖）褒义上的故事有头有尾，甚至在讲故事的基础上给你非常强的政治思考，明显到你根本不会把它当做一个简单的无脑打来打去的电影，对于领袖（造神）情况的直指。撒尿和泥好兄弟反目成仇的感情线嵌套在一个非常成熟的仙侠小说三幕剧本之中，看得非常欢乐，类型化极好。
朝阳区妻夫木聪,2024-09-29 01:21:27,天津,3星,9,笑死，真没抱啥期待，一开始都不打算看的，结果因为逛街太无聊了，路过一家影院顺手一搜，看到刚好排了一场大厅，票价还只要30块不到，想说那就看看打发时间吧，还一不小心包了个场。说回片子，没想到还挺好看，至少真人变形金刚系列后面几部我已经没继续追了，但这部感觉比之前爆炸贝的那些都好看。政治隐喻的部分甚至都不是隐喻了，直接拿到台面上说了。“他一直都在骗我们，我从出生就活在谎言里！”妈呀，禁止过度联想哈。话痨大黄蜂还挺可爱的就是说，基友变敌蜜的剧情也能浅嗑一下吧。虽然也不是变形金刚系列的粉丝，小时候也没咋看过这个动画，但看完后至少弄清楚了原来擎天柱威震天大黄蜂这些角色的关系是啥样的了。另外，看一堆钢铁戚戚咔咔在一块变身也还是有点小燃的哈。
