用户名,评论时间,IP属地,评论分数,有用数量,短评内容
大人物,2024-09-16 01:08:02,河南,3星,73,达不到八点六分的，时间会证明，三星作品而已。
不良生,2024-09-17 21:02:14,江苏,3星,30,有一定电影叙事技巧，但几乎没有任何电影艺术美感。
明天就现充,2024-08-26 22:55:48,上海,3星,83,反转来反转去，最后把命运轮回因果报应这个主题加在可怜的女孩身上，就是为了烘托一下男主悲惨无助和反派罪大恶极，也是有点点被恶心到了
匡轶歌,2024-10-05 23:57:10,河南,4星,35,看到1小时43分的时候猜到了结尾。因为人物关系设置得这么对称，只能是这么结尾。唯一意外是警察这部分，一帮人居然在干人事儿、办实事儿，你信么？鬼才信。
Summer,2024-09-26 23:39:42,陕西,2星,155,非常反感这样的男性做坏事报应直接体现在妻女上的叙事，恶心
揽梦入星河,2024-09-29 21:58:42,陕西,5星,117,这女孩子被养的真好，她说的那些话，所有被伤害的人都应该看到。她只是受害者，没有任何错。
鲁大师-鲁提辖,2024-09-01 00:51:43,浙江,5星,80,我敢打赌，这部电影一定会被国内翻拍的！多次反转看爽了，诡计设计非常巧妙，因果报应也是相当切题。复仇男主大智若愚，看似猥琐奸诈的警察其实正义感爆棚，反派一号也有铁汉柔情，结尾诛心却令人拍案称绝。印度电影已经超越我们中国电影太多太多了！
一勺咩咩,2024-09-18 20:38:53,湖北,5星,61,别被陈思诚看见这电影！
发条晨🐾,2024-11-29 17:05:46,江西,5星,66,真nb  此时此刻  我在电影院震撼的呆住  就此时此刻
shininglove,2024-08-26 16:35:40,北京,2星,65,据悉，2024年印度只有7个中国留学生，而想翻拍的中国人可能高达七百。
丙酮,2024-09-08 02:28:15,河北,2星,130,吹得天花乱坠，实际看完后悔。在印度实习医生性侵案成为国际新闻时出现这么一部讲好父亲私刑处决侵害女儿的罪魁祸首以来歌颂父爱如山彰显父女情深的电影，真是天大的讽刺啊。另外译者自作聪明起的标题也可谓是夹带私货了，印度原标题就是男主名字，因果报应是什么？是指男人作恶种下因果，而他的妻女要么死于非命要么被强奸来承担报应吗？
张小亮,2024-12-22 17:37:08,山西,3星,30,叙事太土了，男的好喜欢两种叙事，老实下藏着可以为“老婆女儿”付出一切的能力和心，还有虽然我十恶不赦但爱“老婆女儿”，老婆女儿只是符号，想复仇想施虐不用找这么多理由，因果报应在女儿身上自己倒是跳楼死挺快。最后得知自己强奸自己女儿大哭后悔让我想到消失的她男主在监狱知道老婆死的时候怀孕了，爹挚爱的表述❤️
大奇特(Grinch),2024-08-23 19:09:25,北京,2星,74,故意剪乱时间线，导致脸盲分不清，若不是有一条线是“一只耳”，辨识度更大。
hhhhhhh,2024-11-28 23:34:51,湖南,2星,54,受害人是施暴人的女儿是什么转折爽点吗？不懂想要表达什么。。。
777tattoo,2024-09-27 14:43:40,江苏,2星,79,打五星没一个悬疑片爱好者吧，纯纯烂片，无意义的镜头、人物过多，别说什么别给陈思诚看见了，这部片子倒像是陈思诚拍的
