用户名,评论时间,IP属地,评论分数,有用数量,短评内容
大号煎饼,2024-07-13 18:27:10,北京,4星,10385,你不拍，我不拍，“华人文化”老外拍
东门捷径小V,2024-08-18 18:29:38,湖南,4星,6364,最最难过的一幕是上一分钟还在跟哥哥用共同的母语合唱，温存靠在他的肩头，下一分钟就狼狈地被赶出去，你永远不要再来了。即使年龄已经离死亡终局这么近了，手足亲情在遗产面前还是这么不堪一击。
Grace,2024-06-13 21:29:42,中国香港,4星,5618,說是孝道電影，我看出來是反孝電影。姥姥年輕時候給父母送終，房產給了大哥，大哥一舉成為富豪；有了子女後，大兒子只出錢不出力，小兒子要媽媽還債，只有女兒真心疼她，依然吃力不討好，經常吵架。女兒自己都調笑：財產給了兒子，癌症給了女兒。外孫子M確實是個好小伙，表面上照顧姥姥是為了遺產，但是兩個舅舅給錢他都拒絕了，姥姥給他存的錢他也用來買墳地。他是真正灑脫也為姥姥著想的人。但是M如果是女孩還有沒有這麼幸運呢？小梅倒是被爺爺公平對待，可是她的生活很快變成了給親戚送終的情感經濟學。一言以蔽之，真心應該留給真心對你的人。
ww5,2024-08-17 16:31:33,山西,4星,4567,感动是感动，但对比一下女儿的待遇心情就变得很复杂。真的不会担心女儿寒心吗？儿子继承财产，女儿继承癌症，连外孙都有成长基金，女儿什么都没有。
我劝告了风,2024-04-07 23:20:29,泰国,4星,4458,作为女性的观感其实不太轻松，女儿明明是最真心付出最多的但是最后却什么也没有。M说 you didn't learn from your lesson 是真的。自己因为父母的重男轻女而穷困最后在自己万年却仍旧选择把遗产给嗜赌成性的儿子，以及从小给孙子存下的基金。那么一直辛苦照顾不求回报的女儿呢？感人是感人的我最后还是哭了。男主角也非常帅我时时刻刻都在欣赏这颜值盛宴甚至想找男人了。在泰国看的第一部电影with Damian
希夫,2024-06-23 00:50:06,中国香港,2星,276,不喜歡這部電影，無論結局如何，當一開始要照顧外婆是從如何獲得利益回報爲考慮出發的時候，我就知道我無法跟這部電影共情。電影一開頭，外孫自顧自打遊戲讓外婆自己上墳頭最後摔下來的那一幕，我是無法接受的。電影里老奶奶演的很好，但即便如此我也無法多打一星。
阿巫门,2024-08-18 20:04:34,北京,4星,2434,儿子继承遗产，女儿继承癌症。
郁甘霖,2024-04-28 23:59:15,泰国,4星,2203,聚焦多个社会学火热议题(集体主义与个人主义，女性权益，伤痛的代际传递，尼特族，老年人赡养，临终关怀等)且具有高度复杂性的影片。已经是非常高水准的佳作。观于曼谷百丽宫。
Jinji,2024-05-31 23:38:07,新加坡,4星,1748,好典型的华人家庭，最年长的女性把一生奉献给家人，许愿时会保佑每一个子孙，珍藏住每一句孩子们小时候的童言。而我们是什么时候遗忘儿时信口胡说又发自内心的承诺呢，长大这点真不可爱。留了很多眼泪，因为没有机会照顾奶奶了。妈妈那句玩笑“儿子继承了财富，女儿继承了癌症。”也让人笑中带泪。坐在第一排，身后是此起彼伏的抽泣声。
momo,2024-06-02 02:58:20,马来西亚,5星,10407,果然只要是华人就有机率出现的经典家庭：不管儿子如何自私没有良心，妈妈永远偏袒的是儿子；不管女儿如何照顾，最多只会换来一句夸奖然后实实在在的遗产依旧没考虑到她。最恐怖的事是：妈妈也曾是自己家庭如此这般的受害者…我感动的点从来不是亲情，我承认或许和我的经历有关，但更直白的原因是从这个角度出发我根本感动不了一点。我感动的从来都是阿嬷本身：她面对化疗脱发带来的恐惧和悲伤，在夜晚被疼痛折磨时请求父母带她走的呢喃，和发现原来自己觉得唯一真心付出的外孙实际上和盯着她遗产的孩子没有差别的时候那种不动声色可是内心崩裂的失望….
D,2024-06-20 23:56:20,北京,5星,9338,婆婆就算没钱买墓地也没想过动给外孙的一百万💔
写真,2024-08-18 17:33:44,陕西,4星,1257,刻画得最好的是一个女人被婚姻、子女和爱蚕食的一生。
同志亦凡人中文站,2024-07-18 17:14:07,新西兰,4星,927,奔着钱去的亲情，最后收获了爱。总以为泰国华人跟我们价值观差不多，但如此功利心的养老送终感觉大多数国人都做不出来——也可能是电影故意戏剧化处理了。不过在重男轻女上才是遗毒深远半斤八两 :(。马群耀乃可别塌房，我还能再粉个五六七八年…
苹果克星,2024-08-17 18:39:20,北京,4星,686,我妈妈也是光头，她还剩最后一次化疗，我们都会努力！
Wuv-wuv,2024-04-07 00:50:02,泰国,4星,578,剧情其实比较俗套 但架不住男主的酒窝
林阿海,2024-08-17 21:07:42,上海,5星,8300,哭不是因為感動 而是照了鏡子
朝阳区妻夫木聪,2024-08-18 20:34:48,北京,4星,562,看完最大的感触反倒不是什么祖孙亲情，而是在想，人这一辈子，不管多么坚强独立，似乎都无法逃脱对于“陪伴”这件事的需求。尤其是当你老了之后，周围的一切人和事都在离你越来越远，你怎么也跟不上，但又没法要别人停下来等等你，这实在是太难受了。片子里让我哭的最厉害的是那句，姥姥说讨厌过完年之后的第二天，家里冷冷清清的，剩饭剩菜我一个人怎么吃呢？我就想起我妈好多时候跟我说的话，以及她需要面对的这一切，一旦代入后简直止不住。其实我不太算是个爷爷奶奶带大的孩子，对外婆的记忆也都很模糊了，但是这个片子还是勾起了我很多跟老人相处的回忆，甚至包括以前照顾过我的邻居奶奶的样子。它实在太东亚了，明明生气又不能不管，明明受伤又没法说疼，“儿子继承房子女儿继承癌症”，真的好窒息好讨厌好想逃，后劲实在太大了……
不买火柴,2024-09-03 17:38:36,湖北,2星,101,好恶心好恶心，一个被美化后代代相传吃女人的故事，心疼废物男宝和男宝妈才他爹是最大的癌症。妈妈全剧最惨，血是要吸的钱是没份的就tm连爱也是从男宝指缝下漏一点的，爱你就让你照顾我但是放心吧我的遗产只会留给亲亲废物儿子和早知根本不爱自己的孙子。。。呃呃爱男真的是种癌症七八九十期无药可救的那种。
王俊俊,2024-08-26 02:22:16,广东,5星,8049,敬观音的茶，要用壶烧开。给儿子祈福，不能吃牛肉。下摆的扣子，松开秀性感。全职的外孙，听不懂潮州话。出生给你种下的石榴。考试第一名给你存款。存下的钱，给你买新房子。大儿子送的鞋，挤脚也要穿。但看出大儿子只为了遗产，于是想买一双新鞋了。希望小儿子不要来，因为说明他过得好。说不出最爱谁，但最想让女儿陪。得了癌症的阿玉，也是化疗没完成就走了。爸爸妈妈，你们来接我了。爷爷奶奶，你们在哪？春节剩下的饭菜，一个人要怎么吃的完。一周一次的聚会，也没能一家人坐下打牌。什么时候，外孙给外婆唱摇篮曲。什么时候，再路过你生前的粥铺。我没有东西留给你，你不用再照顾我了。阴阳相隔的彩虹，呼啸而过的火车。低眉的世尊，沉默的菩萨。故意撒一团的花。
亵渎电影,2024-08-23 23:01:21,河北,4星,370,看惯了在商业元素和各种平衡度上拿捏走钢丝的华语电影，会给人一种错觉，感觉想拍好电影，就要在尺度和审查上碰运气。现在看到一部这样的泰国电影，突然有点惊慌失措，电影也可以拍得这么朴实，踏踏实实地叙事，不把精力花在动脑筋和算计上，把生活的细节做扎实，故事依旧能打动人，主题表达和价值输出不直给，反而更有力量。人到中年，身边的朋友和老人去世的越来越多，看到片中姥姥的状态很有感触。陪伴就是时间，年轻人虽然有很多时间，但很难懂得这种孤独，正是需要把拿时间来换金钱的年纪，为了顾家讨生活。人生很难，尤其是我们。
横路,2024-08-17 16:29:46,北京,3星,11720,儿子继承遗产，女儿继承癌症——全片最精彩的台词由母亲说出。除这句抱怨外，她所做的只是付出（甚至还替弟弟抵挡住了哥哥对房产证的抢夺）。姥姥始终介怀于她的父母把遗产全留给儿子，自己辛勤照料却什么也没得到，但她自己最终也是这么做的。这，就是祖传癌症。
有_犭苗_饼,2024-08-23 22:47:19,辽宁,5星,6490,阿安在给姥姥送终时一路敲着棺材经过曾经走过的地方 最终来到为姥姥买的新家 又不好好撒花 是想让姥姥来找他啊呜呜呜😭
西楼尘,2024-08-24 09:35:24,江苏,3星,1420,橱窗里存钱罐被偷走的是信任，春节后冰箱里吃不完的是孤独。拜观音后不吃的，寺庙签上写满的，石榴树上熟透的，都是姥姥对这个家的爱。我带着功利的企图住进她的房子，她带着卑微的渴望想买漂亮墓地。当我学会了姥姥的语言，才听懂了她最后没说的话。当我闻不到房间的老人味，才记起她曾经许给我的爱。
_Ellipse,2024-08-24 18:11:38,湖南,3星,841,最惨的就是男主他妈，真的继承的是惨和癌症，房子是给小儿子的，钱是给外孙的，女儿白白付出啥也没有，钱也没得，还得被画虽然我不知道我最爱谁，但我想你陪我身边这种饼😅
Yuan,2024-08-17 18:27:12,北京,5星,5746,很难想象一个片子能通过一个遗产继承问题包揽了当下几个最具争议的社会议题，整个东亚都避不开的女性作为母亲就必须牺牲自我权益以及正视女性在家庭中的付出，空巢老人、临终关怀、等待死亡感知死亡，加上久石让式淡淡的配乐，整个片子有种是枝裕和的哀伤风格，结尾送别高潮戏不煽情却催泪，泰国的现实题材拍得太好了……
好好地,2024-08-24 19:31:07,北京,4星,423,东亚女人被算计，被利用，被诅咒的一生。哪里温情了？明明是年度最佳恐怖片。
鼹鼠种地去,2024-08-25 19:33:28,江苏,5星,4388,有遗产的老人有儿有女，没有遗产的老人只有女儿
油尖旺金毛凌,2024-08-24 09:29:52,广东,4星,367,姥姥目睹自己的肉身的枯竭、最爱之人的算计，最难过的是自己被亲人与世界一步步抛在身后。这样的孤独，只能在午夜梦回，让她像个孩子一般，呼唤父母把自己带走。隐忍、沉默的崩溃，比大哭大闹更来得让人猝不及防。
桃桃林林,2024-05-30 16:59:32,广东,5星,3731,其实剧情很套路，看开头就知道最后剧情的走向，包括外孙对姥姥态度的变化，配乐其实也有点太满了，从头铺到尾。但是，怎么可以这么好哭，最后完全哭崩了。很安静、很亲切，一点点把深藏的记忆渗出来（很多童年的记忆早就记不清了，但她都记得）。奶奶已经去世快30年了，看到这个电影，还是好想她。太难过了。
阿五,2024-08-24 18:51:07,河北,4星,344,用心看护并且得到了相应回报的阿梅是这里面最让人感到舒适的存在
一半王尔德,2024-08-19 10:12:19,广西,5星,3755,和这部电影比起来，当今的国产电影几乎没有真情实意这种东西，充满了算计，算计观众看到哪个情节会哭看到哪句台词会笑。然而真实却是最动人的力量
RealityBites,2024-08-23 20:24:40,浙江,4星,302,为大儿子戒了最爱吃的牛肉，房子留给了烂赌的小儿子，小儿子转头就把房子卖了把癌症末期的她送进福利院，在生命的最后阶段还是女儿把她接回家照顾，女儿只是得到了一句“我希望你陪在我身边”就感动得稀里哗啦，连辛苦存下的一百万也是留给外孙的。“儿子继承财产，女儿继承癌症”这很中式家庭。外孙小时候对外婆说你给我存一百万，我要给你买新房，最后真的用外婆存给他的一百万为她买了新房（墓地），这真的很戳。
关关难过关关过,2024-04-21 05:56:47,泰国,5星,3492,哭得不行，是很久没看到那种不炫技+认真讲好一个故事+演员不拖后腿的好电影
蓝色荣耀,2024-08-18 01:34:50,上海,4星,326,结尾坐着车去敲棺材那段确实感人，把整个片子几乎所有的相处都串了一遍。但真正最触动我的是姥姥那句墓地豪华一些，或许就会多来看我一些。那种无奈和卑微，仿佛一下点出了整个片子的核心。或许所谓爱都是有附加条件都是希望有所得的。整个片子做的还非常好的一点就是男主思想的转变，或许从他不回想购房者的短信就开始了，他开始意识到这种陪伴除了是一份工作或许可能还真的会有爱的程度。整个片子是在寻找和领悟亲情的过程，而它对亲情的这种阐释，从自私出发最终却落向无私的这种表达，我觉得还真的是蛮酷的。                   2024-8-17看
断片王,2024-08-24 12:10:34,陕西,5星,2097,说出口的是心愿，没说出的是抱歉。姥姥明明自己淋过雨，终究没给女儿打伞。
midori,2024-09-09 21:43:04,北京,4星,117,谁能告诉我为什么要给阿梅一个做网黄的设定……想塑造一个放弃尊严唯利是图的女生形象也不必如此恶趣味吧
依然是瓜皮少女,2024-08-17 17:30:39,山东,4星,217,好哭的背后是吃人，尤其是吃女人的东亚家庭。爷爷可以略过子女把房子留给外孙女，而外婆的一生，为了大儿子，为了小儿子，为了外孙，从来没有为了自己。“儿子继承遗产，女儿继承癌症”现实就是彻骨的寒冷。东亚家庭对老人是残忍的，人老了之后的价值是提供遗产，是让子女把假惺惺的尽孝做足，给子女留一个心安一个好名声，没人在意她穿的漂漂亮亮的等子女回家。这是东亚家庭亲情纽带注定的破碎，但受伤害的人，是老人，是女人。
乐乐,2024-08-25 02:02:42,云南,4星,225,最触动我的地方是姥姥到门外和讨债人周旋，结果发现对方是外孙发帖吸引过来的看房人。她支走那个人后默默走回房间，看到孙子坐在那里，心里是怎样的想法呢？又是怎样在短短几分钟里劝说自己看待这件事？我想不到她居然拿起新买的衬衣给外孙，还能装作无事发生去叮嘱他要好好工作好好面对人生。或许是人年纪大了，时间残忍起来连多余的悲伤都来不及。
m89,2024-06-28 18:35:23,马来西亚,5星,1911,配乐十分久石让。有几个非常惊艳的关于“时间”的镜头设计。又一次在电影院里哭成煞笔。和许鞍华的《天水围的日与夜》非常像，看上去轻松诙谐，三姑六婆，实际上绵里藏针，后劲儿非常大。这是无数中国家庭的缩影，南洋先辈们筚路蓝缕，漂洋过海，为的无外乎就是家里妻儿的一袭新衣，一口热食。哪怕已经落地生根，乡音难觅，骨血里流淌的依然是中华传统家文化的基因。
射費是死亡終站,2024-08-25 23:14:54,广东,5星,1583,内地翻拍不要碰这部，谢谢。
kirkland,2024-08-30 22:37:11,湖北,3星,386,中间睡着了好几次，对男权社会的恨意蒸发了我的眼泪
Zoey_,2024-08-26 00:44:06,广东,4星,139,因为是女儿，所以即使照顾了临终的爸妈，也没有得到一分财产。癌症第四期的时候拉着外孙上门找生活富裕的大哥，只是想要一个棺材本，被指着鼻子说因为不是一个姓所以就是两家人，今天是最后一次见面了。     然后同样地，把房产留给了欠了赌债的小儿子，却对女儿说，你要问我最爱谁我不知道，但我最希望你陪在我身边。     “继承房子的是儿子，癌症遗传给女儿。”太痛了。
谢飞导演,2024-10-18 18:24:24,北京,4星,48,终于在网上看到了这部泰国今年最卖座、中国获得1.2亿票房的电影，确实不错！泰国华人家庭展现的中华家庭文化精髓朴素、真切，令人感动。姥姥的形象塑造丰满，表演细腻，导演手法朴素、精准，都值得一看。这是在中国国内市场上出现的“东南亚黑马”，听说男主演在泰国很有名，但估计这和中国票房并没有直接关系，豆瓣上20多万人次打出来8.9的高分，说明我们的观众是识货的，好电影，能感动观众的作品，就会有人爱！
smslhyhy,2024-08-25 16:55:11,广东,5星,1347,很感人又很现实，窝囊废儿子获得了一套房产，外孙有外婆从小存到大的存款，东亚女儿最后获得的是妈妈的一句“我最想你陪在我身边”
嘟嘟熊之父,2024-08-26 15:54:38,北京,3星,219,自从是枝裕和开始走红，人们就渐渐遗忘了今村昌平。选择性的遗忘，是因为人们更习惯因感动而落泪，而非因羞愧而落泪。
一棵芹菜,2024-07-27 09:59:53,美国,1星,525,不能再差了 本质是一个加长电视剧 称不上是电影 而且剧情而言 姥姥因为是女性所以啥什么都没继承到 结果自己死的时候也选择啥都留给儿子不给女儿 这究竟有什么好哭的我请问
柠檬不好吃,2024-08-23 23:11:43,河南,1星,275,下午看还是8.9，现在升到9，真虚高啊。在电影院看的如坐针毡，本身是冲着大哭一场的，但说实话全程看得我眉头紧皱，这不就是女儿照顾我但是我要把钱给儿子吗？儿子没钱就活不了了？谁弱谁有理呗，典型的三观不正，就是因为拍的温馨了就分这么高？我是真没get 到点
一杭,2024-08-26 23:06:35,上海,5星,1111,我知道有些观众会批判姥姥明明自己受够了重男轻女的苦，自己却也是个重男轻女的人，如果男主和彩虹两个人性别颠倒，这账户的钱就是留给彩虹的。但我想把事情想得更美好些，我认为给外孙的钱就是给女儿的钱，正因为自己也曾做过女儿她才渴望改变，也借此补偿当年被伤害的自己。全片最难受的两句话，1. 姥姥她哥：就算（父母）把钱分给你，也会被你的废物老公败光，姥姥：但这个老公也是他们选的。2. 男主妈妈：男人继承房产，女人继承癌症。当然我觉得影片最大的艺术性是，用真感情维系出一种必然性。必然是，无论你照顾我是在做戏，还是假戏真做，还是你根本从一开始就没有来照顾我，那一百万我都会给你。必然是，即便我知道遗产黄了，但是看到你躺在养老院那张逼仄的小床上，还是会舍不得把你接回自己家。必然是，爱不需要条件。
CX_qiao,2024-08-18 17:18:37,广东,5星,960,眼泪止不住，纸没带够太失策了... 姥姥夜里脆弱地喊爸爸妈妈我想你，我想死；姥姥说春节后一天看着满冰箱的剩饭剩菜觉得自己一个人怎么吃得掉啊；姥姥不舍儿子买的不合脚的鞋子，就算无奈也会帮赌博的儿子还债；跟外孙说我没什么给你了你不用照顾我了；外孙去养老院说姥姥我们回家；病重时专门学了潮州话给姥姥唱家乡小调；下葬时的指路，说姥姥经过你的粥店了；还有那多少年攒下来的存折... 泪点不要太多。而人性世故的复杂，真心与算计，老人的孤独与说不出口的期待，兄弟姐妹之间为了钱反目的世态炎凉，真的是众生相
Landy,2024-06-14 19:37:42,中国香港,3星,290,編導首先點出「不計代價付出」的偽善本質，同時肯定了全身心照護老人，要求報酬不過分的看法（這也是為何現實中會有一些老人把遺產留給沒有血緣關係的照顧者）；其次將此觀點進一步延伸至對血緣維繫的華人家族文化裡重男輕女、長幼親疏有序等傳統觀念的質疑，例如女兒用心照顧老人，但遺產卻是兒子們繼承。而對這些議題的探討又是建立在心有所求的孫仔與時日無多的婆婆的相處點滴，以避免濫情的日常筆觸，提出何謂親情，並試圖重構親密關係（最親近的那個人理應獲得更多）的努力之上，不致淪為空中樓閣。完場後想，假如明仔是女生，情況又會如何？（明仔的堂妹小梅被爺爺善待，不知道她是否也來自華人家族）那就是另一個故事了。
:DDominique,2024-08-24 06:36:01,浙江,3星,290,我觉得最痛的是“儿子继承财产，女儿继承癌症”，尽管姥姥从前就是那个重男轻女家庭的受害者，这套逻辑还是用在未来的子女身上，给外孙的存款很难不让人觉得因为他是男丁。所以这是一个世代相传的痼疾，不是说人临终前煽一下这个事就化解了。
朝暮雪,2024-09-21 23:39:15,四川,4星,42,父母最偏爱的往往是最不孝顺的，最冷落的大多数都是孝顺的，对不孝子太宽容，对孝子太苛刻。对于最孝顺的子女，朝夕相处，父母看到的全是缺点；对于一年都回不了几次家的子女，因为没有一起生活，所以父母看不到他们的缺点，他们只需要偶尔孝敬一下父母，父母就会觉得他们对自己很好。姥姥对父母孝顺，父母却把遗产给了她哥。M母亲很孝顺，姥姥却把房子给了最不孝顺的二儿子。虽然M很孝顺，也得到了姥姥的遗产，但如果M是个女孩，姥姥还会给他存那么多钱吗？姥姥是重男轻女的受害者，她长大后没有说我经历过重男轻女，我绝不让女儿再遭受我当年的经历，反而成了自己最讨厌的人。
Alpaca,2024-08-24 12:31:01,四川,3星,257,我还是无法共情男人诶
噠噠噠,2024-04-30 18:28:09,泰国,5星,597,非常细腻和直面。亲情界的《不够善良的我们》。
连城易脆,2024-08-17 22:03:24,江苏,4星,99,一开始，影厅里一些马群耀的粉丝反复拿手机📱屏摄，甚至开了闪光灯，搞得我有点烦直接伸手示意不要拍了。而到了电影后半段，特别是姥姥光头后，发现这些粉丝们明显安静了，最后回忆姥姥带着外孙存钱那段，则能感受到很多人都泪目了，整个影厅的气场都不一样了，一部真诚的电影的确可以让浮躁的人变得平静，并沉浸其中。坦率讲，由于类似讲祖孙情的电影之前看过不少，且我的个人经历和电影的呈现差异比较大，所以更多是一种感慨，而不是感动。特别是在当下老龄化、社会原子化如此严重的情况下，还是需要这些宣扬亲情的电影的。另外，自《天才枪手》之后，就鲜有热卖的泰国电影，从产业角度来说，还是非常希望优秀的小语种电影可以多多进入大陆市场并获得好的市场反馈的。
Furiosa,2024-08-25 19:12:34,湖南,3星,178,不觉得温情。分明是东亚女性地狱故事，一代一代照顾老人、但却没有继承权。什么养儿防老，自己赚钱存钱才是硬道理。“儿子继承遗产，女儿继承照顾重担。”
她是太平洋,2024-08-28 23:23:07,山东,5星,644,字里行间都是中国，但片中人说的却是听不懂的语言。所以中国电影人在干嘛呢？
未来未来,2024-09-02 01:28:22,陕西,2星,100,2⭐半。我不明白，然后呢？儿子继承遗产，女儿继承癌症。然后呢？你的钱确实存给了外孙，那女儿呢？如果你只是想说明“困境”，大可不必。因为不在困境里的人永远不会看这个电影，让困境里的人看了这个电影为自己的伤口流泪已大可不必。女性唯一应该被教的是“不要成为好人”，而不是得到“我死前唯一想在一起的人是你，因为你是好人”的奖赏
徐若风,2024-08-25 23:24:47,北京,4星,43,「金钱与情感分配」这一核心主题贯穿始终，将散点式的情节点串出了主线。细微处的小幽默与刺痛感，始终保持稳定输出。不少符号的使用（如石榴树/果/花），浸染着东方式的对家庭与人伦情感的理解。全片最不解的是姥姥的富豪哥哥坚决不肯出买墓地的100W泰铢（21W人民币），也印证了后续那句“儿子继承遗产，女儿继承癌症”，女性在东亚家庭里的职责、地位与财产所得，存在着太多分配不公。这份无解在最终的反转得到回扣，也让人在瞬间释怀与感动。情感都是有条件的，而一切付出也都会有回报，因为人生在世，最终无非是挽留亲情、求得心安。
查令街的浪先生,2024-08-24 20:09:57,北京,5星,580,【付出总比得到更让人心安…】
明蘅🏳‍🌈,2024-08-27 13:47:00,安徽,5星,451,居然有这么多人在那纠结最后把房子给了不成器的儿子，这才是这部电影绝妙的细节好吗？麻烦搞清楚，你是来看现实主义作品不是来看社会主义价值观科普的！
天马星,2024-06-10 19:41:33,广东,5星,481,世界上最幸福的事莫过于被爱，但是有一件比被爱更幸福的事，那就是懂得爱。后半程哭得眼睛发酸，没想一部泰国电影拍出了华人家庭的精髓，一幕幕太过熟悉，熟悉的文字，熟悉的话语，熟悉的礼节，熟悉的禁忌，熟悉的“付出的人没有回报，被偏爱的有恃无恐”。很喜欢妈妈这个角色，她活得最通透。
