用户名,评论时间,IP属地,评论分数,有用数量,短评内容
来都来了,2018-07-04 12:19:43,,5星,139,徐峥渐渐宋康昊化了，照这个趋势，影帝是跑不了的。恭喜徐峥。不过，制药公司定这么高的价格，真没毛病，药物的研发成本极高，如果不保护产权帮助制药公司收回成本。那请问，新的药谁去研发？医药行业还要不要进步？
猪大勇,2018-07-07 23:47:46,,4星,79,几处过度的感情渲染和最后字幕、车里对话所显示的“求生欲”，并不妨碍这部电影的优秀。要放在一水国产电影里评价的话，光取材就可以打满星。
妖灵妖,2018-06-30 19:07:59,,4星,74,非寻常视野里的上海
土呆,2018-07-09 11:43:43,,3星,104,我就问药企的研发费用谁买单？市场经济这么多年了，商人还是地主周扒皮嘴脸，都晓得吃饭不能搞人民公社大锅饭，吃药就一定要全民AA？谁不同情病人，谁不担心自己没有药，谁不渴望延续生命？但不代表这病人所得到的救赎就真的那么理所应当。
肖浑,2018-07-06 16:56:19,,4星,111,徐峥从小人物到救世主被拔得有点太急太高了，最后煽情让我憋眼泪憋得头疼，有几个场面过于戏剧化，不过都可以理解，依然值得鼓励。
皮革业,2018-07-05 11:04:01,,4星,62,不管到底出于什么原因，对题材边界的突破都值得肯定。另外，怎么都那么把打分当回事啊，还最终评分7.3、7.4的，想当高考阅卷老师还是体操裁判啊……
FloriaZENG,2018-07-07 16:16:14,,4星,76,说实话，九分真的过高了，但无可否认这部电影有他的感染力和闪光点，题材的意义和演员的魅力简直太大了，好几处让人无法不为之动容。尽管在节奏和部分剧情处理上还是有些不自然和过分煽情，但终究是值得令人尊重的国产片。对于那些说其媚俗的人，我替演员和背后的工作人员感到难过。
五,2018-07-01 16:36:23,,未评分,61,不喜欢后半截。啥时才可以别为理所应当的事情歌功颂德、痛哭流涕？啥时候才可以别要求别人具备社会身份（本片中是商人）以上的道德？啥时候才可以别牺牲了无数人，才给自己一句“时代进步总有代价、知错能改就是好的”？
内陆飞鱼,2018-06-30 22:37:48,,4星,66,佩服，中国现实主义题材拍摄方式的一种样板，影像，故事，节奏，表演皆纯熟到位，悲而不哀，怨而不愤，尺度掌握好，结尾有些那个，但好像也没有更好办法了，自私懦弱的平民百姓，几乎成为救民于水火的“超级英雄”，这是最发人深省的地方，宁浩、徐峥提携新导演，提携很到位，预感徐峥要拿表演奖啦。
ChrisKirk,2018-07-03 23:34:15,,3星,72,看到两股势力的交锋，却没看到锋芒下的冒险精神，题材本身所具有的深度在迫击炮般的泪点轰击下被冲淡不少，更何况此中个人神化的倾向性太过乖张，虽能一语中的指出诟病所在，但这样的蜻蜓点水无论从哪个角度看都像极一场模式化的兜售，权衡和融合后本质也仍是求稳心理，但这不能怪创作者，大环境如此。
远子,2018-07-09 16:43:36,,4星,65,已经很不错了。现实肯定比电影复杂，之前看过的一些根据真人真事改编的电影，其现实往往比电影表现的要黑暗得多（比如《无人知晓》）。但我想我们不能因为现实的复杂而去否定电影的“单纯”。从某种程度上讲，这也是电影存在的意义。这部电影能够激发大家关于进口药的讨论，也是好事。
叶飞Phoenix,2018-07-07 10:16:28,,4星,74,实属国产佳作，但不至于被捧上神坛。富有争议的题材，出色的表演，真实事件改编，可惜不能还原幕后真实利益关系，迫于需要过审，只能脸谱化谄媚处理，后半段煽情技法非常奏效，但缺乏电影的高级感。这样的题材可以过审，而且排片可以像商业大片一样如此密集，实属不易。
托尼·王大拿,2018-07-05 19:47:54,,4星,60,有些地方的那群众呼声，不还是早年间献礼片那一套？但带着镣铐起舞的技法成熟度体现在文本和影像上，尤其剪辑，虽不大胆，但看的舒心，节奏感特顺溜。
圆首的秘书,2018-07-05 16:10:10,,4星,55,真的不错哦，直到结尾都不错，个人愿意再看一遍。但实话讲，并不觉得这是中国电影的进步，也不是什么制度的进步，至多是化用其他电影创意的方式的进步。其中比较露骨没藏好的地方，比如结尾对辩护人毫无节制的“索取”，让人瞬间失去共情的动力。中国缺故事吗？显然不缺，但始终还是缺一点“大聪明”。
