用户名,评论时间,IP属地,评论分数,有用数量,短评内容
坠落幻觉,2025-01-28 21:32:40,英国,2星,0,【5分】又看另一部好莱坞式的流水账传记片，真好。游移、动荡、三角恋，波折、起伏、小圆满，虽然阳光之下无新事，但电影不能拍得无新意。波澜起伏的时代背景被草草带过，并未与人物产生有效互动，纵然神曲让人激动一秒，但依旧是为了bob Dylon本身而非电影。除了按部就班地告诉观众他的经历，这样的传记片还有什么？能否引起观众哪怕一秒的共情，哪怕一个小切片的体悟？bob Dylon为什么会成为bob Dylon，影片并未给出解答，甚至都没有提出问题，最终变成了无过但也无功的金曲串烧。
VincentP,2025-01-06 08:32:16,美国,2星,0,又臭又长的流水账片，东一榔头西一棒的剧情 越看越莫名其妙
Sparkling_,2025-01-19 07:21:19,英国,3星,1,感觉故事撑不起来两个多小时的时长呢，甜茶的“扮演”感太强了，倒是两个女生都蛮自然。（这个中文译名很不喜欢
🫗,2025-02-08 17:43:19,美国,2星,0,AMC with Adam. 甜茶作为歌手没激情也没气息实在不convincing
玲玖,2025-01-27 07:39:19,英国,2星,0,演自己演的真好
cyberflea,2025-01-21 07:47:56,英国,4星,0,"Great vibe, great music. 看得尸体暖暖的。@ODEON"
Puff,2025-01-26 19:05:06,中国台湾,3星,0,3.75詹姆斯曼高德相隔20年再拍音樂人傳記片，拍的是巴布狄倫，但很意外有《為你鍾情》的強尼凱許來串場，而這個角色也從昔日的瓦昆交給了曼高德近期最常合作的愛將綠葉波伊德霍布魯克扮演，講鄉村民謠果然還是脫離不了強尼凱許以及巴布狄倫。開場想起《醉鄉民謠》，中間一連串民謠演奏看的過程一直有種這其實該由柯恩來拍的想法，巴布狄倫i人的性格，是低調也是反叛，60年代一連串的時代變革，鄉村民謠充當撫慰民心的作用，巴布狄倫站在時代的浪潮極力用歌詞以及歌曲撫慰民心，最後當普通吉他走向了搖滾吉他，鄉村民謠成了過去，他也不再是過去的他，曼高德在流水帳敘事中抓住了時代浪潮與巴布狄倫在演奏上的變化，從民謠走向搖滾，注定會是孤單又叛逆的一匹狼，甜茶的表演合格，民謠歌曲駕馭起來也不俗，但更多驚喜是獨行俠的鳳凰以及艾兒芬妮
whateverulike,2024-12-29 03:53:59,美国,2星,6,"看完对bob dylan 路转黑…默认所有媒体的年度Top电影榜, 如果有《无名小辈》就是收了钱"
牛奶的奶,2025-02-09 13:52:53,澳大利亚,5星,0,"Don’t let’s ask for the moon, we have the stars."
Elio,2024-12-31 18:41:07,美国,4星,3,2024最后一部电影的标记留给最爱的提摩西！影片最多三星，多加一星给甜茶的演技和bob dylan的歌曲。剧情真的实在是太无聊了，全靠bob dylan的歌曲来串场。后来看了timmy和bob的造型对比，真的出神入化。而且居然后来是现场录音！总是能被他的演技打动，演啥像啥。还是我最爱的演员！elle fanning也很美。timmy在采访里说如果这个影片能让年轻人重新爱上bob dylan的音乐那他会很高兴的。回家就一直循环播放timmy唱的soundtrack。
睡玫瑰,2025-02-09 22:22:16,上海,2星,0,非常无聊的传记片，但甜茶的脸稍稍回春了
疾行慢赏,2024-12-27 06:40:42,加拿大,4星,1,艺术家的个性都展现了，蜻蜓点水，可总是少点触动，回头一看，这片名不就是最好的点题。老先生今年来多伦多也是唱的新歌，一辈子就这么个性，也是有点传奇了。
jeanyoo,2025-02-08 15:09:02,英国,3星,0,又续上了odeon会员卡畅看。Joan Baez（演得）太有气质了。怎么看迪伦都是甜茶甚至戳爷，不管他怎么努力黏着嘴说话，大概就是演员上太多综艺的坏处。
布吃魚の貓,2025-01-20 12:24:13,美国,3星,1,对Bob Dylon的了解仅限于知道有这么个人所以无法评价内容 但没想到甜茶吉他弹唱水平还挺可以的 另外这电影可真够长的 跟约会对象过去这三个月内看了四五部电影 这是第一次把一桶爆米花都吃光了
LD,2025-01-24 07:55:51,英国,3星,0,3.0 没有给撒旦签契约算什么传记片
小菜将学会做菜,2025-02-10 01:53:07,福建,4星,0,歌都非常好听。以及在后半段重新爱上甜茶的脸。
下午三點,2024-12-26 14:03:56,美国,3星,1,故事讲的就挺稀碎的
小乔,2025-02-04 10:55:10,北京,2星,0,这么无聊的电影，大可不必被拍出来
涌着爱面朝沧海,2025-01-21 23:44:11,菲律宾,3星,5,三颗星全部给高密度的音乐。电影本身节奏松散、故事凌乱、叙事啰里八嗦……以及甜茶顶着那一张毫无表情的脸，咱也看不出他在演谁……
纸躯,2024-12-25 13:13:17,加拿大,3星,1,Christmas Eve满座电影，鲍勃迪伦的人生节选。好多好多的歌好碎片化的剧情。Cineplex.IV.
冷漠.jpg233,2025-01-18 12:17:52,美国,3星,1,看着留不下什么印象的电影。一个落魄青年就magically变有名，然后乱睡两个女人。甜茶真的很帅，这部的演技很不错，就是口音让我没字幕看的有点痛苦
五大湖口设计费,2025-01-05 14:15:16,美国,3星,0,甜茶真的好像dylan，说话含糊不清演的真好
Rêveurs,2025-01-24 11:34:17,河北,3星,0,无聊传记剖析人物抓错重点了hhh
阳光新事,2025-01-10 15:01:55,美国,3星,0,好平好无聊，也就甜茶的脸能看一看歌能听一听。
