用户名,评论时间,IP属地,评论分数,有用数量,短评内容
咸菜帮老大,2024-12-25 05:15:57,美国,3星,53,迪倫和他身處的時代一筆帶過，迪倫和他的私人生活濃墨重彩。攝影機熱衷在主角唱歌時反复懟到周圍角色的臉上來傳遞「你的音樂令我沉醉 or 痛苦」的信息，這鏡頭語言放在好萊塢都算是爛俗了。
三点水加个灯,2024-12-26 03:44:09,美国,3星,28,歌唱得都不错，但只是流水账地把名曲串联在一起，配上不痛不痒的三角恋。背景中暗示的时代变迁在贫瘠的文本里显得可笑，人物弧光也很难让人共情，甜茶明年再战影帝吧
喂马,2024-12-29 17:25:56,美国,3星,26,故事讲得好烂，看完只觉得Bob Dylan是创作很天才但有青少年病的asshole。歌还是好听的
泽维尔酱,2024-12-29 14:11:00,美国,4星,25,喜欢艾莉范宁角色的感情线，她带迪伦参加protest，鼓励他唱自己写的歌；当迪伦在Newport对着台下的万千观众唱风中摇滚的时候她的凝视坚定又悲伤：他的音乐、才华和桀骜不驯，终究不再只属于她了。舞台上全新又陌生的他，多像一个complete unknown
Francesca.L,2024-12-25 10:21:55,美国,5星,24,还是喜欢真正unknown的那段时期……后面成名之后整个质感都变了😭甜茶演的不错啊连唱腔都很像！依稀记得二零年刚粉上茶的时候 他就已经在看Bob的传记了！将近五年后终于看上啦 给甜茶打五星🥰前半段我特别喜欢 质感好音乐也好 上世纪纽约的那种vibe也好带感啊 应该会找时间再看一遍？后半段感觉就戴着墨镜走来走去不知道在干嘛（
1985.,2025-01-08 23:40:21,天津,5星,7,能在一部2024的电影里听到这么多迪伦的歌已经很满足了😭
AgentDS,2024-12-25 14:16:39,美国,3星,17,3.5、平安夜點映簡直老年人專場、、、突然覺得bob dylan是極少數傳記片個人生活極度清水的音樂人了😅其他演員都還好、joan baez太有魅力了！突然get了為什麼是這麼多人的女神、老一代人音樂人裡bob dylan也算近十年裡還會出現在大眾視野裡的、包括之前參與錄製hes funny that way
Cherry樱桃之远,2024-12-27 14:33:24,美国,2星,34,看着Timmy咬着后槽牙学Bob Dylan说话两个半小时看得我坐如针毡，随后我立刻去翻采访，本人说话正常点，不过那种吞吞吐吐说话不清的感觉学到了……好无聊的电影，我对Bob Dylan一无所知，看完电影后除了知道Bob Dylan脚踏几条船，对于音乐创作坚持自己非常叛逆，其他依然一无所知。歌不是我喜欢的，当年看Girl from the North Country也是从头睡到尾。
踢迩达,2024-12-25 17:48:05,北京,4星,14,自弹自唱的甜茶，对于复刻不情愿被困在固定类型中的迪伦有一定的互文意义。音乐传记片太是曼高德的舒适区了。
张一bin,2024-12-29 08:51:22,美国,3星,27,[AMC Eastridge 15] 全场几乎都是老年人。落入音乐传记片俗套： 音乐串烧
寒枝雀静,2025-02-02 04:17:04,法国,1星,4,0 / 很久很久很久没有看如此纯粹的零分电影了。全片唯一的记忆点可能是房间里挂的汉语书法上写的“基情”两个字吧。
Ryan,2024-12-27 08:15:34,美国,3星,14,这片真是trying so hard给甜茶造神但感觉也没造出来 有些脱离时代大背景全部都轻描淡写 始终不够完整
Thè,2025-02-09 06:38:00,英国,3星,1,本来觉得肯定没啥好看的，结果影院的朋友和我说2024年里只有这部片子座无虚席！嚯那不得看看？看完了只觉得，座无虚席的原因可能是因为Bob Dylan就是中老年白男白女的周杰伦，爷爷奶奶们都兴致勃勃坐下来，影片开始十分钟后开始狂睡，结束时候睁开眼合唱一曲Rolling Stone，阖家欢乐！其乐无穷！
YKNAL,2024-12-30 03:29:41,加拿大,3星,6,让他写出那些歌的时代背景一笔带过，一到私生活家长里短事无巨细，想到类似的拿破仑也是一样，看来最近流行狗仔式传记片，好像在银幕上看狗血深夜节目。多么可笑的二十一世纪，给曾经直面时代的勇者拍传记片，却顾左右而言他，连再现时代的勇气都没有了。
Otocolobus,2024-12-27 09:33:41,加拿大,4星,17,对我来说最大的遗憾是几乎没有展现那个时代和他的音乐之间重要的关系，只是在电影中作为背景轻描淡写带过了。电影整体对于他的音乐是展现得很好的，而且真的做到了用音乐讲故事。爱德华诺顿虽然是个xxxx但是演戏确实是非常不错...以及我小时候是不是太傻了点我一点没意识到joan baez和bob dylan之间的关系...*facepalm*
加一份奥利奥碎,2024-12-25 09:17:01,美国,4星,20,音乐类的传记片总比其他传记片更容易打动我，几段Bob Dylan对着Woody Guthrie的弹唱我都止不住流眼泪。前半段有点一般，后面越来越精彩。这部电影适合点一杯烈一点的鸡尾酒，前半段跟着音乐摇一摇，后半段酒劲上来后彻底融入rebel spirit。
Chery,2025-01-06 10:41:46,美国,4星,3,真的好喜欢60年代的纽约
ballsirius,2025-01-13 05:40:13,美国,3星,5,第无数次怀念《醉乡民谣》的一天。前半程老问题，Dylan金曲串烧+模仿秀，文戏很赶很肤浅。后半程讨论艺术家星光背后的孤独和自我追求，好很多。甜茶很有魅力，但除了道化服，和Bob Dylan不太沾边，尤其口音和音调模仿，拙劣刻意，全程难以入戏。反而Norton演个平和老艺术家更令人耳目一新。
Tear,2024-12-25 09:01:37,美国,4星,7,今年甜茶看得有点多了，跟 Bob Dylan 也不熟，平安夜选这部其实有点犹豫的，看到短评里说大半篇幅都在唱歌，hell yeah！就来了。时间线到专辑 Highway 61 Revisited 之前，也就是 1965 年，对于我来说还是太复古了，台下的人为吉他插电而暴怒的时候我：干嘛啊？好好听啊！你们不喜欢吗？红红火火恍恍惚惚实在是油盐不进。感情戏一般，take away 是他喜欢在贤者时间写歌并且不让别人睡觉，整这些还不如好好点题。特别招人喜欢的角色，目前不清楚人物弧光来自迪伦本人还是甜茶，但是听着歌，看着台下/录音室外面亲友笑得像老父亲一样，还是会嘴角上扬。How does it feel？愿你不必随波逐流。
三角铁,2024-12-27 11:51:46,加拿大,3星,9,3.5 分. 提摩西不行，配角记住了好几个，就是记不住他，诺顿那个角色都比他好。最大的优点是音乐很好听，让人真真切切感受到鲍勃迪伦音乐的魅力
安远,2024-12-26 07:37:55,加拿大,1星,27,Is this really necessary?
🍟🥔,2024-12-31 05:59:23,美国,3星,1,流水账，但是看着很舒服，反而很喜欢这种对时代、政治、社运、爱情、音乐等一切事情都点到为止的写法（拎出来的音乐反叛主题也尚可接受）。没有任何人生可以用电影三幕剧来阐释，反面教材是波西米亚狂想曲
King Arthur,2024-12-26 15:21:25,美国,3星,11,这叙事不只是平庸，而是故事本身都没讲好啊。人物塑造没有什么弧光，甚至不如去看之前那部《Don't Look Back》的纪录片更能了解Bob Dylan的真实性格。故事方面也是东一榔头西一棒槌，每首歌的时代背景和社会意义都没有深挖，所有重大事件都是流水账似的一笔带过，连Go Electric的最后一幕也没有充分铺垫。听歌倒是听的挺爽的，没想到电影里这些歌还真是甜茶唱的。#AMC Century City
饮歌,2024-12-25 11:37:34,加拿大,2星,16,有点一言难尽，落入了我最不喜欢的那种传记片模式的窠臼，试图展现一个丰富的Bob Dylan，可是音乐、爱情、政治...每个方面都沾点边，但每个方面都不出彩；人物也是有点纸上谈兵的意思，唯独甜茶跟Elle Fanning的这条线让我动容了一下。以为导演可以重塑《与歌同行》，哪知道更让人看到了华金塑造的Johnny Cash有多好。
去短毛象,2024-12-29 04:36:50,美国,3星,8,why bother? 搞个演唱会重映不比这强八百倍吗，只能从真人上些微借点光
：,2024-12-29 08:40:13,美国,2星,22,主创对得起这满场爷爷奶奶的粉丝票嘛😅
daydreamsugarbo,2024-12-25 16:53:27,美国,4星,4,"Every time it gives a close-up on a character’s reaction scene, the movie gets worse. Best music biopic in years tho | 甜茶颜值又回来了 好会拍｜strong 4"
Norah.C,2025-01-05 08:06:32,美国,2星,9,好无聊的片子，Bob Dylan的生平是一笔带过的，背景是潦草介绍的，情感经历是大书特书的，而且搞的女的都像傻白甜一样。
Matt,2025-01-03 12:20:29,美国,3星,3,音乐传记片都是为了冲奥。看电影感觉就是甜茶本人而不是Bob Dylan。
下周也要睡懒觉,2024-12-26 07:13:23,美国,2星,15,欣赏不来，音乐、爱情、政治、时代变迁什么都想讲，最后什么都没讲好，还不如从一开始就选择一个点深入
VAM👸,2025-01-19 08:05:23,英国,3星,3,太四平八稳了，甚至都没有什么存在的必要。影片明显就是想照着波西米亚狂想曲的票房成功去的，但是没有其激动人心的表现力。片名完全未知，但全片几乎从一开始就把鲍勃迪伦塑造成了一个开了挂的天才，没有将注意力放到鲍勃迪伦的成长反而浓墨重彩笔去关注鲍勃迪伦的感情八卦，这当然保持了充分的娱乐性但也消解了音乐的传奇性。不无聊，但也就仅限于此，某一些片段还是会因音乐和鲍勃迪伦人物本身而触动。
jerrynemo,2025-01-04 12:03:30,美国,3星,2,按照时间跨度分为前后两部分，走进民谣和告别民谣（今后霉霉传记体电影可参考走进乡村和告别乡村）。剧本其实写得并不好，前半部分穿插的诸多历史事件蜻蜓点水，后半段以newport民谣音乐节为时间线，却没有讲清楚迪伦转变风格的原因和动机。各个角色也是走马观花。甜茶这是要当小小李子吗，演这种人物传记电影，却丝毫看不到角色的成长变化。
阿伦·雷乃,2024-12-27 17:06:19,美国,2星,11,看完只想问导演你在干嘛？到底要表现什么讲什么，感觉他自己可能都不知道。片中的音乐家我都有听但全程还是皱眉看完，是不是应该讲讲音乐上的influence，社会的时代的艺术的，一些戏是有这个意图但巨失败，以及三角恋的呈现，真不知道在干什么…甜茶像在上什么百变大咖秀，模仿得有点像只是很假，但歌唱得还可以
橱柜里的猫。,2025-02-07 05:02:17,英国,2星,2,剧本对不熟Bob Dylan的人来讲太要命了。歌一首接一首放但毫无故事，大概只有中老年粉丝才看了个爽吧？80%以上的戏除了用来铺时间线全是废戏，一开始女友指控Bob隐藏真实自我的时候还挺期待会怎么深挖的，结果到底讲了个啥啊……一个小时之后就毫无进展，看之前只知道Bob Dylan是个唱歌的，挺有名；看之后还是只知道Bob Dylan是个唱歌的，挺有名。就这点角色塑造究竟谁在乎你跟几个人睡觉？（一下班就去看看到八点半我快饿疯了，以后要习惯性在包里揣饼干TT）
阿莫多瓦特了,2025-02-06 19:56:12,法国,2星,2,怪不得一开始叫《完全未知》啊，属于导演和剧组完全不知道在拍啥、该怎么拍、该演什么……从头到尾没有一场可圈可点的戏，时代背景动荡、音乐流派变迁、个人事业转型这些大处着眼小处落笔的设置都含混不清，还试图讲一段三角恋，口区，剧本烂成这样是怎么好意思入围最佳改编剧本的；我茶也是……由清纯羞涩到邋遢油腻的转型之作，别以为刻意吐词模糊、极力模仿唱歌就是好表演了……
蓝詹,2024-12-31 23:06:22,上海,1星,6,土了吧唧，俗得要死。把不想看大写打在圣诞新年的大银幕上please，为什么甜茶能入围但paul mescal不能？这片子全部起承转合的sense都他妈在哪里？要不是Bob Dylan自己加持也很难呈现这么自恋的局面，老年人无论有过什么辉煌荣誉都别在活着的时候赞颂自己了，not at all auspicious. 大写的看不下去。
张伊苒,2025-01-01 07:33:28,美国,2星,1,糟糕的创作取向，昏昏欲睡
阿蒙,2025-01-09 11:26:16,美国,2星,4,看到一半我跟朋友说，我知道甜茶为什么要带墨镜了，因为他的演技尤其是眼神戏太烂了，不得不盖住这一致命缺陷🤣整体而言这电影还挺“令人愉悦的”：肤浅、养眼、笑点偶尔、流畅但粗糙，大概是因为Bob Dylan还在世的缘故，拍的非常保守，像极了Bob的自我长片宣传，这是我想给世人展现的炫耀的我的故事：天生就会写歌写词，刚一出道就被誉为不世出的天才，连我的偶像都惊为天人大加栽培，出道后更是一炮而红、佛挡杀佛的存在，连去小酒吧看个现场都被粉丝疯狂追捧无法成行，感情生活更是虽渣但人人都爱我。我想改风格做融合了冒天下之大不韪写了新曲风带去folk音乐节表演，面临巨大的风险和压力顶住了市场的考验，虽然演出毁誉参半，但专辑成为了音乐界最具影响力的唱片之一。
Anasa,2025-01-27 06:29:20,意大利,4星,0,missed the beginning cuz of being late...
天气晚来秋,2025-01-04 14:25:50,美国,2星,3,Timmy性缩力拉满
faroe.,2025-02-07 08:00:59,英国,1星,0,太难看，不知道这个电影拍了是要干嘛，所有人都是一种要死不活的演技，单纯放歌？
amie我乐苦多,2025-01-10 13:17:59,美国,未评分,1,这是个啥？！tc演唱会大电影？写的太有问题了，导的也很平庸…..james mangold来学校煞有介事的讲了半天 实在不太convincing @Utah Megaplex
彭婶高龄六十六,2025-01-14 22:39:40,天津,未评分,1,他目前最大的问题是可塑性不高，上限下限一目了然，作为ip型艺人这种演法非常利好fanbases，但作为真正的演员远远不够。其实cmbyn里透出来的灵气并没有消失，只是被自以为是的“技巧”掩盖了，他仰视对手露出的上目线满是阴郁而非忧郁，还充斥求胜心切。看来荷里活是真不好混啊，把曾经水灵的小生折磨得满身班味儿。
一桶猫,2025-01-03 00:55:51,美国,2星,3,流水账一样的传记 拼命学到了一些表情 学不了一点内在 很表面的还原
Cinema is dead,2025-02-06 22:05:13,中国香港,4星,0,一般这种伟人音乐传记片要不关注性格缺陷，要不探讨社政议题，但这部算是少有更多从纯粹创作自由的角度出发来构造。甜茶绝对是好莱坞现在最被滥用的男星，这部全程不像，不过口音表现还过得去。最出彩的是近年很少看到的Edward Norton，人老了气质成熟许多。
竹和,2025-01-07 13:46:50,美国,4星,1,12/18 AMC 18 IMAX提前点映。蒂莫西查拉梅这种含着金汤匙出道大火的票房金鸡，一路走得顺风顺水，总是让人觉得命运会在某些地方使绊子。这次演鲍勃迪伦，上妆后让我以为他的花期总算结束了，但一看结束的访谈，才发现是假的。总体上说电影还不错看，音乐表演全是演员原声自己完成的，结束后偷听到的观众评价总体上都很正面。个人认为最出彩的部分是Monica的歌声（见仁见智的像）以及范宁的心碎。比较不解的是这影片也不是通过imax摄影机拍的，上映的也不是imax的画幅，只有最后的录制访谈是imax的比例，感觉没什么好在IMAX厅点映的，正式上映后去看杜比就够了。
Fan要坚强,2024-12-30 02:26:40,美国,3星,4,@AMC lincoln Center 像看了带解说的演唱会，不喜欢甜茶版本的Dylon，难以想象Dylon当年居然是如此的jerk且唱歌难听。有点像是摆pose而眼里缺乏睿智的灵魂。/Joan的演员唱的很好，但是跟Dylon在一起姐气太重/导演让Suzie演成一个中西部傻妞儿毫无东村气质，我总能想起来一帘幽梦/旁边坐了很多当年的silver hair 迷妹带着丈夫和老姐们儿一起全场k歌/饿晕了从电影院走出来看到UWS街道感觉电影还没结束
Epicentro,2025-01-19 07:55:46,美国,3星,1,三角恋看得我直接睡着，白开水一样地拍真无聊…怎么说呢感觉们茶还是给出了合格表演的，虽然偶然还是有点黑蒜感（ 以及johnny cash几分钟的露脸性张力都秒了im sorry but its true🫥
YuRAY,2025-01-12 09:33:20,美国,4星,1,"远高于我的预期, Elle Fanning 演得真的太好了, Edward Norton 好几次看着镜头讲话都让我看得热泪盈眶."
SAPURI,2025-01-07 10:12:44,英国,2星,1,皇帝的新衣，甜茶的演技
Qtn,2024-12-29 21:49:56,上海,未评分,2,电影进行到中段时意外好看，茶渐渐适应了迪伦这个persona，导演也没有试图解释天才的运作机制，而是用某种庸人视角旁观迪伦——导演不是天才，即便是天才也很难理解其他天才，但普通人面对天才时的态度显然可以被呈现（所以Suze、Pete Seeger和Joan Baez在片中都有动人时刻）。可惜这个视角在最后一幕里没能持续，茶显然也驾驭不住爆炸头迪伦的爆炸气质。我们的时代终究只能放行这么一个PG-13版本迪伦，要真正领略他的魅力，直接去看The Other Side of the Mirror足矣
N1ck在线,2025-01-12 16:45:07,加拿大,4星,1,8/10。不刻意粘连宏大叙事，但也不刻意anti宏大，曼高德真正做到了去拍一个“个体”、只关注“小”。也是，年少成名的天才Bob Dylan哪来跌宕起伏式的挫折，沉浸在金曲的海洋中感受音乐的魅力就好了，看似鸠占鹊巢的感情线也不是简单的书写，利用老片《扬帆》既呼应也暗示，如果忽略掉Joan和她的感情线，Bob和Sylvie之间甚至被拍得极有纯爱感（当然联系现实的话就笑笑），电影最后反而结束在了反高潮式的音乐会嘘声中（反正对于我一个不了解他生平的人来说挺反高潮的）。都说曼高德是行活导演，但偏偏是他这种“去作者性”使得本片看上去一点不会ego（拉踩一下老雷的《拿破仑》）（曼高德这样和格斯范桑特有异曲同工之妙）。三位配角演员诺顿、范宁和莫妮卡巴巴罗过于抢眼，甜茶反而中规中矩。
rainypan,2025-01-02 03:57:48,加拿大,3星,4,没有展现bobby的魅力，也没展现出他的才华、也没展现出时代的背景，只有一个任性的男人和一段三角恋
andarta,2025-01-21 07:14:37,法国,未评分,0,彻底一展歌喉的TC，谁能想到唱的比演得好～
海鸟,2024-12-25 03:20:11,美国,3星,3,"#12/18IMAXEarlyAccessScreening 平庸之作 从此片中看不到任何bob dylan的charisma 醉乡民谣是这片贵替 round of applause to monica barbaro, she’s stunning!"
sheepfield,2025-02-02 08:22:16,美国,3星,0,适合听歌的时节-01/30/25 at AMC Garden State Plaza 16
mozartera,2025-01-02 01:48:03,美国,3星,1,"Really really good acting for a biopic. Watched it on New Year’s Eve and right after I came back from Newport, when I was confused about and eager to unpack lots of feelings."
林日宣,2025-01-03 18:04:09,美国,5星,3,影厅里听茶唱歌感觉非常美妙
薄荷清柚,2025-01-19 23:46:12,黑龙江,2星,0,听你茶的破锣嗓子开了一场翻唱音乐会+烂俗偶像剧爱情，与时代的联结只剩下廉价的变装秀，鲍勃迪伦的音乐脉络、他的生平和心路历程、当时的社会风潮这些统统一带而过，我原本并不了解鲍勃迪伦，140分钟之后除了知道他是个渣男和歌不对我胃口之外依然不了解鲍勃迪伦，传记片拍成这样导演给本尊道歉吧。每个人站出来都比你茶像个演员，结尾跟Woody对视一场戏，你茶被秒的渣都不剩，除了装X之外，我不知道他还做了什么。
寒腿,2025-01-08 14:38:03,美国,2星,1,这个提摩西模仿的口音太搞笑了，唱歌也太难听了吧。根本搭不上Joan。因为提摩西扣两分
素水,2024-12-26 05:16:16,美国,2星,7,@AMC Sunset Place 24. 5. 完全落入窠臼的奥系电影，完全流水账，曼高德根本就是行活导演。从抗议歌手到在新港音乐节给吉它插电唱摇滚抗议民谣观众，迪伦的“抗议”属性是一以贯之的。但本片完全真空的时代表达让迪伦结尾的抗议观众显得严重缺乏说服力。
全自动NinGyou,2025-01-10 06:59:32,美国,5星,3,"甜茶挺适合演一个jerk的。You can be pretty or you can be a freak, but you can't be plain."
逃逸光子,2025-01-01 00:03:49,美国,2星,1,老白男boomer严选
Balding,2024-12-29 04:15:32,加拿大,4星,2,张小斐老师已经开始参演奥斯卡级别的电影了么？
甜味放映机,2025-01-19 02:38:49,英国,3星,2,感觉甜茶应该是研究了鲍勃迪伦，所以模仿了各种口音和小表情。然后看新闻也说这里面70%弹唱都是他亲力亲为，能明显看出这部电影他确实投入了不少，作为甜茶他可以说是尽力而为了。但如果作为一个传记片就蛮…无聊的…鲍勃迪伦那么精彩的人生就拍成…这样？
小羊不亦乐乎,2024-12-28 11:12:20,美国,3星,1,比预期好，甜茶演的bob dylan虽然小身板，但是戴上墨镜顶个爆炸头，还挺像那么回事，毕竟也是大明星架子绝对有的。音乐很好听，心疼诺顿的角色
天才拾荒者,2025-01-19 05:04:34,英国,3星,3,观感：提莫西给这部电影做的唯一贡献就是学了弹吉他，电影导演给这部电影的做的唯一贡献就是去听了鲍勃迪伦金曲汇编。 （edit：每次电影大特写：好僵硬的一张脸，好无神的一双眼
toishiki,2025-01-14 18:41:53,美国,3星,0,5年也不怎么长，但是什么都想拍一点就太贪心了
NidomeAoki,2024-12-29 15:08:06,加拿大,2星,0,非常割裂…一边是dylan倒了什么血霉摊上这么一部传记片，从演员到故事到人物间tension都毫无神韵，拍得这是什么…基本上一到ta们开始演戏的段落就各种扶额，某茶说话和形态也太做作了，就各种什么鬼🤬 而且一群民运斗士也被当成花瓶样真的好意思吗？？ 不过另一边是单纯歌太棒了，dylan以外的也都，想想一开场就This land is your land，还有Joan各种能介绍给下一代也蛮好吧～好几首喜欢的歌各种爆哭完全不需要太多剧情辅助…毕竟歌和歌词本身生命力太强了🌟😭 但随便去看几个音乐现场或者纪录片像Heartworn highways哪怕Nashville那种电影体现出的各种音乐人对音乐的喜爱完全缺失，展现的一些音乐人交集也好生硬，就除了罗列歌单完全没用心把音乐放在重要位置（
Doreen,2025-01-01 14:33:37,美国,4星,0,NYE @AMC
Elio,2025-01-18 23:14:49,英国,3星,4,3.5，甜茶学迪伦说话我真的是一句听不懂
飘零半生丶,2025-01-21 19:38:54,宁夏,3星,2,看完感觉很一般，除去革命性的电吉他演奏外，没什么记忆点，关于涤纶的成名路和不同时期的表现都是一笔带过，不同时期的社会背景和歌曲创作背景也没有深入涉及到，看的时候就像刷了一堆短视频，对于熟悉涤纶的人来说，看完这部电影，非常失望，因为电影里的很多情节都能通过日常的介绍视频了解到，当然电影里对涤纶的个人性格，独立的创作风格，风流的个人生活都有涉及，都只是蜻蜓点水，可惜没有抓住涤纶主要的方面讨论，感觉没啥出彩的地方，也就是主要拍了六十年代涤纶的舞台表演过程，没把他写歌的心路历程拍出来，还挺可惜，摄影剪辑也没啥特别，要说最打动自己的还是涤纶和西尔维亚分别时引用到那段老电影对白，其他方面真的很平淡，没有大学看《醉乡民谣》的那种兴奋感了，勉强合格的商业电影，传记片拍成这样，怕是“冲奥”还差得远吧。
kinder23,2025-01-16 20:22:49,中国香港,2星,0,又是一部让人可惜的流水账，甜茶很用力地学者BD，但这种模仿反而暗淡了他的光芒，也没有显示出原型人物的光芒。2.5
肆捕像,2025-01-24 20:22:04,澳大利亚,4星,0,有一种伍迪艾伦导音乐传记片的感觉，感情戏大于事业戏，但音乐感很好，比较完整，讲的东西也不碎片。另外，这是在悉尼看的。
WalrusTuTu☮,2025-01-16 08:06:33,中国香港,3星,0,午間老年人專場，Monica唱的太好了演的太有魅力了🥺，boyd的這個Johnny cash哈哈哈，電影劇情可看性就那樣吧但我是來聽歌的，小聲唱著唱著它斷了我還在繼續唱就很尷尬，anyway挺好的
盐水丧棒冰,2024-12-29 09:52:47,加拿大,未评分,1,"12/18 IMAX提前点映! 7/10…？ it’s a vibe… 像一个两个小时的ensemble民谣音乐会，因为主要在靠歌讲故事。在想如果不是几乎电影里每首歌我都听过无数遍都能唱了（因为太熟了，让我突然把他们当作一个个叙事的独白有点困难）会不会觉得好看一点，其实也说不定。大家唱的都蛮好的倒是，Monica唱的和Joan Baez太像了，其实所有人都唱的太像了反而有点奇怪，再次因为对这些歌太熟了仿佛在看parody…… anyway, IT’S ALL OVER NOW, BABY BLUE 🎶"
