用户名,评论时间,IP属地,评论分数,有用数量,短评内容
Gary96787,2024-07-25 07:13:52,德国,2星,2715,无聊的电影工业流水线故事全靠死侍的碎嘴和迪士尼经典技能打情怀牌撑下去了。这东西不配叫电影，只能叫笑话合集视频。
Stfind,2024-07-26 20:58:04,天津,3星,6312,我觉得片中最好的一句话就是借着死侍的嘴说的：“这个多元宇宙的设定已经被玩烂了。”
朝暮雪,2024-07-26 03:18:21,四川,4星,2544,只要活得够久，你就可以在漫威中看到超人和绿灯行同框。“在朋友圈、抖音上被剧透有哪些角色客串后再去看，甚至过几个月再在手机上看”和“上映前几天就断网防剧透，上映后第一时间去电影院，亲自揭晓谜底”真的是完全不同的体验，就好比知道了夜魔侠客串、三蛛同框后再去看《蜘蛛侠：英雄无归》，你完全不理解美国人为什么打高分。在完全不知道剧情、不知道有哪些客串的情况下，看到TVA、TVA屏幕上播放的复联片段、神圣时间线、虚空之地、变种人，以及一个又一个出乎意料的客串，当初看《复联4》和《X战警：逆转未来》的感觉又回来了。惊喜之余，还有落寞。《金刚狼3》上映时，你老了，我还年轻。《死侍3》你返老还童了，而我变老了7岁，不一样的是，我不会再年轻了。看到死亡的角色回归是什么体验？我感觉我看的不是电影，而是我逝去的青春。
Agent阿神,2024-07-26 02:57:51,北京,4星,2200,谁能想到我看片尾花絮的时候哭了，情怀尚在，但剧情差强人意
Bryan·Mai,2024-07-24 13:18:16,中国香港,3星,2192,迪士尼假惺惺尊重下死侍的风格，但也不过是再一次昭告天下：我能把整个漫威数十年的影视化作品进行跨公司整合，把被遗忘的人、前公司倒闭也没做成的饼随时拉出来游街，随便玩演员梗。客串搞堆料初看确实惊艳，出厅之后立马脱敏。多元宇宙的螃蟹也不是你第一个吃，俗套得搞出不同版本的自己预示着创意枯竭，还把前两部的演员晾在一边。本质上犯了《蚁人3》的战略错误，单纯把视野拉大就忘了本。让你整合福克斯的遗产怎么还顺带把老狐狸叙事割裂的毛病也给学过来了？对所有人物漠视的失望感远大于几个老人家客串的惊喜，所谓漫威今年唯一押宝可能在老东家被收购的那天起就注定要变味了。
VinceTsang,2024-07-24 19:14:11,日本,3星,1620,结束所有漫威电影的电影。
陈升,2024-07-26 03:30:27,四川,3星,746,何尝不是用福斯的尸骨打了最后一场
桃桃林林,2024-07-26 21:29:10,河南,3星,401,漫威的春晚。反正这么一弄，真就什么彩蛋都可以随便玩了，热闹是热闹，但也只剩下些段子了。看你是什么目的吧，如果是看热闹的漫威粉丝，应该会非常嗨的。但剧情方面，真的是简单到不行了。
Rêveurs,2024-07-26 02:21:11,河北,3星,304,真不至于大晚上出来漫威粉过节过的什么节清明节(^_^)🌱
^^o^^o,2024-07-26 21:18:42,湖北,2星,807,剧本真的不是ai写的吗？。。。
Hi Friday,2024-07-27 13:19:05,广东,4星,1333,Educated Wish，画大饼，又学习了新短语。
昵的称,2024-07-26 23:02:31,广东,3星,240,漫威一碰上宏观叙事，就是三板斧：身份认同危机、中年危机、村口械斗
同志亦凡人中文站,2024-07-24 18:02:30,新西兰,4星,1379,小贱贱版多重宇宙+逆转未来。虽然创意毫不新鲜，但真的是爆笑如雷，且全部笑点来自于小贱贱对不能融入复联和X战警两大系列偏偏又要硬融的疯狂吐槽。通过将老东家（20世纪福克斯）和新东家（迪士尼）拉踩到地心，漫威终于掀开了自己的棺材板。小贱贱不是在拯救亲友，而是在拯救漫威。
夏日将至,2024-07-24 09:29:05,日本,5星,2130,情怀加一星。一首献给漫改领域失败者的挽歌，漫威给与了20世纪福克斯最大的尊重和敬意。
伯简,2024-07-26 03:42:16,重庆,3星,211,给人一种大清修明史的美感。
ElioElioElio,2024-07-25 10:23:38,英国,4星,940,看完电影像走完了半壁欧美圈，激动的心在滚动字幕化成泪，Ryan戏里戏外真诚的发言，青涩的Hugh和X全员，电影落幕是Fox给老观众的最后礼物和告别。很高兴重新见到老朋友啊，艾丽卡刀锋童年时期的漫威宇宙，查老板终于玩上牌，老埃文斯是最惊喜最爱的回归了，当年因为F4爱上HumanTorch和Chris，真没想到卸下盾后还能再见，短发胡茬结实又好看的身材和新制服，本来都在惋惜草率死了没想到Jonny你嘴真脏啊。X23又把我带回7年前大哭的首映，看着老狼寂寞离场。结局他俩抱着狗狗对视救活了我。剧情来说没有亮点第三幕更是平庸无聊至极，但能咋办呢，从零六年一部部看过来的很难不买单。I wait a long time for this teamup，you are the best wolverine！
LEのn个晴天,2024-07-26 03:09:38,北京,4星,826,我知道他们又是在黔驴技穷地大卖情怀，但当看到片尾第一个彩蛋Xmen大合集的时候我的内心还是哇哇大哭了。戴面具的金刚狼休叔太帅了！！！！！！冲出公交车后玻璃那个镜头给我帅飞了！休叔真的yyds这部更是登峰造极 He's always the best and one and only wolverine.桃总真是我靠卧了大个槽了竟然能在一部片子里又是美队又是神奇4侠的霹雳火？！漫威这帮鸟人也玩儿太嗨了吧？！！
O莙,2024-07-24 17:34:02,中国香港,3星,230,#B+ Cinema MOKO IMAX｜什么叫惊喜过后尽皆虚无，两个小时的情怀爆炸高潮过后像贤者时间一样坐在戏院门口出神，虚伪地向R级妥协却依旧跳不出主题乐园怪圈，因此看上去表面是福斯的体面葬礼，但其实MCU已彻底一眼望到尽头，如果这也算影响宇宙未来走向的重中之重，那这下就是真Jesus来也拯救不了Marvel了
其实我是衣柜,2024-07-26 17:25:27,中国澳门,3星,198,原来粉丝向就是大杂烩，拍的真的太糊弄了，迪斯尼真没资格说福克斯时代的漫威IP拍的烂
山人阿苍苍,2024-07-28 14:44:02,北京,4星,420,都能在电影院里看男男车震戏了还要啥自行车
白山墨人,2024-07-24 13:11:30,中国香港,5星,1491,不劇透沒法寫影評啊！200%粉絲向電影，過去30年所有跟漫威電影有關的梗的人物幾乎都出現了，最大的三個驚喜連我這死忠粉也只猜中一個，憑這就要給十星！！
韦肃,2024-07-31 16:10:49,重庆,3星,148,在多元宇宙的设定下，所有英雄的牺牲和粉丝的感动都成了笑话。
誒嘿嘿教主,2024-07-24 14:33:52,中国香港,4星,407,到处在展现老子有无数ip版权的傲慢嘿嘿，不停地有之前电影画面或者元素出现，有一些淡淡的怀旧，粉丝向友好，有一位还是很让人惊喜的。肯定不是最好，放低预期，但也不是最差，开心就好。另外三级片镜头不知大陆上的时候会怎么处理，那些暴力镜头是风格上是很重要的元素。
不拉不拉,2024-07-24 14:05:25,中国香港,3星,139,剧情推不上去；强行打破第四堵墙可以叠加的打斗场面就有点无聊了，看血腥镜头看睡了，不过来香港看的未删减版的，嘿嘿
××,2024-07-24 10:19:09,日本,1星,777,没绿灯侠好看
下雪了没有,2024-07-24 12:35:34,北京,5星,1296,一场Fanboys的狂欢，首映场的掌声密集度远超《奇异博士2》和《蜘蛛侠:英雄无归》，有几处惊喜客串看的人差点从椅子上蹦起来（漫威保密工作还是nb），说真的死侍可以从头到尾吐槽一整部我都不会看腻的😂
有迹可循,2024-07-24 11:42:22,中国香港,2星,605,无聊到爆炸
朝碧海而暮苍梧,2024-07-26 02:31:25,广东,4星,190,没想到美队你是这样的霹雳火
逃出熔炉,2024-07-24 22:11:11,广东,1星,590,假装有棱角，假装有自我反思，但实际保守至极的空洞之作
亵渎电影,2024-07-29 23:12:11,河北,2星,240,太聒噪了，毫无新意的彩蛋电影，他们明知道对方可以再生，不明白他俩为什么反反复复不停地互捅；还有那群死侍，不明白他们为什么要出来；也不明白大反派悖论先生为什么愚蠢，我厌蠢。可能观众习惯了电影很水，没有内容？看看彩蛋就很开心？难怪老马说漫威电影是游乐场。
AC,2024-07-27 19:03:46,广东,4星,195,不明白家长带小孩看死侍是什么心态，小孩能看懂这些成人幽默？能看懂这些梗？一直在十万个为什么，哇哇叫，真的很影响观影体验。
影志,2024-07-28 16:27:24,湖南,2星,287,扭臀、跳舞，看腻了老一套的东西，毫无新意可言。杂糅各种客串，并没起到点睛作用，节奏拖沓，尿点满篇，正如死侍自己说的那句台词：又水又长。漫威电影已从神坛跌入屎滩。多1星给说给金刚狼的那句“演到90岁”
你的邻居,2024-07-27 16:51:08,四川,2星,239,别跟我说平行宇宙、彩蛋这一套，首先他得是一部电影啊…都这么拍电影就没电影了 像是看了两小时的抖音
Infante,2024-07-24 13:53:03,日本,5星,1169,比其他合家欢电影要诚意的多，情怀制作都给足了，这个ultra 4dx厅喷水喷死我了，连狼叔吐唾沫都能给喷一下。狼叔嘴臭起来能给死侍喷破防哈哈哈哈我真的笑疯了，结尾很感动，当然我说的是幕后花絮剪在一起的那个结尾。
红酒与谋杀,2024-07-26 09:05:17,英国,3星,69,大银幕Dolby版。一部意图清晰、定位明朗、自知自嘲的shitty movie，承认主流超英大片的陋习与糟粕，以及作为游乐场所的实质。当然不必去强装cinema，正所谓物极必反，这片就是漫威大型主题乐园电影的尽头，几乎是一次对于在漫威多元宇宙经营模式下长期蓄积的工业废料和资源残渣的回收与加工，在这个意义上如此大搞特搞都显得异乎寻常地合理。比《蜘蛛侠：英雄无归》《奇异博士：疯狂多元宇宙》《蚁人与黄蜂女》等那些还处于深度昏迷的作品要好。
晚不安,2024-07-27 21:08:24,北京,2星,198,当《金刚狼3》以西部片的荣光帮这个悲情角色完成了妥帖的退场，死侍又偏要以一种消解崇高的方式来娱乐大众，为此不惜把前者那种深切的痛苦与挣扎，降格为无关痛痒的好莱坞公式。无论他多少次打破第四面墙代替观众吐槽迪士尼的商业行径，也无法抹除这部畸形大杂烩对我造成的精神伤害：存在于遥远的观影记忆中的神圣时间线被不断篡改，而两具不死之身互插的动作场面也显然无法带来任何痛感与刺激。这部电影的存在只是再一次证明，超英世界里愈演愈烈的多元宇宙概念已经彻底黔驴技穷，情怀沦为一种太过廉价的消费，内部梗的泛滥不断加剧着粉丝文化的自嗨与固化。
理想的愚蠢主义,2024-07-24 14:08:14,中国香港,2星,173,大型漫威Cosplay漫展。站在漫威的遗产上跳舞，但是跳得并不好看，的确是重磅彩蛋轮番轰炸，但全是踩着BGM登场接着很快离场，且非常考验观众对漫威的知识储备，虽然还是让人激动欢呼，但也就如同走秀一样瞬间而过，在短暂的插科打诨和惊喜彩蛋之后，主体是个不太合格的爆米花，哪怕不断地自我吐槽也没法掩盖情节的硬伤，彩蛋、自黑、打破第四堵墙永远只是添彩的配料，而不是化腐朽为神奇的借口。看到彩蛋只会让我怀念起X战警系列曾经的辉煌，所以扣一星。
大奇特(Grinch),2024-07-27 01:30:03,北京,1星,227,事实证明，我多年不看漫威电影是正确的。他们继续制作没有灵魂的电影，只留下失望的苦涩味道。两个曾经的漫画传奇变成了模仿自己的可悲角色，连悖论先生的动机都是如此的丑陋，许多情节并没有推进剧情，只是一味地抛出更多彩蛋，它们对未来的系列电影也没有任何帮助，只是在原地打转。它与漫威宇宙的故事线也没有特别的联系，是一部最好留在平行宇宙里的电影。
由迦可汗,2024-07-26 10:18:23,四川,1星,322,全片充斥着烂梗，大概十多年前吧，那时的华语电影充着在一部分靠堆积人物来吸引眼球的的电影，十多年过去了，漫威倒是也学到了，内容不行就让明星来凑，人们根本不会讨论这部电影有什么剧情，只会说这部电影有谁来了，谁作为彩蛋登场了，与其花钱找所谓的影评人尬吹，不如好好做作品，不过漫威也就这样了，靠着饭圈文化也逐步走向落幕，毕竟有意义有内涵的作品才能长存，而儿童乐园也就只能吸引儿童前去。希望漫威越来越好
贡布雷之夜,2024-08-07 20:09:20,江苏,2星,65,是不是觉得自己很幽默
兔安叽,2024-07-27 13:22:27,北京,4星,88,在大量梗中发现少量电影。在漫威宇宙里少有的让人感受到主创团队是真心爱漫威的角色，而不是瞎改八改出来圈钱。时间管理局随意抹去时间线和英雄，就像studio高管为了圈钱乱处置角色和故事线。某个演员的客串真的太好笑了，不剧透了看了就知道。
皮皮鸦,2024-07-26 02:49:40,四川,4星,100,太搞了 漫威粉狂喜
Cutsin,2024-07-26 11:35:23,北京,1星,263,被打4星5星的骗来IMAX，还是受不了话唠，配乐全程聒噪，每一分钟都是煎熬，工业垃圾
柯里昂,2024-07-27 13:58:35,湖北,2星,73,听了俩小时相声
Fleurs.哼哼,2024-07-26 02:56:24,河南,4星,71,漫威、迪士尼、好莱坞乃至美国电影都想重回自己的黄金时代，就像我们想回到那朝气蓬勃的二十乃至四十年。可大家都知道，回不去了
Just hold on,2024-07-28 23:08:56,上海,3星,85,剧本chatgpt写的吧
女神的秋裤,2024-07-26 19:31:18,山东,4星,63,字幕里的幕后集锦让人梦回超级英雄电影的黄金时代，比电影更让人感慨。全片都是情怀，客串彩蛋大爆发，老粉能看出满屏的彩蛋，一如既往很漫威。一句“让你演到90岁”，让人既激动又心疼，其他英雄演员换了一波又一波。金刚狼还是那匹金刚狼。即便他是最差的狼，他也是我心中唯一的狼。死侍+金刚狼实力为漫威挽尊，但也不能说漫威活了。情怀不是金钟罩，剧情弱到弱智…不想说了，只是更加怀念复联4之前，那些有漫威电影陪伴的夏天。
Vapiditys,2024-07-27 22:28:03,四川,2星,82,十几年老粉，这部梗能 get 到百分之九十五，但我还是想说这是目前最差的死侍电影，也是最差的金刚狼电影
叶烺,2024-08-01 02:21:46,英国,2星,79,以前的漫威：热血，搞笑，煽情。现在的漫威：想热血，想搞笑，想煽情。
粥粥爱吃八宝粥,2024-08-17 21:17:27,四川,4星,37,主要就是讲金刚狼积极响应延长退休新政策，以身作则，主动退休返聘准备演到90岁。
EMO ZOMBIE,2024-07-24 10:54:05,日本,5星,1125,The one and only Marvel Jesus!从彩蛋的密度及惊喜程度可以看出marvel真的已经走投无路了
UglY_MoNey,2024-07-27 23:38:49,上海,3星,59,这三十年但凡你少看一个超英片，少关注一个美国社会实事，都会错过一个梗。这就是个在梗上长了部电影。
木山豆睿,2024-07-25 10:28:05,英国,5星,583,"欢迎狼叔回归&回家！终于穿上经典黄黑制服！Deadpool+Wolverine, They are indestructible!!!还好Loki的结局不用再现，他俩并肩走出来了！彩蛋巨多，情怀牌打得人心服口服。还玩了Star Trek的梗，双厨狂喜。在CE美队形象已经烙印的情况下以Torch身份出现还挺会玩的。居然有Elektra和Blade这种古早角色出现，老中青齐上场，真的有点淘遍家底的意思。A vs X希望漫威早日考虑。狼叔因为Charles不肯对Cassandra下死手这点好嗑！ps.Happy办公室简直Dream Office，但是对着头盔和Arc Reactor很难不暴哭。片尾Fox时代青涩的X-Men和F4也叫人无限感怀看他们的岁月如白驹过隙。所以为啥Thor抱贱贱在怀里哭？"
苏菲sama,2024-07-25 11:54:58,中国香港,5星,262,笑到尖叫。这个贱人能不能住我隔壁啊，我要天天找他玩。。。。强烈怀疑死侍跟我是同一个mbti
Josephine,2024-07-26 17:36:15,北京,5星,209,霹雳火真的笑死我了！整个电影就是一个大型彩蛋，本来确实不值满分的，但是人家有诚意啊！人家真的为了观众狠狠的打了一场啊！
突然粉碎,2024-07-26 02:03:52,北京,4星,77,老福斯你走的很安详，被百般挖苦调笑也没了还嘴之力，但是你的经典角色会被所有漫威粉溺爱。叉男初恋的主题音乐变奏被反复使用，也是有心了
Liza（二級回發,2024-07-26 02:15:29,广东,1星,255,感觉被关在獄門疆里2个多小时
尔安宋🌈,2024-10-13 22:12:08,上海,2星,14,出于漫威之前的尿性已经不报希望了，没想到还能更失望，主故事相当于没有故事，复活一个这样的金刚狼意义何在？难道真的就是资本让休叔干到90岁？
MajorTom,2024-07-26 19:08:36,山东,5星,239,片尾x男花絮看哭了
Vc不爽,2024-07-26 23:01:18,河北,5星,179,要说不好看就是脑子有问题
Savica.,2024-07-27 19:34:50,上海,5星,108,一定要看最后的花絮 X- men粉丝泪目
DeckardYang,2024-07-26 23:31:25,四川,2星,30,【2】“老套”本可以是一种类型的魅力，比如今年的《X战警97》。本片最大的问题还是想象力的缺失，只能靠不断的客串彩蛋填补，叙事的苍白无力则被插科打诨所遮掩。然而这种手段注定是双刃剑，情感愈发稀薄，只有片尾字幕旁的混剪能感受到一点电影的魔力——真正的时间的回望。 w/c
Adward.kid,2024-07-26 21:19:06,甘肃,5星,145,车载收音机发出马戏之王的音乐时我整个人惊起身！！！！
公爵,2024-07-26 02:25:31,广东,1星,242,非常难看，《没头脑和不高兴》的故事，两位主演的人设甚至还比不上光头反派女，全靠堆打斗特效和血腥场面，非常薄弱的剧本，可以说是毫无内涵，看这种东西简直是浪费时间
文森特九六,2024-07-26 23:43:34,山东,2星,40,两星半。本质是经典的《午夜狂奔》那类冷面硬汉搭滑稽丑角的公路拍档动作喜剧，配以不再新鲜的情怀向客串彩蛋批量兜售（但仍要承认那些以福克斯、新线为代表的童年记忆们登场时还是惊呼了，尤其是霹雳火和刀锋）。两位主角互动的喜剧段落是最易出彩的，也基本是全片最用心的部分，大多数时间都充斥着愚蠢脱节的动作戏，系列一再重复的R级幽默套路，以及完全不过脑子硬尬一通的儿戏主线，让休·杰克曼的回归像以极其尊重的姿态完成的一场毫不尊重的亵渎。话说回来若该片更加成功则彻底印证了传统漫威品牌的失效，未来或有两条路：要么继续自嘲解构超英题材（然并不可能，调剂不能当主料，何况“死侍”系列这种打法自身也成了套路），要么无限靠近真实甚至日常生活（但很难摆脱超英题材解决问题的模式）。总之本片诞下的绝非救世之主，反而恰是混乱之子。
壹安²,2024-07-26 02:21:04,北京,5星,157,好似迪士尼对20世纪福斯版X男宇宙“遗愿清单”的满足。走下去，别回头，好好翻开新篇章吧。
xy!,2024-07-26 22:18:31,广东,3星,78,所有笑点都在埃文斯身上了。故事内容仿佛只是无病呻吟，用时髦的话来说就是没苦硬吃。
Nein,2024-07-28 10:41:05,北京,4星,55,给X战警系列和20世纪福克斯过的最隆重的喜丧！开场非常吊，甚至想为了开场和到处埋的梗给它五星，但主线真的很弱，太弱了，段子也撑不起一个电影啊！不过就为了这个开场就值得一次IMAX票价了真的，心中最好的开场top1
猛汉世雄,2024-07-27 17:40:58,江苏,4星,36,还行，虽然不是漫威粉，很多梗看不明白，但非粉也有别的乐趣，比如：死侍和金刚狼在一辆丰田车里的打戏拍得很像床戏……而且整部电影里都充满了这种男色擦边梗和下流话，我也是看得喜笑颜开。
魂,2024-07-24 18:06:42,帕劳,未评分,36,跟《闪电侠》一样拿了一系列来自破产宇宙的角色玩了个大杂烩。要说二者有任何区别的话，那就是《闪电侠》在很用心地讲它自以为自己可以讲得很好的“闪点”故事，然后堆了一大堆乱七八糟的CGI；而本片则完全躺平，人物塑造与故事线全都弃疗，让位给那个备受瞩目但实际效果平平无奇的金刚狼回归，连自己最爱制造的噱头都已经玩不好。正如死侍在片中调侃地那样：你的回归恰逢漫威宇宙低谷期
皇帝陛下的玉米,2024-08-01 21:14:26,浙江,4星,51,那辆本田比死侍和金刚狼加起来都耐操。
毛毛没有爱,2024-07-26 21:50:05,江苏,5星,109,活得久真是什么都看得到啊🥹
Fly  Away,2024-07-26 02:54:47,重庆,4星,40,纯粉丝电影，用最平滑最易懂甚至后续疲软的剧情去玩各式各样银幕内外的梗和彩蛋，从福克斯到漫威，从X战警到复仇者联盟，几乎把能联动的人物角色都拉了出来，甚至很多其他电影如《疯狂的麦克斯》都以场景到对话发挥了不少梗，可以说从头乐到尾，熟悉的打破第四面墙和死侍独特的脏话荤段子笑话如常充斥趣味，金刚狼的加入也能产生适量的化学反应，可惜电影的主线剧情过于单调，甚至最后俗套的英雄主义结局反而有点毁了这个“反英雄”电影，也会有种为了堆积彩蛋而强行铺进故事和危机，路人观感估计会很无聊。但看到最后字幕中以往所有X战警的花絮突然感动到不行，在X战警的回归漫威中却已经丢失了扮演黄金一代X战警的风光，失去的不仅是银幕上他们的再现，更是难能可贵的回忆，这部电影所带来的更有如忆往昔的交织记忆，但仅仅作为电影只是及格边缘
唯唯,2024-07-26 02:43:10,广东,1星,183,+；佯装为动作片的开心麻花电影，每当叙事无法顺利推进时便直接放弃讲故事，而后选择毫无底线地加快速率以此搪塞故事的敷衍和编剧、导演的无能。本片全部的魅力仅来自瑞恩·雷诺兹一人（他的速率相当独特），连休·杰克曼也只是一位来自前-超级英雄时代的“夜店男模”。
手抓蛋,2024-08-02 00:46:39,重庆,5星,83,谁要一分钟笑三次并在片尾字幕彩蛋哭出来我们就是最好的朋友
嵇澹,2024-07-27 13:06:47,浙江,1星,70,最为无耻的甚至还不是把量产彩蛋称作电影售卖，而是迪士尼盘踞在囤积成山的版权帝国耀武扬威的傲慢嘴脸，毫无自省如同片中在山寨madmax垃圾场吞噬各色被放逐超英的龙型存在alioth般，以情怀复盘为名炫耀着倾泻流水的玩具旧藏登场，而后罔顾剧作和人物逻辑地用后即弃，封印他们等待下一次的掘墓消费，对待福斯时代遗产和角色前任东家的卑劣诋毁亵渎由自鸣得意的字面意义破坏尸骨开篇起首定调。垄断巨头的盲目自信造就了粉丝导向的全片文本完全依赖观众必须熟知漫威世界和流行文化的衔尾蛇式自体吞噬增殖，多重宇宙越是链式扩张，其像垫底ip自揽救世重任一样本就建筑在虚空的根基就越不堪一击。标志性自我意识元互动脱离点缀解嘲定位霸占全屏后立即暴露ryan reynolds油腻单口相声的真面目，简直没有比这更垂死挣扎的收官姿态。
西楼尘,2024-07-27 17:04:40,江苏,2星,41,你是X战警里无愧的头牌，所有漫画都为你著书立传。我是应聘复联失败的卢瑟，连战衣都被锁在衣柜不敢穿。你因为没能拯救队友自甘堕落，我害怕无法挽救爱人铤而走险。就算被流放到虚空之地，也总有人占山为王。就算身处时间变异管理局，也总有人销毁宇宙。而那些宇宙是因为有我们爱的人，才称之为宇宙。
下一棵树,2024-07-28 16:14:51,重庆,4星,42,不得不说审查单位蛮拼的，为了票房指标把绝大部分捅刀子踢裆以及F-word都保留了；整体是相比虫3略为小众的粉丝向电影，最大的贡献是带来了一个巨他妈帅的漫画金刚狼，以及完成当初《黑凤凰》未竟的事业-给二十世纪福克斯办一场风光大葬。
仓鼠飞轮,2024-07-30 20:27:36,山东,1星,108,暂时我将他誉为漫威影史最烂，因为下一部肯定更烂
印子,2024-07-25 22:27:21,中国香港,2星,76,【5.7】空洞到爆炸的纯彩蛋电影，刨去那些fan service的梗和惊喜客串（我感觉普通观众要get到这些梗和彩蛋甚至都十分困难）基本一无是处。去年滚导刚示范给漫威怎么拍终章，这部反手就是一个开倒车退回那种靠彩蛋和客串填充的“多元宇宙要毁灭了，各宇宙英雄粉墨登场成功拯救多元宇宙”的后《英雄无归》时代典型模板式烂片…真的太无聊了…
