用户名,评论时间,IP属地,评论分数,有用数量,短评内容
秋里,2012-02-03 00:05:01,,5星,92,我步入丛林，因为我希望生活有意义，我希望活得深刻，吸取生命中所有的精华，把非生命的一切都击溃，以免当我生命终结，发现自己从没有活过。
梦里诗书,2015-05-14 17:26:43,,5星,71,《死亡诗社》对人自我个性的解放做出了最为理想化的诠释，更难能可贵的是其不仅仅只是制造了一个犹如乌托邦的毕业班级，终又以死亡这最为残酷的现实予以了主题的回归升华，理想化的开篇与悲剧性的结尾，引人深思于生命存在的真谛。
leni,2010-04-23 23:10:10,,2星,44,反抗权威的老师自己成了权威，真是呵呵后的一部洗脑片，现在想来和那些骂政府而红的所谓公知似乎还有点共通之处呢
Muto,2020-11-02 22:55:26,,3星,33,在寻求中，就怕我未熟的果实偏偏毒死了偏爱我的果实的人——幸或不幸，鲁迅先生的忧虑在《死亡诗社》这部严重过誉的电影里成真。本片探讨的是僵化的父权制在与浪漫化的父权制激烈碰撞之后的代价，以及对理想主义这种极具煽动性价值观的反思。即，对基廷教学范式的一种超越性批判。显而易见，代价就是这些脆弱的理想主义者之死。所以，自由根本不是核心主题，用诗意而非教义的眼光来看待死亡才是。事实上，影片里的学生并无自由可言，满脸困惑的他们不是被学校洗脑，就是被其对立面——基廷船长忽悠。人生第一课是认识死亡，从而让人意识到制度也是一种会死的生物。遗憾的是，学校总是忽视这堂必修课。所幸，基廷教授把这些无知的少年人「勾引」出了课堂，以其未熟的理念指导孩儿们把握当下。但在「及时行乐」语境下，天才的下场不是被流放，就是被死亡。
游民王阿牛,2008-09-04 21:15:07,,未评分,29,"Seize the day,and live deliberately"
虾坨坨艺仔,2015-09-19 10:10:32,,4星,95,【170】 结尾哭的不行了，这学校简直太像我的初中！然而煽情的感动背后还有思考，追求艺术的姿态是内心理想还是一种对体制反叛的迷恋？在不合适的时间地点描绘了自由的画面，是激发还是一场谋杀？也许没有这样的刺激Neil还能在体制内好好活着，在未来找到机会追求自由。O captain my captain
玛丽苏患者,2022-06-29 20:04:26,,2星,21,诗歌不是性骚扰的遮羞布 及时行乐也不代表只顾自己欢乐 罔顾别人的感受 诗社的大部分男生完全看不出对诗歌的喜爱两星给结局和“oh captain，my captain” 以及站在桌子上看不同视角 结局那个男生说他父亲杀了他是浅薄的 他学会了追求理想 却没学会基于现实表达自己结局被告发大概也是大部分现实中另辟蹊径教学和鼓励追求理想的老师的结局宣传的理念在今天依然适用 但整部影片没有很好表达这个观点 感觉像是洋洋洒洒写了堆日常后生搬硬套去切合主题
赫舍里清如,2017-03-29 07:27:34,,3星,31,英语老师放给我们的，她也是一个好老师，学生自杀的时候真的很虐心
Bork,2020-04-06 02:07:03,,2星,12,學校教育的工作目標，究竟是要擔當高度秩序化的社會的“預科”，還是賦予學生充分的自由空間，令他們可克服思維慣習，發現自己的更多可能性？在當代以美式價值觀為圭臬的政治正確下，後者顯然更加“正義”、聲量也更大，這部影片即展現了當代美國的文化理念（以基汀和死亡詩社為代表）是有多麼想與其精神宗主國英國的保守理念（以威爾頓學院的傳統體制為代表）相區隔和道別。但另一方面，這種有意營建的二元性，也顯示出影片對於“自由”的理解空洞和淺薄的一面，至少我認為它沒有充分尊重喜好現實主義詩歌、認同秩序的合理性和選擇“不自由”者的“自由”。而教師在課堂上激烈地表彰對“异己”的反感和排斥，對此我所更多感到的是一種同樣冷漠的權力意志，即便這“异己”是既有的體制或權威。疫情家庭展映季場次二十八（教育成長題材單元）。
三岛的玻璃球,2023-02-16 00:23:22,吉林,5星,38,青年版《放牛班》，群像版《在轮下》neil兴奋的拿出《仲夏夜之梦》首演的海报的那一瞬间，我看到了死去的自己和重生的希望。所以在他饮弹自尽之后，我才会像失去他的todd一样泣不成声。
吴辽,2023-10-15 02:30:46,日本,5星,35,我们都曾是追求星辰的孩子，最终却向强权妥协。仲夏夜的梦过于脆弱美好，我心中最单纯善良，本想一生去追随的东西，死在那个寒冷冬天。哦，船长，我的船长，人生如诗，对真理的追求永远不会停止。金融，工程，计算固然和重要，那是我们生存的条件；但诗歌，浪漫，爱是我们生而为人的原因。
曾于里,2012-06-25 21:25:36,,4星,64,"captain,my captain 当孩子们勇敢站上桌时，戳中泪点。"
星睡,2021-05-05 14:16:58,,5星,72,用自己的死换父母痛苦一生———最恨的复仇。
被遗忘的回忆,2023-04-08 23:25:51,河北,5星,50,站在桌子上，是代表着跳出体制，跳出繁琐，跳出只追求成绩而忽视事情本身存在的意义的现实。个人认为最牛逼的电影。最后学生站在桌子上向船长再见也成为了影史经典一幕。
黄青蕉,2014-08-16 22:22:46,,5星,36,我怎么不记得主角居然是豪斯的老基友！
我测伱㐷,2023-03-11 16:00:42,宁夏,4星,43,死亡诗社让我最深刻的是影响力且不谈内容的矫揉造作…谄媚豆瓣有一个影评说“是从一种盲从到了另一种盲从”从这个方面来看，仔细想想…人成长的这一生会遇到各种各样的人，就像田超之前说的那样，遇到的人，经历过的事情，必定会对这个人造成或大或小的影响。在还没有彻底找到属于自己的风格和人生道路时，盲从其实也算是短暂的影响。不过再过十几二十年，经历百态，当年的盲从就化身为经验和回忆，变成人生长轴的一个节点。
德小科,2019-07-01 06:47:00,,3星,11,传递垃圾桶、讲台上开导Todd作诗、Neil的自杀、雪地中的奔跑以及最后站在课桌上的几个段落冲击力和观感极强，在影像表达上挽救了这个在形式风格和叙事上极为平庸的电影。尽管文本内处处传达反叛、自由意志和个性化的价值观，在表达上却完全无法走出保守俗套的制约，只能用几个比较有新意的镜头来中和，险些就成为了喊着口号的视频公开课。同样的故事，如果更大胆一些，想想都觉得可以无比浪漫而壮烈。
Sarcophagus,2013-01-31 11:36:36,,5星,51,感谢没有译成春风化雨，还有什么壮志骄阳……六颗星……纯粹旋律支持
亚比煞,2010-04-22 12:49:10,,4星,74,my name is New Wanda
睡眠余额请充值,2023-03-18 00:43:50,辽宁,3星,16,6/10 我是真的喜欢不起来彼得威尔的电影，腐朽的价值观，陈旧的叙事结构，滥情的情节爆点，仍旧是用观众的情感冲动来掩盖思想浅显的缺陷
U 兔,2019-03-18 14:29:15,,4星,32,"近日重看，颜值太高，赏心悦目。以前回想起来会觉得基汀的角色有点“揍势”，现在明白了他的腔调，以及孤独、勇敢和可爱，而且电影是非常细致地一步一步深入的：第一课认识前人（珍惜时间）→撕书（为什么读诗）→站桌（如何欣赏以及视角）→踢球（大声读出来）→写诗（面对自我）→踏步（个人意志唤醒及节奏）之后较少表现课堂，之前课下的接触逐渐表现他们关系的递进，从尼尔的角色向他倾诉这一点开始，由群戏引向这条主干。剧作太成熟太稳重太有数了，镜头语言扎实又让人舒服，演员极有感染力。结尾让最弱的安德森第一个站起来也极有象征意义。可以说好得无懈可击，4星9分少一星只是个人喜好问题吧。20080624说：师生电影中比较喜欢的，虽然我看的时候已经挺大了。O Captain, My Captain对于英语文学爱好者来说真的是击中心眼了吧。"
bamboo,2010-03-10 19:23:08,,5星,58,有信仰与追求 是人生最美的事情
Steven-LW,2022-03-25 21:21:19,,5星,62,“金融，工程，建筑，计算，固然很重要，那是我们生存的条件；但诗歌，浪漫，爱，是我们生而为人的原因。”
Panda的影音,2012-09-15 10:46:04,,4星,42,"要不是看到「尼尔为反抗父亲规划自己人生而自杀」和「结尾特殊的送别仪式」，我只会给本片标记「★★★」。—— 2019.09.10：教师节特别重温观影。1. O Captain, my Captain. 哦 船长，我的船长。→ 泪泣。想起《放牛班的春天》最后离别的纸飞机。2.在理想与现实充满矛盾的世界里，我们的所学所想所作所为挺难一致。它要我们学会独立思考，有时却想方设法将其扼杀；它要我们追求真相，有时却运用权利人力将其篡改掩埋……3.发现并提出问题，不代表就能解决问题；4.我坚持了他没能选择的坚持，但他开了我没有开的一枪……P.S.：影片46分钟→宿舍Neil抢Todd诗…以及54分钟→教室John教Todd…两个段落的环绕镜头设计得挺有意思。"
