用户名,评论时间,IP属地,评论分数,有用数量,短评内容
顗礼,2024-07-26 08:53:25,加拿大,3星,24,《死侍：纵横宇宙》，这是一句不算剧透的剧透。在迪士尼挥之不去的阴影下为旧日福斯系漫威办了场葬礼，说没被触动是假的（无比喜欢某人的有效客串），但感知那些太过明确和可预判的计算（算计）并不舒服，基于梗文化建立的彩蛋与情节编排法几乎走向了一部正常叙事电影的反面，吊起胃口后又没有给出足够有分量的第三幕，怀念过往的仪式感建立与主线实际是脱节的，影片本质与同班底制作的《失控玩家》没有区别，都是迪士尼在炫耀版权的同时宣告自己大一统的战略。作为表述核心的“英雄存在主义危机”，以及重新找寻被扫尽历史垃圾堆的“失败品”的概念是有价值的，却也在某种程度上造成了严重的“观影门槛”，对粉丝来说是体面的告别，对路人来说或许就是灾难了吧
tangerine,2024-07-26 21:50:26,江苏,3星,27,漫威给福斯X战警的风光大葬，可能没有什么比彩蛋之前的花絮，能更好的总结所有粉丝这么多年一路走来的感慨了，但葬礼结束后实则是用X战警的尸骸打了一仗。故事反正是没救了，哪怕和《英雄无归》比都差的多，实现了要客串有客串，要特效有客串，要故事还是只有客串的究极不要脸，但这次确实也是第一时间在电影院感受了狂热，体验感到底是比高清三虫要好。就是这样下去故事也不用写了，编不下去就拉一堆过气角色回来客串，这才是真烂完了。最后除了情怀和已经一坨的多元宇宙，真让人觉得啥也不剩。
嘟嘟熊之父,2024-08-07 16:29:36,北京,1星,26,由一个个弱智设定和千篇一律的样板戏串联而成的垃圾片。自从嘴贱成为所有漫威人物的基操，死侍就像被剥夺了超能力，普到只剩下烂脸。闪回、内部梗、堆人头，希望立法禁止漫威片搞以上老三样。
揪心的玩笑,2024-07-28 06:02:55,重庆,1星,89,如坐针毡，剧本傻逼，内部梗不懂，避雷大坪ume影院，我对漫威好像再也没兴趣了…3D和话唠属性都太难受了
托尼·王大拿,2024-07-26 11:32:55,黑龙江,4星,29,"""漫威救世主""的名头属实夸张，但称之为""后福斯时代叉男系列超级补锅匠""绝对恰如其分：沿用前两部的风格在迪士尼的新时代继续极尽能事，对那些因企划、宣传、制作、丑闻诸多事件影响而始乱终弃的前朝旧党来了次精彩万分的回收再造，死侍系列的出色始终贯穿于银幕内外。"
汤包圈外男友,2024-07-28 00:26:14,山东,5星,70,献给所有漫威迷的情书，路人请主动回避
匪子,2024-08-01 09:00:48,福建,2星,39,漫威和烂网大的区别不过在于有钱请到一水一线明星罢了。
想飞的企鹅🐧,2024-07-26 02:17:53,陕西,1星,112,一泡雕花的屎，真的有钱能使磨推鬼。为了联动而联动，为了打戏而打戏，为了炫技而炫技。故事的基本要素起因经过结果，电影都讲不明白。莫名其妙的人物动机，莫名其妙的反转，莫名其妙的结局。金刚狼3完了真的别霍霍金刚狼的招牌了！金刚狼帅不帅，帅，死侍贱不贱，贱，特效好不好？好！打戏好不好看，好看。但是各个人物的行为动机，真的让我吃了屎一样。
徐若风,2024-07-28 14:10:12,北京,3星,33,低于预期。主要是多元宇宙逻辑混乱，导致困惑感压倒了爽感和情怀。为什么X23、牌皇等会被扔下来？为什么一百个死侍突然混战？...即使看过剧集《洛基》也仍旧莫名其妙的。且多元宇宙还带来一个问题：有成千上万个金刚狼，那这个金刚狼其实并不是曾经的那位，无形间削减了感动。全片最大亮点，除了狼叔贱贱卖腐/“互插CP”好嗑，就是对20世纪福克斯的调侃与“风光厚葬”，尤其片尾的花絮，全是我们成长的记忆啊。
可爱的小蜘蛛,2024-07-29 12:25:44,广东,5星,59,看完就一个问题，雷神为什么哭
我私人的风与河,2024-07-26 21:50:28,广东,5星,70,客观不了一点，请休杰克曼演到九十岁😭
蛋黄椰奶糕,2024-07-27 20:06:37,山东,5星,39,《死侍与金刚狼》不是一部电影，是欧美姐的复活节，也是迪士尼对我这个20世纪福克斯寡妇的专属强制爱To 20世纪福克斯：老公你就安心地去吧，虽然我跟漫威过得一塌糊涂，满地鸡毛，但是老公你也没法亡夫归来了，我们就勉为其难地将就吧，我会想你的，真的永久怀念，音容宛在！死侍3最后的花絮就是一场20世纪福克斯的亡夫回忆录，欢迎大家来参加我老公的葬礼，请带着欢声笑语走进，也带着欢声笑语离开！
Kimi,2024-07-25 17:53:11,中国香港,1星,89,怎么连插科打诨都那么无聊，如坐针毡
Sophie  Z,2024-08-02 09:22:49,加拿大,3星,28,金刚狼和死侍的regeneration能力让所有的互殴都变得pointless，同理是漫威的multiverse已经让所有英雄的死亡都变得无意义了，毕竟换一个宇宙就活了。以及梗里有太多关于两个演员本人的self-referencing了，真的很自恋诶。
半個斯文人,2024-07-26 16:52:41,山东,5星,83,献给漫威粉丝的情书
渡边,2024-07-26 16:46:31,江苏,3星,38,现在的漫威真是耶稣来了都救不了。
祝亚喆,2024-08-01 12:44:17,福建,5星,35,和fox说声再见吧，这部有点邪典的作品作为X战警的收官，比黑凤凰体面多了
ElizaBlack💤,2024-07-24 19:32:18,广东,3星,75,也许是漫威粉丝的狂欢，但绝不会是漫威的救世主，爆梗与血浆充其量还只是调味剂，失去人物塑造与故事表达让这部电影彻底沦为如同开心麻花电影一般的闹剧
白羊先生,2024-07-29 20:10:39,山东,5星,33,米老鼠站在20世纪福斯坟头疯狂蹦迪。
catcatcat,2024-07-28 11:56:25,辽宁,5星,34,Emma Corrin长得太像詹美了，怪不得让她来演孪生姐弟。我没看过王冠，一开始看到她，以为是詹美通过AI作的造型，哈哈哈哈
