用户名,评论时间,IP属地,评论分数,有用数量,短评内容
荆棘,2024-12-25 10:50:32,美国,4星,2,如果删去彭彭丁满的部分剧本节奏原本非常好的，尤其刀疤整个人物塑造完美，到最后居然让人非常能共情，丰满程度比木法沙要好太多。但是各种突兀的大特写360大回旋加上突如其来的大广角镜头是在搞笑吗......剪辑也是跳来跳去的乱切，迷之有一种钱全花在做特效上其他部门就凑合凑合得了的感觉。anyway期待不高，反倒觉得不错，尤其麦叔大白狮全片最帅还惊喜献唱一曲
总有蓝天,2024-12-21 17:30:38,山东,1星,10,一场备胎破防引发的血案
Peter,2024-12-21 11:38:13,云南,3星,6,后面的剧情转的太生硬了，前期木法沙和刀疤少年时候的故事讲的也不够深
Ciciaego,2024-12-20 16:15:48,四川,3星,15,名字是Mufasa，其实讲的是刀疤，讲的是阶级与归属，以及circle of life这个主题。但为了扣题，后半段落入俗套（特别是三角恋），有点失望。
寒鲲,2024-12-22 21:43:32,广东,5星,3,剧情方面真是一股子浓郁的欧洲中世纪王子历险传奇味道，也算是西方文学中的经典套路了，尤其是塔卡刀疤化过程中天的那种缺陷性格，与木法沙那童年坎坷后的近乎完美形成拧巴且纠缠的交织与冲突，幸好全员动物玩不了什么政治正确。视觉、音乐、节奏等各方面都是一如既往的迪士尼质量，发从肉出，拟真性极强，堪称业界标杆了。白狮的设定、刀疤的来历、拉飞奇的经历算是难得的惊喜，彭彭丁满的吐槽也是妙笔，尤其是版权那里，公然自嘲自家是地表最强版权捍卫者，只有迪士尼了
人九海海,2024-12-20 12:24:53,美国,未评分,26,咱就是说 刀疤儿应该单独拍一个
Xxin,2024-12-20 14:22:58,北京,2星,30,又名：《草原上的燃冬：再见雄狮爱人》。沙拉碧，你周冬雨啊？！
Parallax...,2024-12-22 20:14:24,北京,3星,4,影片剥除了血统与承袭式的王生王，将你必须成为王的逻辑转为了你是否有资格成为王的逻辑，但却将悲剧的源头赋予在了一只由女性狮子引起的青春期三角关系上，使兄弟间最初的背叛与恩怨情仇被塑造为是因嫉妒与自卑而出的报复，在这里一方面女性狮子又是作为原罪或者说潘多拉般的存在（除了三角关系这一灾与幸的暧昧形象也体现在用蜜蜂引发象群的骚动上），而另一方面作为后续支撑两人情感关系的铺垫与源头还是略显小格局且私人化与稚嫩了些，同比今年另一对相爱相杀的霸天虎与擎天柱的差异明显。
Ferr_lee0519,2024-12-21 02:29:09,福建,3星,12,想不明白堂堂皇位继承狮刀疤为什么比流浪木法沙瘦弱那么多
IRONiccc,2024-12-26 08:48:03,辽宁,4星,4,刀疤，一款荣耀王国安陵容，虽然一般但是饭吃到爽了，四星吧
CoolKid.✨,2024-12-20 16:25:51,河北,2星,26,有钱做特效不如多请几个编剧...
。,2024-12-23 23:59:21,北京,3星,6,Poor Taka……
,2024-12-22 13:25:03,江苏,3星,6,已经忍受不了任何大男主爽文了 狮子也不行！！！但是！！我们小犀鸟太可爱了太可爱了一出现我就听不到别的声音了 而且我一说小鸟在哪里它就出现了耶！（现在我仍然不知道沙祖出场的时候主角们在讲什么 （记录第一次参加南京米子团建(^^)（最后心疼一下疤子
Konano,2024-12-30 22:30:01,辽宁,2星,4,家门口终于有激麦了，所有奔跑的镜头都好好看，然而木法沙和刀疤反目竟是因为争女人也亏迪士尼能写出来，人物关系硬转折都和正传接不上，史诗级自砸招牌有一套，跟擎天柱威震天起源比高下立判，公主听了一夜爷爷历史课后对天一串狮吼还不结束，原来是为了迎接弟弟出生，活狮也有很多地狱。
﹍我是靳小轻♥♡,2024-12-26 20:50:52,法国,1星,1,小时候看第一版狮子王的时候，Mufasa就是我心中永远的王了！后面辛巴高弗都远远不及它，终于可以有机会看狮子王自己的故事了！还有麦叔竟然来自配音了！——————12·26更新:我宁可没看过这部剧，幸好没看那个男频剧男主的配音版，要不真得0星。
xu,2024-12-20 19:35:37,上海,1星,24,只能说太差了，真的太差了，永无创新的剧情，无聊到爆一眼就能知道下一步要干什么的剧情，只觉得刀疤真是太惨了，自己救了木法沙的命，给自己埋了个大坑。自己母亲智障不培养儿子培养个外来的，被木法沙偷了王位还偷了爱情，也不知道母狮子为啥一眼就爱上他了，就必须来点主角光环，这刀疤不反都逆天了。感觉木法沙就无所不能没有任何弱点，男二啥也不会只能当陪衬，女主人设立不起来必须只能当男一爱人。这种俗套的剧情在十年前就已经看腻了，为什么主创现在还要写这种？真的无法理解2024年还有这样的降智剧情。全剧唯一正常人只有刀疤他爹，那个智障刀疤妈如果听他爸的直接驱逐影片到此结束都比我在这坐两小时强
Talent,2024-12-20 22:17:58,江苏,2星,9,狮子王前传。画面升级了。补了故事，失了内涵。刀疤人设非常割裂…
Wongwongwong,2025-01-04 17:11:42,中国香港,4星,0,成王之路好累好麻烦啊。。原来刀疤不是二胎，带入他的视角，真的挺不爽的！！爸爸们都好短命_(:з」∠)_
小旗,2024-12-20 11:27:47,北京,2星,22,延续第一部真狮版的全部缺点尬点，不看都能脑补出八成的剧情，从头儿到尾也没死一只小动物，迪士尼终于榨干了最后的一滴狮油
宋夕,2025-01-05 21:58:23,德国,2星,5,歌不错，但是唱的少，景不错，但是审美疲劳，最佳镜头，大猫伸懒腰，故事很烂，果然，父权糟粕编到最后都成了“精神男同”。PS称王那一段，尬得我脚趾抠地，感觉不止是父权了，简直是白人霸权的体现了。凭啥食草动物要主动向狮子狮子俯首称臣啊？团结起来能战胜白狮子，那就也能战胜黄狮子……
冷秋星落霜,2024-12-21 18:24:14,辽宁,2星,9,一星给特效，一星给狮子的萌。故事特别低幼，特别无聊，感觉木法沙改名叫水法沙吧。歌曲也远不如海洋奇缘。
andarta,2024-12-20 09:02:14,法国,2星,24,没想到看完了，给12岁以下小朋友看还行吧。以上就算了～
Sebastian,2024-12-26 00:04:28,北京,2星,4,shame on u disney 这都什么烂歌？？这剧情根本撑不起这时间啊 要不然干嘛加那么多剧情之外的串场戏？哦 不对 再给3铺路吧？？地震戏拍的….坐上王位……哎 硬来…..
BC怎么说,2024-12-21 19:39:53,四川,1星,19,下面我将列举本片三大罪状:1.完全违背生物学常识，木法沙怎么可能作为幼狮在其他狮群存活？2.完全违背地理学常识，你告诉我非洲哪里有那样的雪山，非洲第一高峰乞力马扎罗有这么多雪？3.完全违背人类学常识，木法沙抢了刀疤爹妈，抢了刀疤老婆，还抢了刀疤的国王，这种不忠不孝不义之辈怎么能当主角？窃国者罢了。
RRRR_,2024-12-21 02:48:37,四川,2星,11,画面很棒但是此剧情……我想吐槽的点真是太多了，塔克这角色的工具属性也太强了吧，好几处剧情上的设计都让我觉得不甚合理且生硬，完全就是为了写木法沙而创造出来的一个工具角色;其次，经典的因为女人而反目，哈哈哈老套且搞笑剧情，已无力吐槽了;前面多处“你到雌狮群里去”“你难道想在雌狮那边待着么”之类的话，木法沙与雌狮关系密切，由雌狮教导狩猎等内容，再结合辛巴唯一的女儿，我还以为要讲雌狮不输雄狮，雌狮当国王呢。结果根本没有，且结尾还生二胎男宝……fine
谋杀游戏机,2024-12-20 21:28:37,北京,2星,7,昏昏欲睡，好无聊的故事。国配用词幼稚，音乐剧段落歌词翻译也不咋地，总结就是跟看儿童剧似的……@上海迪士尼大剧院
宫唯明,2024-12-21 22:39:12,江苏,1星,3,简直堪称是今年最难受的观影体验，一会昏昏欲睡，一会头痛欲裂。我这看的哪是电影啊，简直就是一坨同质化的工业垃圾
Evelyn,2024-12-30 11:13:54,美国,1星,11,滚 狮子是母系社会
blanche,2024-12-22 16:21:56,浙江,2星,4,太奇怪了，两小无猜到反目为仇主因是母狮子。刀疤黑化几乎没有缓冲期，虽然从一开始就叠了一堆buff，仿佛害怕观众不知道两狮子绝对会反目为仇，隔一会就要从台词提醒大家，注意了塔卡以后会黑化，ps这些狮子都长得太像了
mysticark,2024-12-29 15:27:30,山东,2星,0,不得不说这是一部让我哭笑不得的狮子王前传作品，而且现在美国会做这样一部动画是让我很纳闷的事。
我也不在乎,2024-12-27 08:15:45,河北,2星,0,原来19年引发我不适的正是狮子王😅 已经忘了我有多讨厌仿真动物张嘴说人话了。。。动画片我能接受，还有为啥都是罗圈腿。强调不看血统出身也能称王所以这片子是美民主党支持的？川普和出身移民家庭的哈里斯比才是那个出身更好的吧？三种狮群三种生态价值观，田园/扩张还有个啥找一个大树sleep&fuck?刀疤就是哈姆雷特，复仇的纠结？PS.Hakuna Matata没有版权不能唱？我爱Seth Rogan
查理曼大帝,2024-12-21 22:41:25,英国,2星,0,好无聊……
Kevin君,2024-12-21 19:09:53,浙江,2星,2,这片子最让我惊喜的是Kiros是麦叔配的，但同样的价格我为什么不去听张杰唱歌呢？
OVERNIGHT RUSH,2024-12-26 03:21:39,加拿大,1星,2,用动物形态拍龙傲天耀祖电影，登味儿溢出之作，求断更🙏
