用户名,评论时间,IP属地,评论分数,有用数量,短评内容
悄悄,2016-03-01 16:55:31,,5星,11886,看过了这一部，我好像能够更坚定地说我会当迪士尼一辈子的粉丝。迪士尼给我们营造的乌托邦就是这样，永远善良勇敢，永远出乎意料。
Digit Fungi,2016-02-26 04:20:45,,5星,8781,无论是人设，世界观，动画制作，还是剧本，都挑不出毛病来啊啊啊！！细节多到爆！！好幸福！！！！>w< 最难能可贵的是配角们的人物性格和形象设置都非常饱满（教父梗好惊喜>< ） 虽然是动画，但是剧本还是隐射很多人类社会的种族问题，以及政治两党上位之争的问题。另外我狐Nick的眼神是在太苏了TwT...
影评终结者,2016-02-26 10:28:40,,5星,7014,完爆冰雪超能头脑，动物再次证明了动画片不止是给小朋友看的，而是全年龄段和世界级的，尖端数码特技、新意剧情、老梗新用搭配萌Q画风，乌托励志、搞笑温情、自然销魂、阴谋反转，用动物来映射人类，涉及种族歧视和两党斗争，无论从制作技术还是政治倾向或是社会意义来说，基本锁定今年奥斯卡最佳动画
黄青蕉,2016-03-07 20:47:43,,4星,6089,港真，面对人家动画片里连一把椅子扶手上的铝合金划痕都做得活灵活现的态度，咱们就默默低头学就好，不要一天到晚吹“国产视效大片”这个概念了，略尴尬
羚羊的灵魂,2016-02-23 22:03:30,,5星,5940,做冰棍那机智的不像话！！！全片最爱！！！想吃！！！
云淡风轻,2016-03-04 03:40:45,,5星,3104,不要看任何影评，如果可以预告片都别看，直接买票就好了。你要啥这电影里有啥！
诗人橙子,2016-02-15 07:14:40,,5星,3112,绝对的好片子 裂墙推荐。实在是因为另一场满了…随手挑了这个片子。真是5分钟一小笑 10分钟哄堂大笑。看那个又懒又慢树獭简直要锤墙了。旁边法国妹子精辟的吐槽！看！这是我们法国人。我要憋到内伤了。最后散场大家都静坐着等着整首歌放完…五星好评。2016年度十佳。
tina,2016-03-01 16:29:52,,5星,2973,赞 看完赶脚世界都美好了
白桃苏打气泡水,2016-02-28 16:31:09,,5星,2791,想嫁给又吊儿郎当又酷得不像话的狐狸先生。自认为是奥斯卡长篇动画的有力候选。啊啊啊，真的好好看，我要去二刷。
Marcus,2016-03-04 02:41:17,,5星,1120,赞到惊人，大迪斯尼动画一年比一年精彩！朱迪只身去陌生的大城市追梦，让我又追忆起自己那美好而充实的留学生活了。Sloth们的每次出场自己都要笑到面瘫了！而朱迪跟尼克哭着道歉的那段我也跟着哭了，朋友之间有时候就应该这样把脸拉下来好好道歉！总体反映的各种社会现象以及政治问题都很贴切到位。
桃桃林林,2016-03-04 17:41:25,,4星,4603,不仅是个小孩子玩玩闹闹的喜剧动画，成年人同样可以很享受这个故事。一个动物的乌托邦，理想与现实。有一个有趣的案件，又有很多关于人类世界的暗喻与指涉，还有教父或毒师这样的小梗。以及狐狸和兔子都那么可爱，那么搭。
✿Suda✿,2016-02-28 21:18:36,,5星,997,超~~~~~~~~~~可爱的。大眼睛看得我都化了。一想到未来狐狸跟兔子可能有感情戏，我就hhhhhhhh。那只长耳朵的狐狸和那群二哈狼是我的笑点！！！
小斑,2016-03-02 07:45:03,,4星,4191,故事流程对小盆友来说不艰深对大盆友也不无聊。树懒那段，跟法国公务员打过交道的都会心一笑。兔子的微表情做得很棒。然而对所有的群体标签统一嘲讽的结果就是下意识也贴了标签（比如狐狸必然聪明却捞偏门，兔子一定是繁殖癌，猛兽全是雄性，etc）。最后，可惜世界不是一部迪斯尼出品的动画片。
北极熊,2016-03-04 21:02:44,,3星,1575,最精彩的动画是用想象力拍出真实世界难以实现的故事，而不是用动物化填充一段如果是真人就普通到不能再普通的烂俗故事。笑料有，萌趣有，但更有的是莫名其妙的主旋律和政治正确，恐怕没有评分所体现的那么出色。
CharlesChou,2016-03-04 15:12:21,,4星,3379,"对比Frozen又是一次进步，但迪士尼家的反转还是太好猜，在最明显的线索被披露前真反派其实就已让人隐隐有种感觉。但抛去这点不看整部电影的主题和执行都堪称模范，还顺带早早地贡献出了今年最佳CP。""You know you love me.""(整个人在椅子上被苏晕"
张小北,2016-03-05 10:43:01,,5星,771,迪斯尼最近几年最好的一部动画片。不但娱乐性超强，而且主题和人物的深度也已超过一般动画片的维度了。
亵渎电影,2016-03-06 23:34:16,,4星,2027,好莱坞这套讲故事的模式可以把全世界都吃的死死的。
早日退休瑾朵朵,2016-03-05 16:30:37,,5星,686,求同款录音笔！
m89,2016-03-04 11:49:21,,4星,1836,换了新领导就是不一样。迪士尼暗黑大电影，洛杉矶罪案片风格和内核。还真是动物乌托邦，美国针对有色人种，欧洲针对难民，天朝针对公知和五毛吗？人设精彩，细节丰富，但要说创意超《头脑特工队》显然就不实事求是了。
铎奇,2016-03-05 10:55:39,,5星,705,妹想到，老娘弯了一世，被一只动画狐狸掰直了。兔子我也爱！迪士尼启用女性主演真是太成功了，迪士尼现在从小孩就倡导的男女无差别教育好棒噢。警局前台基佬豹好萌！
影志,2016-03-15 22:55:25,,5星,393,100个人可以看到100种解读，太多细节主题值得称道：重视与忽视、尝试与安定、偏见与包容、恐惧与误会…流俗或新鲜，都在这样一部颠覆性迪士尼作品里放大呈现。“我们都有很多弱点，却也有着更多珍贵的共通” 第一次摸到羊头的狐尼克、睡觉时数自己的羊、爸妈总会在紧急时刻来电…朱迪兔的道歉直接泪奔
Otocolobus,2016-02-24 03:47:33,,4星,1165,"故事中规中矩，立意却是小孩看了笑大人看了深思的寓言故事。It's a story about minority, stereotype and acceptance. I'm glad disney plants the seed of equality to every child who sees this.兔子跟狐狸是最佳拍（情）档（侣）！警局前台豹子不是gay你找我！迪士尼彩蛋都棒棒的！"
周杰伧的小粉丝,2016-03-08 14:01:42,,4星,1091,疯狂动物城最现实的一点在于，兔子想做个好警察，她确实也做到了嫉恶如仇，恪尽职守。但她在面对杀人如麻的黑帮老大时，毕恭毕敬，甚至还成为了老大外孙女的教母，实际上就是认贼作父了。这可不就是最现实的现实。
AuraWang,2016-03-04 19:30:22,,2星,366,我不喜欢 近年来的最差 预告片把笑点亮点都透干净了 视效观感好差 大部分场景在黑夜 3D看得real心累 而且3D很差劲= =本来以为会对真实世界讽喻 结果肉食动物发狂的原因竟然那么无脑 前半段的bully情节 各种过分的嘲讽 兔子绑架狐狸过分 动作场面也拍的很一般 看完只觉得浑身不爽
米粒,2016-03-08 11:06:03,,4星,435,车管所的那些树懒是照着王思聪画的吗😂
梵蒂冈的妇男,2016-03-05 22:55:02,,5星,463,我希望所有孩子能看着这种电影长大
云中,2016-03-06 16:15:56,,未评分,745,至于吗？我都不敢说坏话了。
yangbin,2016-03-04 19:24:03,,5星,446,17年奥斯卡最佳动画，你好！
喷子,2016-03-23 23:49:43,,1星,184,白男意淫新高峰。明确的种族与身份划分，且几百年前血腥屠戮不该影响几百年后和平共处（继续奴役）。白男成功学贩卖，乡村有色裔女性无比向往的X国梦实现。市长是无辜的，警长是用心良苦的，小流氓是心地善良的，人性化背后是现有权力结构的巩固确认。树濑呢，不过是再次对少数族群做出番温和取笑罢了
Wanderer,2016-03-04 06:50:11,,5星,365,我们也许进化了，但内心深处我们仍旧是动物。偏见，歧视，评价，用固有成见把别人框在小框框里，只是为了自己过的容易一些。那么努力地证明自己是对的，却也不想让别人给自己贴上标签。生活有点疯狂，我们经常会犯错。不管你是哪一种，改变从你开始。
芦哲峰,2016-03-10 18:20:26,,3星,285,动画本身是不错的，一贯低幼的迪斯尼，拍出了皮克斯的水准。但是把电影当做传播价值观的工具，是无法令人享受到由单纯艺术带来的更为纯粹的乐趣。这段时间感觉整个世界都在倒退，西方正如《疯狂动物城》一样，从自由选择走向政治正确；而天朝则越来越像《动物庄园》，在大步流星地奔向朝鲜。
淡島百景,2016-03-05 12:47:05,,2星,160,感觉这个片的白左癌非常严重啊。
朝暮雪,2016-03-07 20:52:28,,5星,199,“别人家的动画片”。
水湄物语,2016-03-11 14:49:27,,5星,206,为什么你们要扼杀一个商业天才啊！！！单日5倍盈利，这是什么样的能力啊？！ 只有我一个人对结局不满意么？
迟到千年,2016-03-01 09:41:26,,4星,590,打分好高啊！每个动物都好像真的存在的人（一开始上班场景里的长颈鹿完全就是李光洙……）（reception的豹子好像我那个很娘的同事……）一开年就赢了，笑点多内涵丰富。
掉线,2016-03-04 21:37:11,,5星,323,【A-】设定出彩却不仅仅是消费设定，凭这点就比小黄人之流不知高到哪去了。剧本朝类型片上靠使得娱乐性在动画界无出其右，“动物城”的表像带来数不尽的萌点和新奇，而与人类社会并无区别的本质更让主题直指现实。【MD我这么严肃干嘛？真的炒鸡好看啊！！！第一次萌上动画CP了！快拍续集啊迪士尼！！
Ramipasu,2016-02-27 21:56:14,,5星,382,激萌！并且告诉小盆友和大盆友们，不论种族不论背景人(动物)人(动物)平等，即使是弱势群体(请自己代入现实)也不可以搞极端手段来求取认同。
可可爱爱乔,2016-03-04 23:01:10,,5星,136,有没有一百星可以打，真该感谢这次是北美同步。我更觉得这是一部电影而不是动画，因为迪士尼构建的世界太真实。往深了看，带偏见做事对人是很不nice的~往浅了看，这样一部好笑又萌萌哒的电影绝对是生活必备。and 要二刷
夏了夏天,2016-03-03 11:12:15,,5星,112,卧槽！！！简直就是惊喜不断啊~~~~
yiS,2016-03-04 23:03:47,,5星,276,看完之后朋友问了一句，如果这部片不是动画，还能过审吗？的确，在越发压抑的审查制度下，这部片能突围，实在很难得，很值得一看！
根,2016-03-04 20:42:09,,4星,237,除了萌就是萌了！不过剧情简直就是一集加长版的摩登家庭，尤其是那个巨像Cam的豹子
张小瑾,2016-03-02 23:19:46,,5星,111,这是2016年迄今为止看的最棒的一部动画！有笑点，树懒激萌，全场都是要哭了！教父还有breaking bad的模仿梗也特别赞了！有泪点，来自不同圈子的友谊的摩擦！还有深思！
陈圆润,2018-01-27 23:41:00,,4星,152,哈哈哈那是我第一次在电影院看动画片，音乐很棒～朱迪和尼克暖的，印象最深的画面当然是银行那里了哈哈哈唉
同志亦凡人中文站,2016-03-25 12:33:05,,4星,144,动物的人格化很成功，几乎可以直接代入真人来演了。从Frozen到大白到动物城，迪斯尼动画算是找对了类型片的感觉。狐狸和兔子谈场恋爱，光想想都萌萌嗒。树懒那儿直接笑岔～～～
九尾黑猫,2016-03-28 15:42:18,,2星,148,不是塞了很多隐喻就是好故事，放在人身上没意思的故事，换成一群外形可爱的动物依然乏味。到最后，可爱变成了刻意，“内涵”变成了说教，几处致敬也毫无新意，乏善可陈。
岛上的夏奈,2016-03-29 11:43:19,,4星,157,为什么大家都喜欢树懒啊！最萌的明明是基佬豹子前台呀！
Dr.Ray,2016-03-04 22:59:47,,5星,109,9分。进击的迪士尼！说是神作也不过分~Zootopia才是更适合它的名字：把现实世界与动物城完美转换，各种致敬与隐喻讽刺包袱萌点应接不暇，几乎从头笑到尾！人设太迷人！如此大的野心，让大人孩子各取所需！得承认是有一些套路的东西，然而看完全片，你打高分的冲动根本按捺不下啊！
木卫二,2016-03-05 00:40:09,,4星,120,伸出你们的爪，摇起你们的尾巴~树懒啊水獭啊树獭啊水懒啊，就情情爱爱眼睛泪汪汪打转什么的太迪斯尼了，其他似乎都挺好的。
深深的蓝,2016-03-04 02:16:38,,5星,92,这部动画不靠卖萌取胜
尚在影,2016-03-04 02:34:01,,4星,279,迪士尼这次太会玩，狐狸和兔子都在一起了，你还相信童话吗？故事欢快有趣，情节跌宕起伏，一会一个惊喜，还有好多大家熟悉的梗：let it go、教父、绝命毒师、碟中谍、狮子王，后面还不忘用盗版碟带回大家的回忆。最搞笑就是树懒那段，结局反转的不错，世界观价值观到位，社会意义值得认可！
东篱,2018-01-28 19:24:15,,5星,93,树懒实在太搞笑啦～哈哈，风靡一时的表情包，朱迪和狐狸先生好可爱
麦垄风来翠浪斜,2017-12-20 00:12:54,,4星,87,怎么说呢，对于里面的树懒先生，因为我是他的迷妹，我对他的喜爱只能用啊啊啊啊啊啊啊啊才能形容了。
anewpig,2016-02-27 16:48:04,,5星,307,很难想象居然是傻白甜的迪斯尼拍的！虽然是动画片但写的用心寓意很深 估计不少成年人能从中有所共鸣... 作为一个加班狗三俗狗花痴狗 喜欢女主家的275个表兄妹 叨叨逼逼的前台和慢到整个世界都不好了的树懒 还有站定了兔子狐狸CP 编剧也是入戏太深 动物裸体天然浴场什么鬼哈哈哈哈哈哈
沙门,2016-03-08 10:29:21,,3星,198,有一个问题，动物城里的肉食动物们吃什么肉？
艾小柯,2016-03-19 18:45:30,,4星,102,可谓美国文化与价值观的一次绝佳大放送。故事整体还好，非常美国非常好莱坞，而有些桥段的确绝妙。
AsuraHu,2016-03-04 02:06:29,,5星,203,埋梗埋得太开心了！《教父》！《绝命毒师》！迪士尼各种经典！Shakira！种族和政治隐喻赞爆！最重要的是！好！笑！死！了！这对cp超戳我的点！最后一段秀恩爱甜到不行！以后黑人可以用“你调情还不如一只狐狸！”了呜呜呜呜萌哭。
冰拿铁,2016-03-03 01:27:46,,5星,82,喜欢每一个人物啊！老是期待兔子和狐狸有点感情戏什么的~~~树懒慢到整个世界都不好了哈哈哈哈
卢十四,2016-03-11 22:32:19,,5星,67,看《疯狂动物城》，感觉就像看乔峰打太祖长拳。都是最普通最寻常的套路，硬是打出了武学名家毕生追求的至高境界。
姨妈的鸭,2016-03-08 22:17:17,,5星,90,消除动物偏见从你我做起：我是鸭子我也可以是女的。
jiojio,2016-03-01 23:20:57,,5星,129,简直就是布鲁克林奶奶动画大电影啊！Jake狐和Amy兔！
frozenmoon,2016-03-06 15:50:55,,4星,87,动物乌托邦/反乌托邦，罪案类型，童话，各种萌细节，各种小讽刺，很赞很赞。
柏林苍穹下,2016-03-05 00:47:24,,4星,51,“所有动物生来平等，但有些动物比其他动物更平等。”——A面是底层人物翻转世界的理想主义正能量，B面则展现出和谐城市难以根除的族群矛盾阴暗面。乌托邦、乌合之众、美丽新世界······诸多概念化的设定，尤适于观众根据自身的需要进行过度阐释。
古尔齐亚,2016-03-13 18:41:01,,5星,80,水獭对政府效率的比喻简直可以给满分
严箫玉,2016-03-05 12:02:39,,5星,55,觉得动画越来越适合表达抽象主题了，真是人类演员没法做到的。觉得会是年度动画片+政治片最佳。
狗骨头,2016-03-04 23:06:17,,5星,58,我只能说，妈呀，也太好看了！从冰雪奇缘开始，迪士尼就不满足于只做普通的童话故事了，里面剧情各种反转，结局意想不到！
迷宝,2016-03-04 20:59:42,,5星,41,好看哭了！但是树懒要红了，不开心！
温言,2016-03-05 22:03:33,,5星,48,我只想知道，如果移民动物城，我可以嫁给狐狸嘛？！？
玑衡,2016-03-24 13:20:54,,3星,146,为什么那么多人会认为这部政治洗脑片好看……每一句兔子说的话都是propaganda.
心生,2016-03-05 10:53:17,,4星,44,怎么说呢，奥斯卡刚结束，明年最佳动画长片提名已确定一个了，迪士尼动画创作力令人感动！明确影射人间的作品，浓缩不同地貌，不同物种，反差的阴谋。在一部轻松的动画故事里，完成大量讽刺和批判！《教父》又被致敬了哈哈
乌鸦火堂,2016-03-06 20:56:05,,5星,36,看片时旁边坐一熊孩子，全程不捣乱，也跟大人们一起哄堂大笑，好久没见这种光景了。一部没有人类动画片打通全年龄级审美，迪士尼告诉我们，故事老套不要紧，也不怕内涵与深度问题，把角色替换一下，换个角度全是新意，狐跑兔萌CP，狮入羊口，树懒、夏奇拉、教父、大耳狐全是笑点与内涵，超赞
大-燕-威-王,2017-09-02 16:30:01,,5星,37,这部片子让我想到一个体制内的同事，他的想法是：动画片就是给小孩子看的，而且多数三观不正，他将来绝对不会让自己孩子看动画，要从小给他们进行爱国主义教育。他刚结婚，正在和他媳妇备孕。讲真，我真同情他们未出生的孩子。
小波福娃,2016-03-12 21:14:50,,5星,44,1)zootopia其实不是动物乌托邦，应该是动物园乌托邦，区别在于动物园本身包含了一种秩序格局和权力分配；2)明明是反刻板印象的动画片，各种笑点全部都要靠刻板印象来制造；3)兔子不是警察嘛，居然当了黑帮老大女儿的教母，黑白两道通吃，细思极恐。政治正确能拍这么有趣也是难得，很好看。
高歌,2016-03-05 22:23:11,,4星,56,好莱坞的政治正确病简直到了晚期……
Bless_U,2018-01-05 21:01:40,,3星,132,树懒真的超级搞笑，哈哈哈，不过狐狸形象不是很喜欢，觉得跟兔子没什么cp感。
琦殿,2016-03-04 16:17:48,,4星,67,兔子和狐狸没有CP感啊！
eita,2016-02-21 07:40:20,,5星,184,全程笑裂！超慢速水獭素预告片就已经笑死，还有🐑睡觉也要数绵羊的梗啊哈哈哈哈！既能教育小朋友树立正确价值观又能拉低笑点的好电影
朝阳区陆依萍,2016-03-04 20:54:41,,1星,69,天了噜，这居然是一部迪士尼动画.....
小痕呀,2018-04-04 22:16:53,,5星,21,是那种在电影院哈哈哈哈哈哈完，回家咂摸咂摸还挺有深意的那种喜剧动画片，我很喜欢，里面每个动物都塑造的非常立体，可以说是人类社会的一部分影射。
宁宁,2018-04-01 23:59:59,,5星,25,喜欢兔子和狐狸的组合，剧情很幽默，动画制作精良，给人留下深刻印象！必须五星！
贪吃的胖虎,2016-03-06 10:54:08,,3星,79,盛誉之下强拉了基友去看结果很失望。仅有的几个特别好笑的笑点都被预告片曝光了。对社会正义的讨论最后又是老套路通过抓住坏人和个人和解了结，结构性的批判说着说着就没下文了。
风信子,2018-03-30 07:35:49,,5星,36,超级温暖超级励志超级治愈，心情不好时的观看最佳选择。
慕詩,2016-09-26 14:45:35,,5星,20,适合跟小朋友一起看，很萌很可爱，场景效果很好！
橘猫爱吃鱼,2018-03-29 10:11:58,,5星,31,一部非常具有现实意义的动画片，情节很有张力，值得一看。
美神经,2017-08-01 22:50:38,,5星,20,最喜欢兔子朱迪了🐰
Adieudusk,2016-03-09 10:53:23,,3星,57,看了《疯狂动物城》，好莱坞帝国忧心忡忡，可仍然相信小人物能改变世界。这样骗孩子我都看不过去了。我喜欢狐狸，不喜欢这个电影。
熊想躺平,2016-03-06 08:58:45,,3星,72,豹子说兔子cute是歧视，警察局要AA。一些种族的天赋是生生生，另一些种族的天赋是抢抢抢。黑帮都是毛熊，地下室适合种草，Vote Bunny for utopia! 可怜了半个电影院的小盆友们。
夏树,2016-03-06 02:18:25,,5星,32,我想不出一种形容，能把这部电影和其他【好看】的电影区分开。是不能用语言形容的好看。狐狸和兔子的角色设定也是意味深长，影片三观极正。夏奇羊的演唱会上四只伴舞老虎，完美还原了现实里diva们的肌肉男舞团。以及，警察局的豹子前台，兔子隔壁很吵的邻居，估计一定可能绝对是同性恋没跑儿了……
Peter Cat,2016-03-08 06:26:50,,4星,69,政治正确本身不应该够成扣分点（主流商业片你还想看到什么呢？不想看政治正确就不要看商业片），但如何植入政治正确则是高下立判功夫。就个人来说，已经好久没有这样被一部商业片满足了。。。让人懒得去挑剔，而不断觉得创作者很聪明。
K,2016-03-06 09:38:17,,4星,55,不得不承认这片子确实好。教父梗满赛！
你在百花深处,2018-01-08 13:12:28,,5星,117,超喜欢的一部电影，百看不厌，喜欢兔子和狐狸的cp啊啊啊
邓安庆,2016-03-06 15:46:16,,4星,72,政治正确的动物乌托邦。步子还可以迈得大一些，比如兔子跟狐狸谈恋爱，生出来狐兔。科技昌明，动物之间可以跨物种而交配，动物城从此多出了各种新型混交物种，从而引发了短时期内的混乱，伦理上的，实际管理上，城市的空间布局上，都会有好戏看呐。
匡轶歌,2016-04-24 23:52:12,,3星,49,So，那些食肉动物吃什么肉，成了一个困扰我的问题。
安德烈大叔,2016-03-04 22:04:14,,4星,49,作为一部动画它表达的足够多足够深了，人类社会的各类偏见和歧视要是真像电影里那么容易解决就好了。虽然一开始就猜到谁会成为大坏蛋但是基本不影响观看，因为细节太丰富。教父那段笑抽了，可是电影院似乎只有我在笑，可见我有多孤独。
栗,2016-03-07 10:22:17,,4星,54,当兔子柔情地将爪放在狐狸的爪上，狐狸假装不动声色缩回，我的脑洞已经不受控制了。怎么讲，狐狸和兔子之间显然弥漫着男女的张力，但最多友谊一场，毕竟不符合世界观，这种似是而非的微妙恰好击中了我。
内陆飞鱼,2016-03-26 18:14:47,,4星,37,讲了一个村姑进城打工的故事，爱笑的姑娘运气都不会差，说的就是兔子朱迪。台湾版角色翻译好，狮明德，志羚，洪金豹……这个我喜欢。
炫3D,2017-05-12 14:55:57,,4星,28,成年人，却喜欢在这样的动画片里找快乐和哲理。
shininglove,2016-03-04 12:01:56,,4星,40,用动物城类比人类社会，以甜蜜蜜的成长童话开始，层层剥开黑暗内核，我们总是太容易下标签以偏见待人，野蛮不是洪水猛兽，有色眼镜才是。世界观设置，价值观传递，软实力得益于多元宽容的社会氛围，这是赵国人可望不可即的。
齐木楠雄,2016-03-08 15:36:53,,4星,23,总体来讲还可以，但没有觉得值得接近满分这么高分啊，没觉得比其他好莱坞动画好多少，为何如此受到迷之追捧……狐狸挺苏的，兔子说食肉动物本性和最后开走整个火车头差点导致证据全毁的时候真是猪队友，树懒的部分最好笑
苏幼,2017-02-21 15:31:29,,4星,22,看完后觉得整体挺好，里面的人物设定真心有心，主题曲和插曲还不错，是值得去看的
顾俏乜,2017-06-06 21:43:00,,4星,22,看似软弱的，往往很强大，看似天真无邪的人，往往伪装的很好。
