用户名,评论时间,IP属地,评论分数,有用数量,短评内容
谢谢你们的鱼,2025-02-04 19:01:26,北京,3星,17,前半段很有趣，最后有点不知道怎么收，男女主角的爱情也太多余了，其实更关注文学与欲望之间的关系会好很多。朴智炫多演电影吧！
不是CD是DC,2025-02-11 16:37:17,内蒙古,3星,0,那么回事吧，中规中矩。
叶呀小白,2025-02-11 16:05:44,江苏,3星,0,想知道女主的键盘哪能买到
申小,2025-02-11 16:53:36,四川,3星,0,有趣思密达～
hangain,2025-02-04 22:53:08,河北,3星,11,很有意思，在我们还在歧视网络文学的时候，他们已经在为成人文化据理力争了。最搞笑的是，爸爸为了女儿放弃成人小说的写作，转向童话创作，女儿为了父亲，想写好童话，却误入成人小说。最后魔改白雪公主和七个小矮人，和开头呼应，这父女俩，可真逗，最终也没扔下童话。
🚧Rhéane🚧,2025-02-05 20:53:22,江苏,3星,12,解说阴蒂构造这一段我高看这片子一点
rockandcannele,2025-01-11 21:35:34,韩国,2星,19,在成人喜剧里加亲情桥段就跟带父母看这种片子一样尴尬
ibelieve,2025-02-10 01:16:55,广东,3星,1,朴智炫太美了啊啊啊啊！崔始源是真的完全不在意形象了。
リアチュウ,2025-02-04 11:24:36,安徽,1星,23,崔始源太灾难了(演技和发面的脸)
FY7,2025-02-09 10:49:18,湖南,3星,1,韩国性喜剧，笑点很足，朴智炫真的太美了，bgm也挺好听。
обломов,2025-02-07 10:41:31,江苏,3星,2,角度太神奇
雪印牛乳,2025-02-04 01:28:34,上海,4星,43,非常搞笑的性喜剧
e,2025-02-04 15:41:57,陕西,4星,5,故事很简单。加上了黄黄的h，意料之外的好看
Devlali Number,2025-02-05 23:07:40,北京,5星,3,哈哈哈哈哈哈哈好胡来的剧情！小白的天性解放让枯树都重新立起来了（不知道为什么…有一点点《喜欢你》的感觉？可能是那个发癫的福瑞控动画吧？？）虽然但是，朴智炫无脑满分！三观也很正，现如今这个道貌岸然的社会，成人的基本权益才是需要保障的吧！！（wait，不看简介甚至都没看出来这位是崔始源，大哥您咋了）
对方正在输入……,2025-02-09 16:55:41,辽宁,3星,1,喜剧效果有了，但故事和尺度一般。棒子国的无需送审就是敢拍敢演。崔始源也开始馒化了，也是有些年纪因素吧。喜欢朴智炫，百看不厌，公务员的双重生活，父女俩为了彼此受困于童话故事，但并不快乐，更多的是负担，为了快乐选择自己的生活很重要，最后女主也是结束了双重生活，过上了她生气时说的边旅游边写作的愿望！整体故事编辑和节奏都很平叙，没有太多虐点和出其不意。轻松成人喜剧，大头照科普那段还算可以。电梯里的前呼后拥和女友探班部队那里还算搞笑，三个女人一台戏，两个女友的故事先期开了个好头！最后还是父亲的成人童话点醒女主，也成功击败坏人！请让朴智炫多演电影吧！
莫选好片,2025-02-08 22:56:34,江苏,3星,1,没营养，但挺可爱。
坏蛋小李,2025-01-20 09:37:30,山东,2星,15,朴智炫，姐，咱好好去拍财阀刑警2不好吗？为了艺术献个身得了，还总拍这种剧吗？
ZeonGin Sou,2025-02-04 11:05:09,广东,3星,6,不错的喜剧，桥段确实好笑。比较可惜是没有写“双面生活”，只是一个引子和反转伏笔。不论女主角还是反派，流量之道都是实拍生活灵感。只是，女主角是取之有道。高潮一战比较理想化。
Junohu,2025-02-05 10:17:18,德国,4星,3,整体是轻松幽默的喜剧，带点擦边也依旧有趣，朴智贤演技确实强，千戏千面，文能驾驭多种风格，武能为艺术献身，怀疑成东日这个AI换脸是在映射龙叔的《传说》，骚瑞真没绷住。
些晕,2025-02-09 14:41:46,广东,3星,1,朴智炫我真的百看不厌！
折翼的蝴蝶,2025-02-07 11:33:15,广东,3星,1,设定有意思，但执行上差点意思。
展不开,2025-02-04 04:55:50,广东,2星,9,甚至故事都没讲明白..
IRA,2025-02-10 14:57:29,浙江,4星,0,朴智贤可爱极了，美出了新高度，喜剧演的不露声色，清新自然。剧探讨的，也不是什么高深的道理，用喜剧的外衣包裹挺合适。成年人的性文学，儿童看的童话，其实本质上没什么区别，唯一的区别在于受众。受欢迎的能经受时间考验的，都需要文学功底，都需要才华。让一个写童话故事的清纯女生，阴差阳错的去写成人情色小说，本身就充满了喜剧。其实画面故事都很正经，但是少儿不宜的内容也时不时的飘过，闪烁在鉴黄组的屏幕上，小说家的丰富想象，和各种科学搜索中…… 其实大人们之所以集体捂住孩子的眼睛和耳朵，可能只是觉得解释起来太累，不如直接切断接触面。
秋奔客,2025-02-11 13:25:37,广东,3星,0,卡司养眼，作为性喜剧中段有几个不错的桥段，可惜后来拼命上价值讲些廉价的剧情，然后编剧不管是童话还是成人文学功底都不行
Zoom.Quiet,2025-02-05 00:09:44,广东,2星,2,"#是也乎,(￣▽￣)电影工业一切元素都很合格,可无论怎么快进都躲不开尿点,女们美的不可方物,可是故事的节奏,逻辑,线索..都是离散的, 完全不知道想表达什么.."
白菜呀,2025-02-08 22:50:48,江苏,4星,0,女主角挺漂亮，有点像谁呀？！
kinder23,2025-02-04 23:43:09,中国香港,3星,1,题材和想要调侃的固化思想挺有趣的，不过越到后面就越有点草草了事，避重就轻。
hitlike,2025-02-11 07:47:07,黑龙江,3星,0,在性喜剧领域日本反倒不如韩国玩的转，这个希望有人拿出 50 万字论文研究一下。
Ms. Kay,2025-02-07 23:58:57,上海,2星,2,万万没想到，第一次在影视作品中看到致敬《阿飞正传》独舞片段的情节，竟然是在这部。25分33秒开始，男演员晃着膀子扭着腰肢试图“颠覆前作”，精神可嘉。
晓思丽英,2025-02-06 02:27:17,天津,3星,0,50
MOMO,2025-02-08 22:11:12,江苏,4星,0,最喜欢军人那一段，超级搞笑。
moss,2025-02-02 12:29:58,上海,2星,3,啥也没有
演员🎬,2025-02-04 03:18:55,黑龙江,3星,3,擦边擦出正能量，也是有点为难了。不过，文学性很高。
岛上的夏奈,2025-02-07 16:33:14,广东,1星,3,女主角的每一个微表情小s都会摔手卡的地步。
张小晗,2025-02-06 21:54:27,甘肃,2星,0,感觉好久没见过性喜剧了
pinkmark,2025-02-06 19:09:17,江苏,3星,3,轻松搞笑，带点sex，蛮好的！
oh la la,2025-02-07 16:07:09,北京,3星,0,韩国每年都会有部叫座的轻松地sex喜剧。从《色即是空》开始，这次也不例外，特别适合在家和亲密的人看，懂得都懂，只是没想到东方神起的欧巴现在胖成这副模样
Gaetano,2025-02-10 12:17:35,广西,3星,0,演员演得都不错，年轻演员也都长得好看。就是导演水平不稳定。按理说是个商业片，导演一些片段拍得不错，但是另一些片段拍得非常干，像是看艺术片。感觉是不是配乐少了，应该上情绪的地方，缺少音乐渲染。还有就是特写拍少了，近景太多，镜头变化有点单调。而且一些戏缺少故事张力，就是平铺直叙，缺少情绪反转，没有起伏，没有把观众情绪调动起来。一些桥段的故事铺垫也不够，让人觉得转进得莫名其妙。剧本其实还行，还加入了大火的chatgpt做桥段。
珜洮,2025-02-09 10:11:12,黑龙江,3星,0,很可爱
birth20200313,2025-02-03 11:18:19,湖北,3星,4,梦想与现实冲突，探索被拒绝的情感
被嫌弃Q的一生,2025-02-08 18:24:16,福建,1星,1,像是实在没剧本可拍但不拍又没钱挣所以好歹拍一部而诞生的剧本，结果就是一场灾难
红彤彤の彤,2025-02-09 22:21:00,山东,3星,1,又污又干净的反差感，这是怎拍出来的，也是绝了
没事就躺会,2025-02-05 21:10:34,澳大利亚,4星,1,就单看电影来说，挺好笑的啊，有戏剧冲突，写的故事确实挺禁忌的，挺好玩的题材。。女主好漂亮啊，崔始源发面馒头般的脸一点都配不上女主。女主真是写这方面小说的天才，看什么都是素材，怎么可能不成功啊
之遇,2025-02-08 11:01:05,山东,2星,0,不知所云！
独孤行二,2025-02-04 01:00:57,湖北,3星,2,打响人类反击AI第一枪，至少写同人黄文方面人类还是占据优势的。回忆起当年看河智苑成名作的快乐时光，都是老港片的余晖。崔始源的脸简直不能看了！
佑灰猫,2025-02-07 17:38:40,四川,2星,0,感觉没之前韩国那几部类似大尺度情节的爱情片好看呢。。崔始源没之前那个sm电视剧的泪痣男好看
先生尚淺,2025-02-02 19:30:04,吉林,2星,1,可惜了
冲玄,2025-02-07 00:43:50,福建,3星,1,朴智炫是真好看。不过这部剧情好无聊，部分桥段尴尬的脚趾抠地，中间差不点昏睡过去。
新生,2025-02-07 22:23:54,陕西,2星,0,漫感很重，有些无聊。
斯宾克斯21,2025-02-05 02:17:34,云南,5星,3,你可以不写童话，你按照自己的意愿生活。
透出的微光,2025-02-05 23:09:28,天津,2星,0,一位女作家，非工作时间的成人小说写作之路，没有喜剧元素、没有搞笑场面，成东日给年轻后辈捧场，不过如此罢…☕️
꧁꫞꯭心꯭星꯭,2025-02-04 17:33:58,安徽,3星,3,剧情转折太过生硬，韩国电影始终不怎么卖座，最终也只能靠大尺度小制作搏一搏人气。成人童话明明是一个很有意思的话题，最后却落在惩治渣男和公务员体制上，实属浪费。
影视圈前沿观察,2025-02-05 18:17:35,北京,2星,0,我对这种漫画感太强的韩国喜剧一向是不太感冒的，总觉得过分夸张是日本喜剧的专利，这种腔调弄在韩国喜剧身上，就显得格外的怪腔怪调。
一只狗,2025-02-04 21:52:59,浙江,3星,2,轻喜剧，男女主的主线爱情引而不发有点过于保守了
Covfefe,2025-02-08 16:57:17,山东,3星,0,韩国喜剧片，画面色调喜人。
普罗米修斯,2025-02-05 20:37:47,浙江,1星,1,这片子的剧情真的是想到哪拍到哪…
陆天明,2025-02-09 22:32:06,山西,3星,0,！
梦之安魂曲,2025-02-04 15:50:43,江苏,3星,1,还算是有趣的，女演员都挺好看的。
Fornever,2025-02-10 14:06:47,美国,4星,0,这就是我们这个时代的三级喜剧吧。
momo,2025-02-08 20:18:37,浙江,4星,0,好奇编剧是谁
siwennen,2025-02-06 13:18:17,北京,3星,1,好久没看性喜剧了，没想到韩国竟然贡献了一部。不像《美国派》那样屎尿屁无下限的性喜剧，这部竟然还是略显小清新的性喜剧，不过关于性方面的喜剧段子，也是管够，尤其是女主角看啥人都要来一炮的段子，还挺好玩的。另外，女主角我是从《隐藏的面孔》认识的，在那里边可是大漏特漏，又清纯又性感的样子真是惹人爱，这次到了性喜剧里反而不漏了，弄得我只好把《隐藏的面孔》再看一遍，过过眼瘾。
笨zhu,2025-02-02 22:04:28,韩国,3星,2,挺好看，收尾差点意思，女主演技也差点。
去北极跳海,2025-02-09 17:42:32,吉林,4星,0,挺好笑的瑟瑟轻喜剧
虚无野种,2025-02-10 14:04:40,浙江,3星,0,挺好笑的，作为喜剧来说挺幽默。
Lucifer,2025-02-10 20:01:47,北京,4星,0,挺搞笑的，确实说如果尺度再大一点，比如有《隐藏的面孔》一半，就会极其风靡～
plink,2025-02-08 22:28:57,安徽,2星,0,孩子，拿出轨当笑点这并不好笑
叽叽喳喳,2025-02-09 18:16:11,四川,3星,0,故事蛮有趣的，可以多套路一点童话跟成人的故事就好了
十三世,2025-02-10 01:16:39,四川,3星,0,朴智炫是可以挑起大戏的，不可不必再脱了
褐,2025-02-06 23:02:16,浙江,3星,1,是和想象不同的轻松有趣，涉及禁忌却不打擦边球，好感徒增。只不过剧情难免有俗套，看得人像是在坐过山车，虽然有偏爱但是不愿常坐，三星已封顶。
林佳树,2025-02-04 14:21:58,广东,4星,2,闺蜜分享的电梯故事真的很有感觉hhh成人部分的片段很搞笑哈哈哈，女主只有吻戏没有船戏
敬民,2025-02-08 17:07:37,内蒙古,4星,1,挺好看  挺轻松的  不要太较真
ejw,2025-02-08 12:44:07,广东,4星,0,开心就好
月球风格,2025-02-07 18:40:01,内蒙古,3星,0,空有噱头
迷影虫,2025-02-08 20:52:38,河北,3星,0,被女主和片名骗过来的。个人觉得就连这样体量的CG减龄技术也比成龙的传说强。
idouyue,2025-02-09 11:24:31,福建,3星,0,主题很成人，剧情挺正能量的，还不错。
苦瓜太甜,2025-02-09 22:04:13,河北,未评分,0,女主闺蜜的两个故事是最大看点，怎么不多讲几个呢
岩大壮。,2025-02-08 23:15:00,云南,3星,0,立意很好，但是剧情一直想用擦边擦出正能量，差点意思
合衬,2025-02-03 18:08:22,北京,3星,1,后面剧情有点包饺子
梦游歌唱家,2025-02-11 15:19:21,海南,未评分,0,好喜欢女主
teruhyde,2025-02-01 11:00:40,广东,1星,3,垃圾，啥也没有
水晶蝴蝶,2025-02-09 21:00:11,辽宁,3星,0,男女主角比较帅！一心想成为童话作家的女主角，阴差阳错写起成人小说，一发不可收拾成为专职成人小说家的故事！韩国电影对于性的探讨与大胆展露，是先锋鼻祖式开放，既诙谐幽默爱情伦理多种调料大汇合，却烹调出不一样的味道与风情。
V我50请你吃🍟,2025-02-08 22:06:56,浙江,3星,0,2.5⭐，设定倒是很有意思，公务员写童话故事，又写18x成人小说，不避讳对性爱的描绘，伟光正版擦边，还怪励志的。。但是主角最后转变成写18x童话故事是什么鬼，到底谁想看白雪公主出轨小矮人又混杂小矮人爱王子的bl故事😟这种事情不要啊། – _ – །
ZHOU,2025-02-04 17:34:03,广东,3星,1,虽然没什么内涵，但朴智铉几好睇。
WerWer,2025-02-08 00:05:43,北京,5星,2,幡然大明白，有正经工作，下班后写不了东西是因为写的不是黄文
Haru,2025-02-11 00:59:28,北京,3星,0,没营养没深度，但非常减压放松，不需要动脑一笑而过，也很值得。
Chihiro,2025-02-05 21:24:34,北京,1星,1,没意思
Dorothee,2025-02-11 15:00:14,北京,3星,0,搞笑性喜剧，但是没有ltns拍得深入，很多角色（比如崔始源）其实是可以没有的，两人的爱情线也有点不知用意。冲着成东日点进来，真的有70了吗？
别处,2025-02-04 03:45:29,四川,4星,0,还挺好看的！
Izayoi Aki 4.0,2025-02-06 14:52:07,浙江,3星,1,眼前一亮马上落入俗套。即便如此，还是提出了两个好问题：成人作品的生产者、使用者与监管者的日常状态是怎么样的？成人作品的价值和意义是什么？
阿波,2025-02-08 21:57:52,山东,3星,0,还是挺好笑的
五柳君,2025-02-09 08:18:11,江西,4星,0,一喝酒就上脸红扑扑的女主，AI现在应该也可以写成人童话了
记得跳舞,2025-02-06 21:03:25,黑龙江,3星,1,有意思，是我小看成人文学了，女主有颜值有演技，男主也是个男的🙃
KD6-3.7,2025-02-08 12:31:47,安徽,3星,0,朴智炫真好看啊
沙仑的夏天,2025-02-05 11:25:10,上海,1星,0,什么三观。崔始源 堕落了。韩国人都疯了吧？
幻游诗人,2025-02-09 14:57:24,湖北,3星,0,小崔也开始馒头脸发酵了
桃雨,2025-02-03 00:35:38,云南,3星,3,就是不经意发现本心经过斗争后遵从的老套路，只不过是反差和尺度稍大了一丢丢。
산의 나무.,2025-02-04 16:01:49,天津,3星,2,"后面有点散,不过题材还不错,万幸朴智炫未来作品没有局限于这种赛道,不然可惜了,三星半~合格的商业片 崔始源的人设挺逗的。"
你们真的厉害,2025-02-10 16:45:21,湖南,3星,0,棒子还是有点意思
馋嘴,2025-02-07 21:16:54,北京,5星,0,有趣
ZUKIMIZ,2025-02-10 17:58:00,北京,1星,0,好他妈无聊，不待见女主
