用户名,评论时间,IP属地,评论分数,有用数量,短评内容
愔凉,2024-10-27 00:25:44,新疆,5星,66,京本的房间对于藤野来说是人生的薛定谔猫的盒子吧。小小缝隙里是无限if线的人生。打开，就固定在死者已逝生者前行的这条线里。我们终究会在未知的世界发生未知的事。这是人生的废话哲学，但也是伯牙子期知遇难求 高山流水心心相惜的动人。能治愈我们普通人对于分别的伤痛，也希望能弥合一些关于京阿尼那场大火后对于日本动画电影制作人的伤痕吧。十二个小时前刚经历的七个小时的飞行真的让也撑着去看的原因：因为是蓦然回首。因为也许有着if线和平行时空，可我终究是单向度的人，所以不想错过 在影院里看到真挚友情终会相遇的故事
TouMing鬼子,2024-10-28 17:36:51,中国香港,2星,54,+  完全赞同奥利奥短评。唯一出彩的是京本冲出房间的一段，“动”的意义也在一瞬间夺门而出。其他时候…只能说是将动画理解成漫画动的又一失败改编典例。既不懂静止的魅力，也不懂运动的魅力
囧之女神daisy,2024-10-30 15:36:51,广东,5星,28,导演在访谈里说这是对所有漫画工作者的歌颂，但其实水下，未尝不是对京阿尼惨案的怒吼。但却奇迹般地用一种日式的举重若轻，日式的融入日常表现出来。还有，一个人的内心有那么多美好，那么多勇气，那么多悲欢，但消灭这整个宇宙，“只需要一颗子弹”。
异见者,2024-11-01 17:36:21,中国香港,3星,19,如果说一部元电影经常充斥着干涩的自我指涉和in-jokes，那么一部“元动画”就其本身而言却一定是被最直接的情感所构成的，因为在这样一种后设的视野下，一切线条的起伏、一切背景的或是人物的运动都不再被视作任何它物的摹本和拟像，而是只是作为它们自身存在着，即创作者一笔一画的劳动，而所有这些努力最终都是为了重现出人们自己默默伏案工作的背影。比起藤本树相当刻意的原作故事，动画师们的工作更真诚，也更令人难以回绝。@Annihilator
连城易脆,2024-10-26 23:35:20,江苏,4星,20,真心不错，虽然我特别希望电影的情绪可以突破我的防线让我哭出来，但是最终还是差了点儿。不过已经很好了！无论是画风、人物、结构、主题、配乐都很喜欢，难怪会成为上影节爆款一票难求。两幅对称表达的四格条漫也很喜欢，两个人物的配音效果也很好。如今，《蓦然回首》已经破了全艺联专线上映的最快预售破100万、500万纪录，还超过《波西米亚狂想曲》破了预售最高纪录和首日票房纪录和首日排片场次纪录！所以，藤野京继续冲鸭！希望可以成为更有成色的票房黑马！另外，本片也探索了短片进入院线公映的新可能，就是片尾加访谈花絮凑时长，票房也说明了这样的作品也会有好的市场反馈。期待未来更多这种小而精的作品可以公映！
维昂维瑞耶,2024-11-02 17:23:31,河北,5星,37,那时复杂的是艺术，简单的是人生。后来，简单的是艺术，复杂的是人生。
老白,2024-10-26 13:44:52,广东,5星,15,只有真正热爱漫画和动画的这群人才能创作出来的作品，一种生活的勇气。
王梓宁（夺朝中,2024-11-04 20:51:57,广东,3星,20,十分忠于原作，却还是不如原作；改编成电影，反而失去漫画分镜的“电影感”。或许写给漫画的故事最佳载体依旧是漫画。
Nccrri,2024-10-29 20:51:06,北京,5星,48,我真是从头哭到尾，从藤野第一次进京野家看到几大堆练习本开始，一路哭到最后......
胤祥,2024-11-23 02:56:34,江苏,3星,8,#10793。加上对京阿尼的情感分可能才能勉强及格吧，故事本身就不太像一个友情故事而是利用控制更多一点，“漫画像电影”可能是种称赞，但动画电影做得像漫画实在就是有点说不过去了。唯一一点觉得有意思的是配音的河合优实，那段动画人物兴高采烈的田间暴走居然意外地跟《纳米比亚沙漠》里面河合优实扮演的女主角走路的方式好像……
kookyobject,2024-10-26 02:03:23,美国,5星,42,伟大！纯爱战士藤本树的漫画几乎我以前都看过，但在大屏幕看到后才真正意识到他才是属于我们时代的漫画作者。更加理解了宫崎骏《你想活出怎样的人生》结尾处老爷爷一生建造并守护的精美大厦的崩塌，核弹的废墟和创伤以及作为对此补偿而制造出的充满精灵和魔力的世界终将是个短暂精致的谎言。漫画作为有限的格子之中worldmaking的媒介在确定的开始（藤野在小学漫画专栏被京本打败的那个自己原本安定的世界突然被外部的事物击中的时刻）和确定的结局（京本的死）之间生成出无限的可能性。再一次蓦然回首，使所有逝去的爱又重新活过来，一种残忍的、没有未来的、只属于当下的精神救赎。Don’t look back in anger. 又想好好读书学习了！
acaleph,2024-07-31 18:32:40,日本,5星,21,创造出这么美好的 拥有过这么美好的 然后毁灭掉 反正哭惨了 在山间的两个小小背影
张苑希,2024-11-08 16:02:27,湖北,3星,12,非原漫受众观感略显平淡。篇幅本身短小叙事又这么平铺直给，如观精美PPT似流水账匆忙划过，缺乏某种循序渐进的情感驱动力。至于双女日常相处和为漫画奋进所展现的不对等从属关系，极大折损这份情谊的厚度，套《天才女友》镜像成长公式根本言过其实，京本更像藤野满足私欲成全自恋幻想的工具。
刺猬接口,2024-10-27 19:36:30,重庆,2星,50,只有藤野的自我沉醉自导自演自恋，没看到有京本这个人，更谈不上两个人友谊了，更愿意理解成这一切包括因为抄袭杀人的事都是藤野的内心世界
彦,2024-10-27 00:06:00,广东,5星,28,漫画情诗，还原得好，浪漫冷酷得也刚好好。藤本树将自我一分为二，一个是为天赋本能所驱动“藤野”，另一个是纯然的热爱“京本”。从前者画下第一个四格漫开始，一生就只剩下”画，画。画!”这个选项。画了四格画短篇，短篇过后是连载，生要画，死了更要画。成功学意义上令人振奋的瞬间只有起伏来去的榜首皇冠与“动画化决定!”，完全无法弥补京本的离去。“你为什么还要画漫画呢?“——因为一开始就不是“我”选择漫画，而是漫画选中了“我”。欣喜要画，哀恸要画，热爱的时候要画得更好，恨它之际竟然连止住画的想象都做不到。最后那张贴在玻璃窗上的空白四格就是藤野此后的人生风景与深渊，她将用毕生的矫饰与剖白、自卑与野望、痛苦与怀恋、我执与解脱填满它。承蒙诅咒，痛饮苦酒，报偿祝福，致每一个创作苦行僧。
FLYPIG,2024-06-19 01:14:45,上海,2星,54,就普普通通啊……一分钟一块钱的票价倒是挺贵 SIFF23大光明
沿岸低飞,2025-01-05 12:55:32,北京,3星,23,特別害怕給這種類型的電影打分，又好看又難看的讓人無法評判。每一次表達都很細膩，但卻又缺乏深度，每個人物都直擊內心，但卻只是撓了個癢，😮‍💨
ミヨ実,2024-10-29 02:10:12,挪威,2星,64,谁告诉妳社恐就是像唐氏综合征患者一样说话的？ 笨拙的声优—齪薺。还有为了煽情硬凑死亡剧情太老土了。两个星给日常画风。
神秘金针菇,2024-10-26 22:50:33,江苏,5星,33,几度落泪…给原作做了不少加法，增强了四格白纸的呼应，多了只有声优能带来的情绪、只有动画能表达的动态感，唯一一点配乐有些太满了，缺点灵动。
重返闇夜,2024-06-17 14:13:56,上海,4星,51,我绝对不是唯一嗑这对儿的人！@siff
阿蕭,2024-10-16 03:36:20,美国,5星,41,很戳我的点是女主在狂练了很长时间后发现对方的画画功力依然比自己还强，然后她就停止了作画。想起刷到过的一条社媒评论区：你是什么时候意识到别人的天赋是自己如何努力也追不上的。当然这条评论区不适用于此片，但是那种决定了放弃的决然非常深刻。
Happy Together,2024-10-29 20:49:30,江西,5星,36,黑暗中你随吹开门的风拥抱我
刘小黛,2024-06-18 09:10:40,上海,3星,37,#SIFF#没看太明白，也没任何触动，单从电影角度线条也不流畅，就是二维还原，加点可爱表情，没什么想象力。旁边座位一个男生抱着周边又哭又笑，应该是漫画骨灰粉吧。
江湖郎中调研,2024-11-10 15:10:56,陕西,5星,21,爆哭！无论在哪个时空以何种方式我们都会相遇！创作者找到自己的灵魂伴侣，度过了青春期、走过了职业生涯的初期，彼此都成了对方生命里不可缺少的成分，这是怎么也无法斩断的羁绊啊！！！小藤野在听到自己一直很在意的京本的赞扬和肯定后在下雨天跳起来奔跑的样子真的太好哭了哇哇哇就这样跑下去吧就这样画一辈子漫画吧！！！
мая,2024-11-07 22:16:53,福建,3星,19,6，无感，没啥意思，日式青春伤痕电影没有上千，也成百了，真的很难被打动到。只有四格画片穿越门缝的那个瞬间让我体会到了蓦然回首的真正含义。
Virgil,2024-09-07 14:07:29,中国香港,4星,28,在奇怪的地方看哭了还不止一次。女孩子的友情+BE我😭都说原著好？打算找来看看。动画到后面全是静止画面这点虽感动但好懒，不好意思不是很买账。不过我也不是全价买的……30蚊早场👌 @ Broadway Cinematheque
bbotonmi,2024-06-14 11:33:26,上海,4星,54,押山清高整了一出极其唯美的藤本树，但是动画化的改动极其不克制，甚至偶尔觉得冗余，不先入为主地观看是非常好的作品（树子哥我能不能也在电影院看到再见绘梨）
黑道少女沈來迟,2024-10-26 20:23:05,贵州,4星,42,“谢谢你带我走出房间。”
金刚,2024-10-25 23:23:23,北京,4星,17,收获了一份私人的感动。想起小时候，跟电影的主人公差不多的年纪，一个小学生去画室画画，从中午画到傍晚，日落回家。后来因为高考压力就放弃了系统的学习，只好在工作中野生成长，持续到现在。像电影的开场和结尾的画面一样，藤野同样的伏在一张桌子前画画，画着画着，就只有自己和故事了。画画是孤单的，但感动是长存的。
里相玉,2024-10-26 23:33:44,浙江,4星,19,他意识到，还没有人为创作者的背影做过动画，那背影浓缩了许多伏案工作的人天马行空的一生，却是影像首先想摆脱的静止部分(这或许是戈达尔想问的问题:为什么电影不拍工厂？其中不是有爱的gesture吗？)押山清高的演出作画让人激赏，但始终是那静止的、单纯的部分处理更值得揣摩，最后抵达那个问题“为什么还要继续画”，创作者怎么可能不心动，我小时候的烦恼简直和藤野一模一样，一是怕别人比自己画得好，二是觉得漫画几十页画不完。(话说这套流程实验完是否能看到未来的改编方向呢？）
失意的孩子,2024-10-27 22:36:20,江苏,4星,16,我妈以前在印刷厂上班，经常拿一堆边角料白纸给我订成本子，让我画画，家里人那时也常夸我画得真好，以后可以当画家，妈的差点哭了。小学的时候，也有个同学，一起画sb漫画给对方看，好像是上辈子认识的人了。致敬两波海贼王，一波是jump的杂志上画的，一波是藤野的顶上战争大将坐姿。上影节60块钱买58分钟，我40块钱买75分钟，此我一胜，电影院不等花絮提前开灯，理论后给了我一瓶可乐和一杯虾片，我赢两次。
居无间,2024-11-01 15:41:50,上海,4星,5,在极简的故事里填充极富动感的画面与充沛的情感。非常好哭。
安德烈大叔,2024-10-27 14:12:22,北京,2星,41,内容还行，但无耻的中国版标注的片长太虚假了，有欺骗普通影迷的嫌疑，不推荐看。电影实际片长50分钟，标注75分钟是中国版本为了撑住时长，硬是在结尾加了25分钟无聊的创作者访谈。
大流士,2024-10-13 05:33:33,美国,1星,191,映后导演采访我根本懒得看，女主什么三观，凭什么别人为了你的梦想牺牲，意外去世后你还要虚伪自责，不论哪个版本里的你，都很自以为是。
