用户名,评论时间,IP属地,评论分数,有用数量,短评内容
粟熙,2008-11-21 12:41:29,,4星,5221,赞誉众口一致夸上了天，百闻不如一见，这种连环画超级英雄故事居然能扯到第六集真是要把编剧逼跳楼了，最后呈现的暗夜骑士全然超越了原著，悲怆到迷人的境界，着实是个奇迹。剧本确实很卓越，导演确实很出色，还有演技真是不得不叹服一下太tmd震撼
bayer04,2008-08-29 22:07:30,,5星,19811,诺兰接手后蝙蝠侠和其它漫画英雄片完全不是一个等级了
根,2017-08-28 22:47:39,,4星,3673,一直在搜索“为什么还有人想住在哥谭市”
飞刀员外,2009-07-07 23:07:40,,3星,797,没感觉出彩在哪……
Lan~die,2008-09-05 00:00:06,,5星,11180,蝙蝠侠、双面人和小丑这三个形象把人在善恶两面的矛盾及选择映射得淋漓尽致，于是成就了史上最佳漫画和英雄电影。时光网：“诺兰让关于艺术片和商业片的讨论变得毫无价值。《黑暗骑士》不但拍出了古典悲剧的感觉，还探讨了恐怖主义、越界权力等美国当代的热点话题。最关键的是，电影好看得无懈可击。”
fishlee,2009-07-28 10:21:42,,5星,7969,大片中很有内涵的一部，不管是人们心中暗自涌动的对小丑疯狂灭世主义的不安的共鸣，还是对蝙蝠侠孤独暗夜行走的英雄惜英雄般同情，其实都是人们对这个世界失望的一种情绪释放。其实小丑说的很对，他和蝙蝠侠很像，都是异类，只不过蝙蝠侠把痛苦留给自己，顽固地去坚守一丝信仰，而小丑把痛苦还给世界。
丁一,2019-09-11 09:52:37,,3星,146,看短评区，好像进了个夸夸群~
evonne||芝士命,2009-05-16 11:12:11,,5星,6948,好到一秒钟都不曾浪费
五色全味,2008-12-02 00:05:09,,4星,3407,诺兰的叙事能力不但在于结构上。。他总有一个与众不同的主题
苏仁,2012-05-08 19:36:09,,4星,645,剧情很诱人，总体很赞。不过，坏人的形象太完美而不真实，在智商情商上都是超一流，远胜主角。漏洞太多，哪有那么快就能搞到详尽的内幕信息？哪有说请了一帮小匪徒却跟受过严格训练的军人一样恪尽职守按时按点执行计划没有分毫不到位的？要搬运大量的汽油桶这种事怎么能在不引起官方注意的情况下实现？
伍德与夏洛蒂,2011-02-27 00:31:25,,4星,642,本来想给5星，但看的我累死了，4星，三颗都给希斯莱杰，剩下一星给累的半死的诺兰
圆首的秘书,2016-08-25 11:20:25,,4星,318,整部片子因为希斯·莱杰的死而高度过誉，而且真心没觉得希斯·莱杰的表演有多好。小丑这个角色本身并没有什么发挥余地，作为一个反派心理还是太单薄了些，什么表演也撑不起来。编剧其实比较大条，关于善恶的讨论还到不了哲学层次，关于行善行恶的手段、转化、对比，比这个好的一箩筐。
云倾,2008-09-10 11:56:30,,5星,6164,小丑把该说的不该说的都说了 蝙蝠侠把该做的不该做的都做了 生命在于抉择 英雄的时代已经逝去了
穆玉修,2008-10-17 18:46:13,,5星,5960,Christopher Nolan太厉害了，好莱坞漫画类型片居然能拍到这样的高度...
亚比煞,2012-08-31 22:06:22,,4星,395,希斯莱杰真是戏疯子。
小M,2008-09-29 21:32:44,,5星,5675,光明与黑暗是同一个人的两张脸
Jin,2008-09-15 12:48:37,,5星,4098,对于这么优秀的电影来说，再多的赞美都是多余的。
奇爱小姐,2008-08-17 23:01:37,,2星,1100,整部片子，逻辑混乱，剪辑无序，故事情节夸张。看完我只记得那个犯人把炸弹控制器扔入船外那一个片断。
胤祥,2012-07-22 21:17:00,,4星,139,这片儿不提最佳影片合情合理啊！Maggie Gyllenhaal不适合这个角色。小丑的戏还算不错。可是木有心理剪辑还能叫诺兰么？吐槽中国到这个程度，无怪不能引进。
影志,2008-12-14 15:32:12,,5星,2675,“有些人并不喜欢那些常人偏爱的东西，比如金钱，他们不被收买、不会被恐吓、不可理喻、更不接受谈判，有些人就想看人间地狱。” 也只有蝙蝠侠，才能让小丑变得完整。无尽的黑暗。
荔枝超人,2008-11-29 16:36:15,,5星,2403,Batman是最不漫画的漫画英雄，也正因为这一点，使之最有可能成为跨越犯罪剧情片和漫画英雄片界限的特例。而这一次，编导精准的抓到了这一点，把这部电影打造得丰富严谨又酷劲十足，无论是满足视听还是人性复杂层面的挖掘上都做到了堪称完美！
M,2008-09-23 11:11:54,,5星,1978,绝对是杰作，大陆上不了院线在广电的耻辱柱上划了浓墨重彩的一笔～
沉歌,2014-06-10 14:32:04,,4星,171,即使这是我最讨厌的电影类型，也必须赞叹一句导演技法的纯熟，完成度之高。这已经不是普通的超级英雄电影了。
陀螺凡达可,2011-12-28 05:13:50,,5星,1992,从此无人再敢挑战漫画英雄电影的巅峰，包括诺兰本人
illusion不忘记,2008-09-10 15:35:09,,5星,2109,当之无愧最出色的商业电影！
朝暮雪,2012-08-18 00:59:42,,5星,1348,在哥谭市的暗夜穹顶之下，总有一袭黑色披风在血色月光中翻涌。当流言如毒藤般缠绕正义的脊梁，当阴谋化作铅云笼罩道德的天平，这个孤独的骑士依然用染血的指节紧攥着永不熄灭的信念火种。世人将镣铐般的道德枷锁套在他伤痕累累的脖颈，却看不见他折断的肋骨下跳动着怎样炽热的赤子之心。从放下权杖到重披战甲，从寄望他人到孤身赴战，这段淬炼之路让布鲁斯·韦恩完成了从殉道者到救赎者的涅槃。诺兰的镜头语言撕开超级英雄的华丽外衣，让我们看见在钛合金装甲之下，那个永远在人性天平上挣扎的、流淌着滚烫鲜血的灵魂。当最后一片硝烟散去，世人终将明白：哥谭需要的不是完美无瑕的圣人，而是那个甘愿堕入黑暗却始终仰望星空的守夜人。他用伤痕累累的身躯编织成网，接住这个不断下坠的世界——这或许就是当代神话最震撼的注脚。
浮生若梦,2009-01-27 22:23:16,,5星,642,08年最好的一部片子。
眠去,2008-11-15 16:42:13,,5星,438,惊见越狱FBI。。。诺兰我爱你！莱杰我爱你！小丑我更爱你！！！
文泽尔,2012-08-28 14:49:40,,5星,399,补记：都说三部里面第二部最佳 细想确实如此 毕竟忍者大师和贝恩都有人间羁绊 固定指向的动机 是不可能与小丑那种纯粹的恶相提并论的 另一方面 一三两部的反派在肉搏武功上 同出一门 各较长短 而小丑则完全是凭着超群智力和疯狂 将蝙蝠压制得服服帖帖 黑化一人残杀一人 最终令蝙蝠自我放逐八年 难超越
小肚子✨,2008-11-16 22:34:49,,3星,162,哪有那么好看啊
LORENZO 洛伦佐,2010-05-04 05:58:45,,3星,100,我觉得没那么好看
zero,2009-08-13 13:40:59,,5星,465,这是蝙蝠侠电影系列中的巅峰之作，无与伦比。无可否认，无论是希斯莱杰的重低音假声“Why so serious？！”还是克里斯蒂安诺兰的“Why you want to kill me！”，每个演员的表现都很到位。黑暗，矛盾，残忍，混乱，人性的阴暗面。。。我们每个人都是小丑。。。
同志亦凡人中文站,2020-08-01 13:14:45,,5星,206,以后还会看很多诺兰电影，但这是第一次也是最后一次在IMAX银幕上看到希斯·莱杰。罪恶从未如此华丽。
叶扬 | 独眼,2009-02-08 17:44:01,,3星,143,对情感的描写太泛泛，而动作镜头也没有那么精彩。小丑确实是其中演得最好的了。
巽,2008-12-11 00:13:51,,2星,607,我明白为什么会一而再再而三的看睡着而不喜欢这个系列了：丫一边想要玩阴暗绝望一边又把态度端着，唧唧歪歪整个一事儿妈~
Vamei,2012-11-25 16:11:23,,4星,81,韦恩如何能在这个世界的疯狂中保持一颗蝙蝠侠的心呢？这对于我来说是个未解之谜。地区检查官尽管不幸，但和韦恩比差远了。可不可以把韦恩也理解为小丑那样的偏执狂呢？
bamboo,2017-01-01 12:14:13,,5星,330,甩普通英雄片一个宇宙
流浪达摩,2009-05-23 23:48:46,,5星,452,每隔十年都会出一部票房口碑双丰收的大作。十年前的《泰坦尼克》，08年的《黑暗骑士》。
曼仔,2022-06-18 11:49:59,,3星,52,时隔四年重看这部，希斯莱杰确实是真正的天赋型体验派；但诺兰确实不懂人。诺兰对“人”的解读是模式化且抽象化的，只能隔着距离去想象大众的善恶，呈现粗糙的“普遍人性”，一旦涉及个体幽微复杂的心理性情，除非演员天才，否则人物的工具感和匠气感非常明显。结尾蝙蝠侠自污名节深藏功与名的设置简直给我看笑了，能说什么，这种“清者自清是于无声处对无人的承诺”式的自怜审美真是跨越中外，鹤唳华亭、庆熹纪事、琅琊榜里的男主角，每一个都在做出一模一样的沉浸式自怜，以自污来自我升华。想象中的孤胆英雄铁肩担道义吗？只怕“载不动许多愁”。
原来是西门大嫂,2008-10-14 05:03:58,,5星,245,诺兰的贝尔牌蝙蝠侠最牛逼之处在于塑造了一个无超能的苦行僧式黑暗英雄。贯穿的主题是：一个人如何克服内心的恐惧和恶（前传中建立了他对世界不信任的根源，如何痛苦的克服它并选择用善对待世界。）所谓正义是相较于世人定义的丑恶暴力才会存在的，而选择哪一种方式对待世界才是对的？于是小丑出现了
小老鼠,2008-09-06 08:49:31,,4星,100,也没牛逼到那种地步，剧情不少牵强之处，整体气氛确实强悍
张小北,2008-10-23 00:02:51,,5星,201,我在巴黎和中国电影资料馆一共看了三遍胶片拷贝放映。可惜没能看成IMAX版。
思郁,2008-09-05 04:46:09,,5星,360,这一部太黑暗了，但精彩无以复加
同人于野,2008-09-12 07:25:20,,5星,290,看的时候感觉非常压抑。我不知道他们是怎么拍出这种压抑感的，但是整个电影无疑代表了电影技术和艺术的最新水平。
水木丁,2017-10-13 10:05:53,,5星,151,快十年过去，终于敢看这部片子了，但是他一出场，还是忍不住落泪啊……
奇爱博士,2012-08-03 22:36:04,,5星,141,伟大、通俗又深刻的商业殿堂级佳作。【电影资料馆】
猎户星座,2022-03-18 23:29:20,,5星,100,与其花钱看新蝙蝠侠，不如重温黑暗骑士
Kaito,2008-09-05 23:31:39,,5星,82,tim burton的batman是带着他诡异的幽默感的东西；而nolan的batman则是让人感觉满满，持续移动联通着的快感。
米粒,2009-07-20 22:05:09,,5星,167,史诗
西楼尘,2013-08-21 22:54:15,,5星,106,最棒的一部超级英雄的电影，带着看无脑片的心情看到了诺兰的惊喜。隐喻影射着我们的社会，好电影就是能把现实生活的不完美巧妙告诉你。
掉线,2016-05-30 03:46:06,,5星,87,【A-】四年后重看感觉好多了，但依旧不是心中神作。诺兰太聪明，能够如此精确的抓住观众的情节期望并推翻，最出色的还是在漫画英雄类型片里达到了前所未有的主题高度。和剧本相比其他就显得逊色了，过于依赖非线性剪辑显示了导演单场景调度能力不足，以及部分动作场面真的满难看
大島,2018-11-12 08:39:33,,4星,67,可贵的是他不是超级英雄，而是人类的极限，阐述的不是正义，而是人性。
杨迪,2009-12-17 01:26:12,,5星,63,一直知道它是部神作，2009看这部片子是怎样的我居然只打了三颗星。2020年再次重温，直接超五星好评。小丑的癫狂，蝙蝠侠的隐忍，双面人的沉沦，庆幸我再次看了一遍。
Over5,2008-12-23 00:16:22,,5星,151,人的恶念就像地心引力，只需轻轻推上一把～大片儿且有品
yyb,2017-02-26 22:08:20,,5星,75,补了一年美漫再回来看黑暗骑士，终于明白经典为什么是常看常新。没有读过蝙蝠侠，你无法理解蝙蝠侠不杀原则，没有读过小丑和致命玩笑，你不明白蝙蝠侠和小丑是一枚硬币的两面。这部电影有巨大的背景门槛（诺兰对于蝙蝠侠和小丑的理解令人惊叹），条目下的长短评论基本是瞎扯，大多只浮于表面
猛汉世雄,2010-05-14 16:17:23,,4星,41,太喜欢小丑了
Alan Sleep,2010-02-19 22:04:35,,5星,54,The hero we deserve.
林愈静,2011-10-18 10:11:22,,3星,98,2011-10-15 诺兰硬是把一部动作片搞的很哲学，so，有点失败。
菲利普,2011-11-14 17:19:44,,4星,30,我觉得没有第一部好，第一部比较从容。这部想表达许多东西，反而乱了手脚。
南笙,2013-02-01 18:22:19,,5星,83,挚爱希斯莱杰，永远的小丑，无人可超越。癫狂的演技，已分不清那是戏还是人
欢乐分裂,2013-08-31 15:34:08,,4星,29,三部曲2>1>3，此片最富戏剧冲突，对人性的拷问也最具深度，也可以预测其没落的征兆，因此即使在没看过之前两部的情况下，依然能感受到第三部的无力和无奈，不过再回过头去看，也理解了其中的悲凉和力不从心；平行线非常漂亮，不过最完美的当数小丑，每个人心中不敢直面的阴影和恐惧。
何倩彤,2008-08-06 00:14:09,,5星,64,11-3-2009 6:30pm imax & 28-2-2009 6:30pm imax & 25-1-2009 6:30pm imax & 5-11-2008 5:50pm imax & 20-10-2008 9:40pm imax & 13-10-2008 9:40pm i
adakenndy,2015-06-11 11:36:12,,5星,47,蝙蝠侠版的铁血丹心！即便蝙蝠侠真的没有了抵抗能力，任他宰割时，他会放弃。或者，他会杀掉这个蝙蝠侠，然后再去找一个蝙蝠侠去杀。如果这个世界上只有一个蝙蝠侠的话，他会舍不得杀的。这不只是为了不断斗下去而活在“一个不那么无聊的世界”，也是他内心深处那个小男孩的一点微弱而坚定的呼声。
曾于里,2015-12-26 23:34:16,,5星,42,虽然是老套的超级英雄主题，但关于人性善与恶、正义与法律悖论的思考非常深刻
托尼·王大拿,2010-09-11 02:51:18,,5星,46,唏嘘感叹，泪流满面
冰红深蓝,2012-02-02 00:12:14,,5星,56,最好的漫画英雄电影之一。
我的苦難史30天30夜也講不完,2009-05-31 23:24:34,,5星,140,好过瘾啊要是可以在电影院看就更爽了
后天的雨,2016-11-21 21:12:41,,5星,36,作为诺兰吹贝尔颜粉必须给五星，很纯熟的商业片，除去商业片元素之外还有些能打动人心的部分
有心打扰,2010-04-19 12:29:25,,5星,39,1.简单粗暴的选择题；2.无与伦比的商业片，叙述节奏趋于完美；3.把恶意当成兴趣，把无差别残杀当成玩乐手段，那才是真正的恐怖，是人性里极致黑暗部分的表露。
大头绿豆,2020-08-26 11:04:02,,3星,58,如果仅仅作为不讲道理的无脑爽片来看，是非常过瘾、值得五星的。但诺兰显然不甘于此，非得逼着观众强行思考一些他自己也没弄明白的大道理，结果呈现出来的，变成一堆似是而非、经不起推敲的价值观。
宇宙无敌库里哥,2023-10-04 22:22:16,重庆,5星,30,神作的结局总是如此有张力，不论是《搏击俱乐部》还是《黑暗骑士》，都令人头皮发麻。小丑和蝙蝠侠各赢一半。当两艘游轮上的人们都没按下起爆按钮时，小丑输了；当哥谭最正义的检查官哈维堕落成杀人犯时，蝙蝠侠输了。哈维冒名顶替蝙蝠侠，蝙蝠侠顶替哈维罪名，这对照让神作气质侧漏。规则之中的正义使者戈登警官、情感线支柱瑞秋、雷厉风行的正义骑士哈维、金句频出的阿尔弗雷德管家、蝙蝠侠的阴暗面小丑，每一个配角都是构成这部神作不可或缺的齿轮。
和时间做朋友,2023-07-06 15:11:54,上海,5星,45,跟其他的超级英雄片相比，这部片子的立意真的是在next level。btw我很悲观，我一点都不相信两艘游轮上的选择在现实中会真的出现。
Eve|Classified,2010-01-01 21:43:50,,5星,46,要么跟随蝙蝠侠，要么向小丑倒戈。有一天我面对这个世界，突然间想要吐。
契阳,2022-06-08 11:44:31,,3星,52,我大概永远无法欣赏，英美的混乱美学。正直精英靠钱堆出来的科技变身暗夜骑士，以哲学理念包装行为偏好的小丑，微笑疤痕的来历，见一个人就换一个说法。。。。。警察市长法庭。民众。无法对任何一方共情。感觉像好几个道德困境选择题连缀起来的一篇作文说不出啥感觉，就是经不起仔细推敲。毕竟真空状态下的完美哲学难题，在漏洞百出的现实当中是不存在的没有人是掌控一切的出题者，各有自己的信息优势，在有明有暗的混沌当中朝各自的目标摸索，才更像我理解的世界。我看到的灰色的风格，跟创作者眼里黑白交织的织法太不一样了。大概真的是跟诺兰没有缘分吧6部片了，看到的都是背后那个有制造场面的才华、但真的让我很想劝他重新接受基础文科教育的偏执者
大耳朵图图_,2017-03-29 14:37:25,,5星,38,最强的人类——蝙蝠侠。虽然是超级英雄片儿，诺兰却把它拍出了人文气质，同类题材的真的会很难超越
YoyoRan,2008-10-30 23:18:14,,2星,234,很久没看过这么老套的商业电影了 　　从来不喜欢蝙蝠侠 小时候都没有喜欢过 　　这么肤浅的正义与邪恶的英雄主义 就是打架杀人外加噱头式的台词 　　用科技糊弄眼睛 没有任何意义
许季山,2014-08-04 11:14:14,,3星,45,看电影过程中一直困扰我的是小丑怎么完成诸多不可能的任务？他真是天仙下凡，只看到结果不解释过程。如果这个问题不解决的话，这电影的根基在哪呢？
Ocap,2014-04-28 23:02:19,,5星,60,启蒙我的电影重作之一。以最痛快的方式，直面黑暗，相信黑暗。
艾小柯,2008-07-21 11:11:49,,4星,25,小丑与电锯狂人之对比
汝就做吾的犬吧,2012-03-31 15:51:31,,5星,36,个人还是比较偏爱前传1，但是2里船上那段戏确实是蝙蝠侠系列所有真人翻拍电影的最高峰…很多人都喜欢这个版本的小丑和阿福，而我恰恰觉得这两个角色不尽如人意，不是演员演技不行的原因；Joker因为剧本和台词的关系狠辣有余但幽默不足，阿福则是因为演员太有气场故使老管家这个角色看起来太过强势…
征服者张袭,2017-07-06 00:41:24,,3星,30,★★★☆
把噗,2011-12-31 16:10:00,,5星,14,爽爆了！！！
X,2017-03-31 16:37:34,,5星,27,私以为蝙蝠侠是一众超级英雄电影里最有深度的一部，非常有讽刺意义
铲铲,2020-11-14 22:07:57,,3星,29,居然评这么高？只觉得很黑暗但是没啥特别的感觉，想拍人性但是可看性一般，差点睡着。不至于不至于。
杜若,2020-10-18 09:45:20,,2星,57,这部片子被严重高估，各种毫无逻辑。小丑是催眠大师吗？可以让那么多黑帮小弟不图钱、随时死跟随他？电影里警察智商为负数，各种蜜汁操作！警察每一次行动，都能被小丑安排自己人也是太扯了！入狱胖子身上的手机和两船的炸弹能没发现？还有检察官的黑化也是全无清理可言，居然放过了小丑，真是太扯了。这片子为了提高立意，各种不合逻辑，完全神化小丑，故事逻辑性为零。
UrthónaD'Mors,2012-09-02 08:34:25,,5星,25,其实我想说，小丑说的话多半是真理I try to show the schemers how pathetic their attempts to control things really are. its a funny world we live in
焚紙樓,2017-08-02 18:50:57,,5星,20,成功原因：諾蘭兄弟（10%）+法蘭克米勒（10%）+華納公司放手一搏的膽識（80%）
尚在影,2014-12-22 07:33:19,,5星,17,看过最多遍的电影！
请保持高冷,2017-01-14 15:49:18,,4星,22,在面对着这个有史以来最具针对性、最恶毒的对手时，“蝙蝠侠”却不得不从他的地下军械库里搬出每一件能够用得上的高科技武器，还得时刻纠结着为他曾经信仰的一切寻找答案。
mumudancing,2011-02-08 20:07:04,,5星,17,人性悖论
迷影网,2008-07-28 01:27:13,,5星,14,这是我见过的最好的漫画英雄电影，而Heath Ledger让电影更上一层楼……
私享史,2012-03-05 00:29:17,,5星,28,谢天谢地，Nolan在本片里没有采用非线性叙事，不变的是心理学元素的融入。我觉得这部电影不仅是秒杀了漫画题材，从黑暗内核的角度，星战系列或者《七宗罪》简直弱爆了。
皮革业,2008-09-21 17:29:15,,4星,16,又看了一遍，到后半段，还是会感觉累。觉得Christopher Nolan几乎被自己过于庞大的叙事吞噬掉似的。
熬夜季军,2018-02-02 16:08:30,,4星,30,最让人叫绝的就是两艘船上的人们做的选择，人性没有那么好，也绝没有那么坏。还是要说诺兰出品，必属精品，这不是简单的超级英雄片，还有对人性的探讨。
朝阳区陆依萍,2013-03-03 16:35:56,,未评分,31,看的我下巴快掉下来了。。。。
kiki,2012-03-17 21:29:04,,3星,45,这种类型的片子不适合我。如果不是为了尊重导演，差点看一半就退出了。就因为自己喜欢的人死了，立刻从光明骑士变成terminator了，难道就为了突出小丑智商1200么？好弱智的片子。
ꪔ̤̱,2024-03-25 23:03:55,河北,3星,36,你们到底是怎么看出这么多人生感悟的
717,2023-08-18 20:42:34,广东,3星,20,通篇过于上流，有些不适。唯独小丑形象深刻至极，三颗星都为希斯·莱杰，这部电影完全是他的个人solo，此外的部片无聊到可以随时停止播放。
易老邪,2010-04-19 19:17:26,,2星,58,重温，观感更差了，空洞、乏味、无聊、腻歪，恕我欣赏无能，再扣1星。
左胸上的吸盘,2021-07-01 20:45:04,,2星,16,蓝光重刷。这部的动作场面依旧非常差，不过构图、色调、配乐这些元素和上部有所区别，外景有些怪诞的空旷，配色浓郁，呈现出一种类似黑泽清的后工业时代奇观的质感。希斯·莱杰的小丑上线，他的演技在这里比较突出，19年的《小丑》的表演方式与性格设定都脱胎于此。女主换成吉伦哈尔姐姐，依旧没看点。剧情还是一泡污，无所顾忌的小丑抢尽风头，上一部完成自我确认的蝙蝠侠在这里又陷入了公义与民主的困境，像这种能力超群却自我迷失、原则清晰又遭大众反噬的形象，在DC作品里已经是臭大街的存在，而受小丑蛊惑的正义检察官相当于把上一部蝙蝠侠的主题又演了一遍，剧情主线是小丑反复胁迫而蝙蝠侠反复纠结，这一大堆啰嗦重复的内容令人难耐。这种剧情老套拖沓、制作廉价粗糙的东西却能获得市场成功是很难复写的，除非导演是诺兰这种自带死粉的且运气爆棚
