用户名,评论时间,IP属地,评论分数,有用数量,短评内容
东东的奇妙树洞,2025-01-18 03:26:56,重庆,4星,1,巴勒斯笔下的Lee其实是个很固执干瘪自欺到极致的人，queer在当时的双关意味恰好满足了lee抗拒酷儿身份却又暗自紧张兴奋的情绪。巴勒斯笔下的蜈蚣既有因玛雅文明和阿兹特克文明的历史影响而造就的危险性，也有毒到情深爱到骨髓后最魅惑最致命的性欲和爱欲。原著写得并不好，而电影前两部分也没拍好，五十年代酷儿集群团体内老年群体与年轻人接触时的胆战心惊和欲盖弥彰其实没太拍出来；毒和酒和性的融合做得不到位。从原著角度出发电影没拍lee和尤金的感情基调是很多的，可这是惊世骇俗的以大尺度非社会既定道德感著称的作者写的原著！！拍摄尺度会不会过于小了？not queer but disembodied，超自然幻想镜头语言太美，而南美丛林回归自然后酷儿们的肉体连结融合交织，证明城市异性恋规范性社会的规训最终都会是屁
YiQiao,2025-01-28 16:48:17,上海,2星,1,根据我对这位导演的了解来说 瓜达尼诺作品的海报往往会比他的影片本身好看（暴言//不知道为什么这部电影给我带来一种词不达意的观影体验 他们明明渴求爱却会选择用性来表述自己的需求 以各种途径来阐述但还是得不到自己想要的 好可怜//演员表演多少也有点差劲
沈精病,2025-01-21 13:42:58,浙江,2星,1,做为一个一直不太喜欢丹尼尔克雷格版007的人，看到他演gay还是看的挺欢乐的。只是看完了全片以后想和瓜导说，不是每部电影你都能拍成CMBYN啊，看到后面已经是需要给眼睛上眼药水的程度了，这么点事拍的如此兴师动众，加上叙事的分裂，情感的断裂，表达的破碎，真想请你吃块菠萝披萨！
Sour mayonnais,2025-02-07 09:52:25,四川,3星,2,正应了那句老话：为了这碟儿醋包了这顿饺子
起玄,2025-01-22 01:51:01,北京,2星,7,把大家喊出来就为了这点事呀.jpg
CharlesChou,2025-01-18 22:32:16,上海,2星,1,除了裸体我们一无所有
ballsirius,2024-12-12 09:32:01,美国,3星,4,同性，美男，热带，旅行，戏水，长镜头，瓜导就是在套CMBYN的公式，结果天时地利人和都不在，又乱又散，反而是第三幕超自然放飞后更有趣
宫唯明,2025-01-15 15:04:22,江苏,2星,1,该怎么说观看的感受呢。就像是深入一具美好的肉体，在梦幻般的炙热和潮湿中触及到潜意识的角落，但最后却又在短暂的迷乱中荡然无存。只能说不糟糕，就是处理有些粗暴
三疊紀,2025-02-02 06:01:32,西班牙,2星,0,很喜歡瓜導的美術風格，劇情真的有點冗長且乏味，影片從頭到尾貫穿的悲劇性讓人難受。。。
骤雨至,2025-01-15 20:42:45,江苏,2星,1,后四十分钟抽象的像导演嗑大了的幻觉。丹尼尔克雷格演技也太差了怎么能这么用力浮夸悬浮，想得奖的目的性明显的让人看不下去，难怪这些年连个提名都捞不着。
时以星,2025-01-16 02:51:45,广东,5星,7,年轻即是资本，就是权力本身，年轻可以漫不经心，任时间流淌，敞开去体验，经历。而越是衰败残颓，越渴求年轻美好，每凝望一次，都觉得越来越遥远，触不可及。只有致幻植物使我们曾有刻互融牵连不分。Guadagnino是70后将电影这门艺术真正当艺术来表达的艺术家。凌晨两点多看完万分疲惫，仿佛被掏空的是我。这漫长无尽的一夜，骤然猝逝的人生。我去冲个热水澡。回到现实中，发现编剧和《过往人生》导演宋是夫妇，原著作者是2月水瓶座，电影中年轻男子真就全程一张水瓶脸，看不出感情，完全抽离，探触不到他的心，惟有靠致幻植物于某刻听到他说，其实我不是queer。《Call me》因为有过很真切的情投意合，双向奔赴，因为“我”是少年，就算伤心失意也不堕落。但到了去年的《酷儿》，那一厢情愿的孤独感，太蚀骨。
touya,2025-01-30 23:37:33,北京,2星,0,Daniel表现得很卖力，Drew被拍得很美好，瓜导真的很会拍男人，但电影太抽象了我理解无能。
峰峰峰峰,2025-01-17 21:06:24,浙江,2星,1,南美寻药一段路，怀念过往一段情，肢臂交缠共衾眠，恰似响蛇梦魂绵
双晚,2025-01-26 02:12:31,上海,4星,4,B+. 看到很多人骂做作、空洞，可这不正是电影想描述的状态吗？塑料景观、流行金曲，乃至克雷格作秀般的表演，都是“酷儿”为自己精心建构的艳丽纸壳，直到有人像太阳一样闯入你的轨道，烧穿你的防线，留下一个巨大的窟窿，和内心再也挡不住的呼啸寒风。瓜导仍然敏锐地捕捉身体与感官的震颤，尤其第三幕的结尾，以血肉相融的方式，具像化了兼具激情与恐惧、引人靠近又惹人逃离的“亲密”，并用它亲手敲碎的终章，去终其一生哀悼它的消逝。符号的运用很直白，但我仍然被它赤裸的悲伤所刺痛了——那些关于衰老、虚无和爱而不得的永恒的诅咒。
水水,2025-01-27 13:27:45,北京,4星,0,好多地方有大卫·柯南伯格的《裸体午餐》的痕迹~~~
ChrisKirk,2025-01-15 10:43:13,四川,2星,3,酷儿影视圈也是有了自己的老登代表作。
Q影誌,2024-09-03 19:45:42,德国,1星,15,#venwzia81主竞赛 这个故事其实挺忧伤，可是被瓜达尼诺拍得出力不讨好，用135分钟证明考夫曼同样找灵花妙草的《改编剧本》有多天才。只有结尾2001和林奇的效果达到了，还是降维版的，其它时间，哇特啊油杜英？还我CMBYN和《本色》的瓜达尼诺😭 Daniel Craig不适合这个角色。p.s.第一次遇见把Nirvana用得这么俗气。
天马星,2025-01-24 16:46:48,广东,3星,0,爱上深柜比爱上直男更痛苦。
欧依熙,2025-01-16 19:21:29,山西,3星,0,太抽象了，感觉是导演嗑大了拍的
Fiona和平,2025-01-18 19:36:20,北京,4星,0,哎呀，一扫昨晚的阴霾，我看得直蹦迪，来来来来来来来来来来来来来十月里响春雷全国人民举金杯
酱桑,2025-01-15 21:08:08,广东,1星,2,【0】yue了。以酷儿之名的老男人味大电影。餐桌戏和所谓的“一见钟情”拍的一塌糊涂，餐桌戏吃饭，硬是不吃，让人抽烟讲废话，初次见面的拉丝用上恶心油腻的慢镜头，天旋地转。主题表就是把异性恋美化成酷儿就觉得本片很美丽，很有态度，那跟电影本质无关。不好好讲故事是对的，但主题变成一次老男人的自我寻找之旅就很恶心。用尽了所有拍GV的手段去诠释一段黏腻的爱情，到头来只得到了美丽的杂志切片。但凡真心实意拍Porn我都会敬瓜导三分，更加坚定了，《请以你的名字呼唤我》就是一次美丽的错误。看本片只得到了朱星钥的美丽而已，其他都想吐。
Xavia,2025-01-18 20:04:07,美国,4星,2,昏暗潮湿的迷幻记忆。老基对双性恋男的执着与痴迷。
华盛顿樱桃树,2025-01-15 12:13:49,北京,4星,1,太艺术了吧！如果说前面是小心翼翼的叙事，为全片的人物关系情感结构做下重要的铺垫，到第三章节导演才露出自己的真面目，还是语不惊人死不休的瓜导，还是用身体叙事抛弃语言逻辑的表达方式，由于第一章立得住，后面便可以自由飞翔了。其实一向不喜欢不说人话的电影，但艺术这件事还得是真艺术，真艺术骗不了人罢了，真艺术令人愉悦，真艺术令人魂飞魄散罢了。007奉献了生涯最高演技，德鲁贡献了全片的艺术精髓，身体。
木皆,2025-01-20 23:48:41,江苏,1星,3,Guadagnino往死胡同里走：上秒还在天旋地转缠绵，觉察下秒憋笑破功，萎得巨夸张。
开门见猫,2025-02-03 21:05:04,上海,4星,1,前半部和原著贴合度很高，丹叔看起来真的是既饱经风霜又堕落无邪，既沉迷其中又妄图摆脱，残破无望的灵魂、俄耳甫斯的神话。。。当然男二也非常值得一看。后半部自由发挥部分略癫狂，超现实的双人影像让人想到《占有者》但更爱欲交织，body horror吐进吐出的部分又很像《某种物质》。结尾太绝望，不仅仅是属于酷儿的绝望。
To Babylon,2025-02-04 01:17:24,上海,4星,1,评分6.2低得太过分了 这可能是瓜导目前作品探讨酷儿身份认同和困境之巅 需要一定的观影门槛 包括但不限于垮掉派文学改编、对巴勒斯生平的了解、片中多段超现实隐喻 如果抱着观看一个无伤大雅的爱情故事的心态看多半要失望了 尾声那段房间梦境太林奇了 服装设计是罗意威创意总监难怪这么时尚 disembodied是不是可以翻译成不以心为形役
傻乐的猫,2025-02-01 17:12:58,新加坡,4星,0,所以这次拍了部大卫林奇吗？爱而不得就是无限循环的莫比乌斯环？有点意思有点癫但是太多符号又有点做作。值得一看。
人土土,2025-02-01 22:34:14,山东,4星,0,开头是阴翳老年版cmbyn，但是越看越不对劲，逐渐变成嗑大了版魂断威尼斯。Luca瓜不愧是氛围营造大师，是很好的电影。但是这次的氛围比起每一次都诡异。不是每样东西都需要体验，看完真的有悟空之效果——我愿称之为21世纪风月宝鉴。好奇心会害死人，远离黄赌毒可以自己主宰的平凡生活才是平凡人的幸福归宿。同样是不切实际的梦我宁愿选择役所广司刷厕所的完美生活。
Akaashi,2025-01-06 02:16:21,西班牙,5星,8,没看过原著但是这就是巴勒斯给我的感觉。没觉得Daniel Craig表演浮夸，实际上让我联想到很多生活中真实遇到的人。片头出现Trent Reznor就知道音乐品质有保障。Nirvana用得确实是惊艳了一把。New Order出来我直接快哭了，不只是因为我多爱这首歌，也因为我爱这一幕的拍摄，Lee的脸上只有痛苦，很少在电影里看到这样对吸毒的描述。成瘾不是因为追求high恰恰是因为想要逃避永恒的痛苦。大卫林奇一般的梦境。yage不是telepathy是镜子。喜欢那段tripping中的choreography
停表错觉,2025-01-16 06:12:09,英国,1星,3,幸好没去电影院看，置景像环球影城，剧情是典同倒贴故事之horny老头遇上又当又立绿茶男。中间那段意识空间已经隐隐让人觉得不妙，后面果然有坨大的恭候多时。瓜导黔驴技穷的状态和男主饿急了的样子如出一辙。选Daniel Craig演这个男主，我看drug addict另有其人。
盲忙,2025-01-28 11:03:46,山西,3星,0,孤独是可耻的，无法对抗孤独更是可怜的，而把摆脱孤独寄托在别人身上，结果将注定是可悲的，早点认清现实让自己不需要任何人才是上策。其实是对男同志一堂很好的教育课，可惜的是剧本有些问题，主题被稀释太多。
SingLesinger,2025-01-21 19:04:09,北京,3星,0,does this gay experience deserve an epic bio-pic treatment? not really.
Pearciac,2025-01-13 04:49:34,法国,5星,8,心想上映也十几天了且这么“小众”，结果临时买票时已经几乎满场，坐在靠银幕的第二排看着透视变形的画面津津有味地看完了。远超预期。最不想看到的就是CMBYN那种自我阉割的crowd pleaser，而这部Queer极为忠于queer精神——真实、大胆、勇于表达。剧本探讨的其实是一个很本质的问题——欲望的终点在哪。在一个年轻漂亮的身体就是王道的世界里，Craig饰演的主角William Lee有幸得到了这样的身体，然而他还想要灵肉合一，想要和对方灵魂交融，于是开始疯狂赔钱倒贴，用钱不行，用性不行，日夜相处的旅行不行，最后求助于土著“神药”——而即使历经一番两人共同的极致精神体验后——还是不行。Starkey的角色永远一副人淡如菊的样子，然而他施舍的一点温存，都足以让对方记到死。多么可悲的一个故事。
鳐.,2024-12-20 20:58:33,广东,5星,18,国内评分这么低更让我觉得这是一部成功的酷儿电影！你们这群人类对normativity的追求啊（指指点点）
Cosine 万一,2025-01-15 02:12:57,广东,5星,2,从柔情到癫狂，既通俗又自我的、放飞的大胆的作品，贡献了一幕极其奇观性的惊艳视觉。他人即地狱，孤独无法超脱于欲望，水乳交融于彼此的亲密关系，穿越时空的自我爱慕。
疯批永不停歇,2025-01-14 18:57:11,上海,1星,4,没有内核的荷尔蒙。毫不诱人。
